"id","url","score","title","summary","venue","year","authors","citationCount","referenceCount","influentialCitationCount"
"d6d3604f369bb0415cbe814e43ca3131323b03e2","https://www.semanticscholar.org/paper/d6d3604f369bb0415cbe814e43ca3131323b03e2",6,"Otter: A Multi-Modal Model with In-Context Instruction Tuning","Otter, a multi-modal model based on OpenFlamingo (open-sourced version of DeepMind's Flamingo), trained on MIMIC-IT and showcasing improved instruction-following ability and in-context learning is introduced.","arXiv.org",2023,"Bo Li,Yuanhan Zhang,Liangyu Chen,Jinghao Wang,Jingkang Yang,Ziwei Liu",2,36,0
"570079bbdd8758dfe865097e05719313c9c1301a","https://www.semanticscholar.org/paper/570079bbdd8758dfe865097e05719313c9c1301a",5,"LLaMA-Adapter V2: Parameter-Efficient Visual Instruction Model","This work augments LLaMA-Adapter by unlocking more learnable parameters and proposes an early fusion strategy to feed visual tokens only into the early LLM layers, contributing to better visual knowledge incorporation and achieves strong multi-modal reasoning with only a small-scale image-text and instruction dataset.","arXiv.org",2023,"Peng Gao,Jiaming Han,Renrui Zhang,Ziyi Lin,Shijie Geng,Aojun Zhou,W. Zhang,Pan Lu,Conghui He,Xiangyu Yue,Hongsheng Li,Y. Qiao",7,77,0
"0ebc861f5478561f12941e6b48aad30574e996d8","https://www.semanticscholar.org/paper/0ebc861f5478561f12941e6b48aad30574e996d8",5,"Video ChatCaptioner: Towards Enriched Spatiotemporal Descriptions","This work introduces Video ChatCaptioner, an innovative approach for creating more comprehensive spatiotemporal video descriptions, specifically designed to select frames for posing video content-driven questions and shows promise as a method for enhancing video content.","arXiv.org",2023,"Jun Chen,Deyao Zhu,Kilichbek Haydarov,Xiang Li,Mohamed Elhoseiny",4,42,0
"e1ff32753e20e48b4b01e40b5e820254396e6e70","https://www.semanticscholar.org/paper/e1ff32753e20e48b4b01e40b5e820254396e6e70",5,"LMEye: An Interactive Perception Network for Large Language Models","Interactive Perception Network (IPN), aiming to achieve a LVLM by incorporating the image understanding capability into Large Language Models (LLMs), significantly improves the zero-shot performance of LVLMs on various multimodal tasks compared to previous methods.","arXiv.org",2023,"Yunxin Li,Baotian Hu,Xinyu Chen,Lin Ma,M. Zhang",0,48,0
"42a30dc5470f54ec249f25d3c31e05d7c376c8e3","https://www.semanticscholar.org/paper/42a30dc5470f54ec249f25d3c31e05d7c376c8e3",5,"VisionLLM: Large Language Model is also an Open-Ended Decoder for Vision-Centric Tasks","This work presents an LLM-based framework for vision-centric tasks, termed VisionLLM, which provides a unified perspective for vision and language tasks by treating images as a foreign language and aligning vision-focused tasks with language tasks that can be flexibly defined and managed using language instructions.","arXiv.org",2023,"Wen Wang,Zhe Chen,Xiaokang Chen,Jiannan Wu,Xizhou Zhu,Gang Zeng,Ping Luo,Tong Lu,Jie Zhou,Y. Qiao,Jifeng Dai",3,78,0
"7e32aac43e9f1df49e116add03327ee6f365dbf3","https://www.semanticscholar.org/paper/7e32aac43e9f1df49e116add03327ee6f365dbf3",4,"mPLUG-Owl: Modularization Empowers Large Language Models with Multimodality",,"arXiv.org",2023,"Qinghao Ye,Haiyang Xu,Guohai Xu,Jiabo Ye,Ming Yan,Yi Zhou,Junyan Wang,Anwen Hu,Pengcheng Shi,Yaya Shi,Chenliang Li,Yuanhong Xu,Hehong Chen,Junfeng Tian,Qiang Qi,J. Zhang,Feiyan Huang",12,32,2
"ca45c746b69fdba8e73c1872937b4f054c6c4cc1","https://www.semanticscholar.org/paper/ca45c746b69fdba8e73c1872937b4f054c6c4cc1",4,"InternGPT: Solving Vision-Centric Tasks by Interacting with Chatbots Beyond Language","By incorporating pointing instructions, the proposed iGPT significantly improves the efficiency of communication between users and chatbots, as well as the accuracy of chatbots in vision-centric tasks, especially in complicated visual scenarios where the number of objects is greater than 2.","arXiv.org",2023,"Zhaoyang Liu,Yinan He,Wenhai Wang,Weiyun Wang,Yi Wang,Shoufa Chen,Qing-Long Zhang,Yang Yang,Qingyun Li,Jiashuo Yu,Kunchang Li,Zhe Chen,Xuecheng Yang,Xizhou Zhu,Yali Wang,Limin Wang,Ping Luo,Jifeng Dai,Yu Qiao",5,79,0
"d48cb91b9e555194f7494c4d4bb9815021d3ee45","https://www.semanticscholar.org/paper/d48cb91b9e555194f7494c4d4bb9815021d3ee45",4,"VideoChat: Chat-Centric Video Understanding","VideoChat is introduced, an end-to-end chat-centric video understanding system that integrates video foundation models and large language models via a learnable neural interface, excelling in spatiotemporal reasoning, event localization, and causal relationship inference.","arXiv.org",2023,"Kunchang Li,Yinan He,Yi Wang,Yizhuo Li,Wen Wang,Ping Luo,Yali Wang,Limin Wang,Yu Qiao",6,59,0
"4194149154f68dd7b1dc60f51bff2ca68448345a","https://www.semanticscholar.org/paper/4194149154f68dd7b1dc60f51bff2ca68448345a",4,"PMC-VQA: Visual Instruction Tuning for Medical Visual Question Answering","This paper proposes a generative-based model for medical visual understanding by aligning visual information from a pre-trained vision encoder with a large language model, and establishes a scalable pipeline to construct a large-scale medical visual question-answering dataset.","arXiv.org",2023,"Xiaoman Zhang,Chaoyi Wu,Ziheng Zhao,Weixiong Lin,Ya Zhang,Yanfeng Wang,Weidi Xie",0,38,0
"a3711dbf296b5ddd97ba93826660cd3995611625","https://www.semanticscholar.org/paper/a3711dbf296b5ddd97ba93826660cd3995611625",3,"Towards A Foundation Model for Generalist Robots: Diverse Skill Learning at Scale via Automated Task and Scene Generation","This document presents a specific idea for mining knowledge in the latest large-scale foundation models for robotics research, and advocates for using them to generate diversified tasks and scenes at scale, thereby scaling up low-level skill learning and ultimately leading to a foundation model for robotics that empowers generalist robots.","arXiv.org",2023,"Zhou Xian,Théophile Gervet,Zhenjia Xu,Yi-Ling Qiao,Tsun-Hsuan Wang",0,111,0
"f500523b8362ad8f838da14ff0a2498d0143cd1e","https://www.semanticscholar.org/paper/f500523b8362ad8f838da14ff0a2498d0143cd1e",3,"Reasoning with Language Model Prompting: A Survey","This paper provides a comprehensive survey of cutting-edge research on reasoning with language model prompting with comparisons and summaries and provides systematic resources to help beginners.","arXiv.org",2022,"Shuofei Qiao,Yixin Ou,Ningyu Zhang,Xiang Chen,Yunzhi Yao,Shumin Deng,Chuanqi Tan,Fei Huang,Huajun Chen",30,198,1
"170c97c7215f42edfb20c2248f954879e91ef86e","https://www.semanticscholar.org/paper/170c97c7215f42edfb20c2248f954879e91ef86e",3,"Chameleon: Plug-and-Play Compositional Reasoning with Large Language Models","This paper presents Chameleon, an AI system that mitigates LLM limitations by augmenting LLMs with plug-and-play modules for compositional reasoning, and shows that the GPT-4-powered planner exhibits more consistent and rational tool selection via inferring potential constraints from instructions, compared to a ChatGPT- powered planner.","arXiv.org",2023,"Pan Lu,Baolin Peng,Hao Cheng,Michel Galley,Kai-Wei Chang,Y. Wu,Song-Chun Zhu,Jianfeng Gao",22,65,3
"1a8eb2cae1833df3bf12fe3b41b03d60b4a4a98d","https://www.semanticscholar.org/paper/1a8eb2cae1833df3bf12fe3b41b03d60b4a4a98d",3,"Visual Instruction Tuning","This paper presents LLaVA: Large Language and Vision Assistant, an end-to-end trained large multimodal model that connects a vision encoder and LLM for general-purpose visual and language understanding and introduces GPT-4 generated visual instruction tuning data, the model and code base publicly available.","arXiv.org",2023,"Haotian Liu,Chunyuan Li,Qingyang Wu,Yong Jae Lee",34,55,18
"43e6e8d6663d83f1b74cf5a2be7b040b0928f867","https://www.semanticscholar.org/paper/43e6e8d6663d83f1b74cf5a2be7b040b0928f867",3,"X-LLM: Bootstrapping Advanced Large Language Models by Treating Multi-Modalities as Foreign Languages","X-LLM is proposed, which converts Multi-modalities into foreign languages using X2L interfaces and inputs them into a large Language model (ChatGLM), and demonstrates impressive multimodel chat abilities.","arXiv.org",2023,"Feilong Chen,Minglun Han,Haozhi Zhao,Qingyang Zhang,Jing Shi,Shuang Xu,Bo Xu",2,61,0
"6a5525c316b9be7909c433a79e090ed731425083","https://www.semanticscholar.org/paper/6a5525c316b9be7909c433a79e090ed731425083",3,"What Makes for Good Visual Tokenizers for Large Language Models?","A new MLLM equipped with a tailored Good Visual Tokenizer (GVT), which exhibits strong visual comprehension capability at multiple scales, without introducing extra parameters and task-specific fine-tuning.","arXiv.org",2023,"Guangzhi Wang,Yixiao Ge,Xiaohan Ding,Mohan S. Kankanhalli,Ying Shan",0,54,0
"ca055cfb9d4d47124cc035c346f38577825fcacf","https://www.semanticscholar.org/paper/ca055cfb9d4d47124cc035c346f38577825fcacf",3,"Enhance Reasoning Ability of Visual-Language Models via Large Language Models","A method called TReE is proposed, which transfers the reasoning ability of a large language model to a visual language model in zero-shot scenarios, and contains three stages: observation, thinking, and re-thinking.","arXiv.org",2023,"Yueting Yang,Xintong Zhang,Wenjuan Han",0,35,0
"9a22b33b529484c912d1ea9f8698369d4546a1c1","https://www.semanticscholar.org/paper/9a22b33b529484c912d1ea9f8698369d4546a1c1",3,"Transfer Visual Prompt Generator across LLMs","This work investigates the VPG transferability across LLMs, and designs a two-stage transfer framework named VPGTrans, which is simple yet highly effective and demonstrated to significantly speed up the transfer learning process without compromising performance.","arXiv.org",2023,"Ao Zhang,Hao Fei,Yuan Yao,Wei Ji,Li Li,Zhiyuan Liu,Tat-Seng Chua",2,34,0
"280b7d7e3ed4c069cc974a70780f88041cbf0717","https://www.semanticscholar.org/paper/280b7d7e3ed4c069cc974a70780f88041cbf0717",3,"Paxion: Patching Action Knowledge in Video-Language Foundation Models","This work proposes a novel framework, Paxion, along with a new Discriminative Video Dynamics Modeling (DVDM) objective, which effectively fills the gap in action knowledge understanding, while maintaining or improving performance on a wide spectrum of both object- and action-centric downstream tasks.","arXiv.org",2023,"Zhenhailong Wang,Ansel Blume,Sha Li,Genglin Liu,Jaemin Cho,Zineng Tang,Mohit Bansal,Heng Ji",0,62,0
"bfa9df38bd8597d8cdf0c3497fe5e5a5e31f646f","https://www.semanticscholar.org/paper/bfa9df38bd8597d8cdf0c3497fe5e5a5e31f646f",3,"ONE-PEACE: Exploring One General Representation Model Toward Unlimited Modalities","This work releases ONE-PEACE, a highly extensible model with 4B parameters that can seamlessly align and integrate representations across vision, audio, and language modalities, and develops two modality-agnostic pretraining tasks, which align the semantic space of different modalities and capture fine-grained details within modalities concurrently.","arXiv.org",2023,"Peng Wang,Shijie Wang,Junyang Lin,Shuai Bai,Xiaohuan Zhou,Jingren Zhou,Xinggang Wang,Chang Zhou",0,169,0
"6fe2a4f7594abadafc9feb05e96ab7e9e634ce8f","https://www.semanticscholar.org/paper/6fe2a4f7594abadafc9feb05e96ab7e9e634ce8f",3,"Album Storytelling with Iterative Story-aware Captioning and Large Language Models","This work proposes a new iterative album storytelling pipeline, which starts with an initial story and builds a story-aware caption model to refine the captions using the whole story as guidance, then feeds into the LLMs to generate a new refined story.","arXiv.org",2023,"Munan Ning,Yujia Xie,Dongdong Chen,Zeyin Song,Lu Yuan,Yonghong Tian,Qixiang Ye,Liuliang Yuan",0,57,0
"cb5f53cd7d43ac6f48abf4dde6fc58e53a083b0e","https://www.semanticscholar.org/paper/cb5f53cd7d43ac6f48abf4dde6fc58e53a083b0e",3,"Accelerating the integration of ChatGPT and other large‐scale AI models into biomedical research and healthcare","","MedComm – Future Medicine",2023,"Ding‐Qiao Wang,Long‐Yu Feng,Jin‐Guo Ye,Jin‐Gen Zou,Yingfeng Zheng",0,99,0
"e9480d62e216f77d5556b7eda769daa4c92d004d","https://www.semanticscholar.org/paper/e9480d62e216f77d5556b7eda769daa4c92d004d",3,"VQAMix: Conditional Triplet Mixup for Medical Visual Question Answering","This paper proposes a simple yet effective data augmentation method, VQAMix, which generates more labeled training samples by linearly combining a pair of VQA samples, which can be easily embedded into any visual-language model to boost performance.","IEEE Transactions on Medical Imaging",2022,"Haifan Gong,Guanqi Chen,Mingzhi Mao,Z. Li,Guanbin Li",7,55,3
"ac4d13b6a4f9fb67337099f4602135a0351f5c99","https://www.semanticscholar.org/paper/ac4d13b6a4f9fb67337099f4602135a0351f5c99",3,"Towards Medical Artificial General Intelligence via Knowledge-Enhanced Multimodal Pretraining","The proposed MOTOR successfully mimics the human practice of fulfilling a""medical student"" to accelerate the process of becoming a""specialist"" and believes that this work makes a significant stride in realizing MAGI.","arXiv.org",2023,"Bingqian Lin,Zicong Chen,Mingjie Li,Haokun Lin,Hang Xu,Yi Zhu,Jian-zhuo Liu,Wenjia Cai,Lei Yang,Shen Zhao,Chenfei Wu,Ling Chen,Xiaojun Chang,Yi Yang,L. Xing,Xiaodan Liang",0,60,0
"ac7771c332da42b29a913b116bd6ef622cbf89cf","https://www.semanticscholar.org/paper/ac7771c332da42b29a913b116bd6ef622cbf89cf",2,"TaskMatrix.AI: Completing Tasks by Connecting Foundation Models with Millions of APIs","The vision of how to build such an ecosystem is presented, each key component is explained, and study cases are used to illustrate both the feasibility of this vision and the main challenges the authors need to address next.","arXiv.org",2023,"Yaobo Liang,Chenfei Wu,Ting Song,Wenshan Wu,Yan Xia,Yu Liu,Yangyiwen Ou,Shuai Lu,Lei Ji,Shaoguang Mao,Yun Wang,Linjun Shou,Ming Gong,Nan Duan",22,27,1
"01f9b773408115a16fe872147348db175789e82f","https://www.semanticscholar.org/paper/01f9b773408115a16fe872147348db175789e82f",2,"Tool Learning with Foundation Models","A systematic investigation of tool learning is presented, including its cognitive origins, the paradigm shift of foundation models, and the complementary roles of tools and models to inspire future research in integrating tools with foundation models.","arXiv.org",2023,"Yujia Qin,Shengding Hu,Yankai Lin,Weize Chen,Ning Ding,Ganqu Cui,Zheni Zeng,Yufei Huang,Chaojun Xiao,Chi Han,Y. Fung,Yusheng Su,Huadong Wang,Cheng Qian,Runchu Tian,Kunlun Zhu,Shi Liang,Xingyu Shen,Bokai Xu,Zhen Zhang,Yining Ye,Bo Li,Ziwei Tang,Jing Yi,Yu Zhu,Zhenning Dai,Lan Yan,Xin Cong,Ya-Ting Lu,Weilin Zhao,Yuxiang Huang,Jun-Han Yan,Xu Han,Xian Sun,Dahai Li,Jason Phang,Cheng Yang,Tongshuang Wu,Heng Ji,Zhiyuan Liu,Maosong Sun",10,224,2
"2195676f111ad492c50f4d4c96abb2bd3d72f7fc","https://www.semanticscholar.org/paper/2195676f111ad492c50f4d4c96abb2bd3d72f7fc",2,"Instruct2Act: Mapping Multi-modality Instructions to Robotic Actions with Large Language Model","This paper presents Instruct2Act, a framework that utilizes Large Language Models to map multi-modal instructions to sequential actions for robotic manipulation tasks, employing the LLM model to generate Python programs that constitute a comprehensive perception, planning, and action loop for robotic tasks.","arXiv.org",2023,"Siyuan Huang,Zhengkai Jiang,Hao-Wen Dong,Y. Qiao,Peng Gao,Hongsheng Li",1,45,1
"13a5140fc0b269c408ecfc666cb297410bc753c5","https://www.semanticscholar.org/paper/13a5140fc0b269c408ecfc666cb297410bc753c5",2,"Matcher: Segment Anything with One Shot Using All-Purpose Feature Matching","This work presents Matcher, which segments anything with one shot by integrating an all-purpose feature extraction model and a class-agnostic segmentation model, and proposes a novel instance-level matching strategy for controllable mask merging.","arXiv.org",2023,"Yang Liu,Muzhi Zhu,Hengtao Li,Hao Chen,Xinlong Wang,Chunhua Shen",0,44,0
"d1120d67b700e4dfe8b39eb1e48fbdea4e1a0c43","https://www.semanticscholar.org/paper/d1120d67b700e4dfe8b39eb1e48fbdea4e1a0c43",2,"HuggingGPT: Solving AI Tasks with ChatGPT and its Friends in HuggingFace","HuggingGPT is a framework that leverages LLMs (e.g., ChatGPT) to connect various AI models in machine learning communities to solve AI tasks and is able to cover numerous sophisticated AI tasks in different modalities and domains and achieve impressive results in language, vision, speech, and other challenging tasks.","arXiv.org",2023,"Yongliang Shen,Kaitao Song,Xu Tan,D. Li,Weiming Lu,Y. Zhuang",60,39,10
"7562e25b666cba841b1dd5cf6e700978922beb04","https://www.semanticscholar.org/paper/7562e25b666cba841b1dd5cf6e700978922beb04",2,"SkinGPT: A Dermatology Diagnostic System with Vision Large Language Model","SkinGPT is the first dermatology diagnostic system that utilizes an advanced vision-based large language model, incorporating a fine-tuned version of MiniGPT-4 with a vast collection of in-house skin disease images, accompanied by doctor's notes.","arXiv.org",2023,"Juexiao Zhou,Xin Gao",0,35,0
"c56a51728678e5b2e3ff95e51caf21d267439c36","https://www.semanticscholar.org/paper/c56a51728678e5b2e3ff95e51caf21d267439c36",2,"ChatVideo: A Tracklet-centric Multimodal and Versatile Video Understanding System","The vision for multimodal and versatile video understanding is presented and a prototype system, built upon a tracklet-centric paradigm, which treats tracklets as the basic video unit and employs various Video Foundation Models to annotate their properties e.g., appearance, motion, etc.","arXiv.org",2023,"Junke Wang,Dongdong Chen,Chong Luo,Xiyang Dai,Lu Yuan,Zuxuan Wu,Yu-Gang Jiang",2,43,0
"8f95859cd6ccbe2c039fe8214f76c22382ebb9c3","https://www.semanticscholar.org/paper/8f95859cd6ccbe2c039fe8214f76c22382ebb9c3",2,"Caption Anything: Interactive Image Description with Diverse Multimodal Controls","Caption AnyThing (CAT) is presented, a foundation model augmented image captioning framework supporting a wide range of multimodel controls: 1) visual controls, including points, boxes, and trajectories; 2) language controls, such as sentiment, length, language, and factuality.","arXiv.org",2023,"Teng Wang,Jinrui Zhang,Junjie Fei,Yixiao Ge,Hao Zheng,Yun-Qiu Tang,Zhe Li,Mingqi Gao,Shanshan Zhao,Ying Shan,Feng Zheng",1,48,1
"80c44fab16852ea9599411da14de7079c4514172","https://www.semanticscholar.org/paper/80c44fab16852ea9599411da14de7079c4514172",2,"Vision-Language Models in Remote Sensing: Current Progress and Future Trends","A comprehensive review of the research on vision-language models in remote sensing, summarizing the latest progress, highlighting the current challenges, and identifying potential research opportunities is provided.","arXiv.org",2023,"Congcong Wen,Yuan Hu,Xiang Li,Zhenghang Yuan,Xiao Xiang Zhu",0,195,0
"affd5837492019cf252f4bf89afcda3708d2abac","https://www.semanticscholar.org/paper/affd5837492019cf252f4bf89afcda3708d2abac",2,"InstructBLIP: Towards General-purpose Vision-Language Models with Instruction Tuning","A systematic and comprehensive study on vision-language instruction tuning based on the pre-trained BLIP-2 models, which achieves state-of-the-art zero-shot performance across all 13 held-out datasets and qualitatively demonstrate the advantages of InstructBLIP over concurrent multimodal models.","arXiv.org",2023,"Wenliang Dai,Junnan Li,Dongxu Li,A. M. H. Tiong,Junqi Zhao,Weisheng Wang,Boyang Li,Pascale Fung,Steven Hoi",5,48,1
"59d0da2d295fe4761431b6b1fcc805ba0df1e172","https://www.semanticscholar.org/paper/59d0da2d295fe4761431b6b1fcc805ba0df1e172",2,"ArtGPT-4: Artistic Vision-Language Understanding with Adapter-enhanced MiniGPT-4","A novel multimodal model called ArtGPT-4 has been proposed to address some challenges in image understanding, particularly in artistic pictures, and novel benchmarks for evaluating the performance of vision-language models are proposed.","arXiv.org",2023,"Zheng Yuan,HU Xue,Xinyi Wang,Yongming Liu,Zhuanzhe Zhao,Kun Wang",0,41,0
"c8e41bde9c80b986bf981f54029db489ee0b7809","https://www.semanticscholar.org/paper/c8e41bde9c80b986bf981f54029db489ee0b7809",2,"On the Hidden Mystery of OCR in Large Multimodal Models","It is demonstrated that even the current most powerful large multimodal models cannot match domain-specific methods in traditional text tasks and face greater challenges in more complex tasks.","arXiv.org",2023,"Yuliang Liu,Zhang Li,Hongliang Li,Wenwen Yu,Mingxin Huang,Dezhi Peng,Mingyu Liu,Mingrui Chen,Chunyuan Li,Lianwen Jin,Xiang Bai",1,48,0
"3f0c4d50050e8d74993b020897abaee8d1e8054d","https://www.semanticscholar.org/paper/3f0c4d50050e8d74993b020897abaee8d1e8054d",2,"Evaluating Object Hallucination in Large Vision-Language Models","This work presents the first systematic study on object hallucination of LVLMs, and designs an improved evaluation method by proposing a polling-based query method called POPE, which can evaluate the object hallucinated objects in a more stable and flexible way.","arXiv.org",2023,"Yifan Li,Yifan Du,Kun Zhou,Jinpeng Wang,Wayne Xin Zhao,Ji-rong Wen",2,42,0
"a1f83d8507677ad0ff47ee44d0577fe086d4b01a","https://www.semanticscholar.org/paper/a1f83d8507677ad0ff47ee44d0577fe086d4b01a",2,"X-IQE: eXplainable Image Quality Evaluation for Text-to-Image Generation with Visual Large Language Models","A novel explainable image quality evaluation approach called X-IQE, which leverages visual large language models (LLMs) to evaluate text-to-image generation methods by generating textual explanations by utilizing a hierarchical Chain of Thought to enable MiniGPT-4 to produce self-consistent, unbiased texts that are highly correlated with human evaluation.","arXiv.org",2023,"Yixiong Chen",0,56,0
"1bdd5fc17cc580efe998304692639c57c857cc84","https://www.semanticscholar.org/paper/1bdd5fc17cc580efe998304692639c57c857cc84",2,"Going Denser with Open-Vocabulary Part Segmentation","A detector with the ability to predict both open-vocabulary objects and their part segmentation and training on the joint of part-level, object-level and image-level data to build the multi-granularity alignment between language and image.","arXiv.org",2023,"Pei Sun,Shoufa Chen,Chenchen Zhu,Fanyi Xiao,Ping Luo,Saining Xie,Zhicheng Yan",0,94,0
"33f9ddca2469bf4831dcab085e1620792b1a6a80","https://www.semanticscholar.org/paper/33f9ddca2469bf4831dcab085e1620792b1a6a80",2,"LLM Itself Can Read and Generate CXR Images","This work presents a novel method to fine-tune a pre-trained LLM to read and generate images like text without any structural changes, extra training objectives, or the need for training an ad-hoc network while still preserving the of the instruction-following capability of the LLM.","arXiv.org",2023,"Suhyeon Lee,Won Jun Kim,Jong-Chul Ye",0,49,0
"f9bfc6d9ba1665b73af3323d46c7642b852759ef","https://www.semanticscholar.org/paper/f9bfc6d9ba1665b73af3323d46c7642b852759ef",2,"VideoLLM: Modeling Video Sequence with Large Language Models","This work proposes a novel framework called VideoLLM that leverages the sequence reasoning capabilities of pre-trained LLMs from natural language processing (NLP) for video sequence understanding and demonstrates that the understanding and Reasoning capabilities of LLMs can be effectively transferred to video understanding tasks.","arXiv.org",2023,"Guo Chen,Yin-Dong Zheng,Jiahao Wang,Jilan Xu,Yifei Huang,Junting Pan,Yi Wang,Yali Wang,Y. Qiao,Tong Lu,Limin Wang",0,101,0
"43a55dbd95c9d5cd82de8db276f41adeec4a937d","https://www.semanticscholar.org/paper/43a55dbd95c9d5cd82de8db276f41adeec4a937d",2,"Interactive Data Synthesis for Systematic Vision Adaptation via LLMs-AIGCs Collaboration","This work extensively study how LLMs communicate with AIGC model to achieve more controllable image generation and makes the first attempt to collaborate them for automatic data augmentation for a variety of downstream tasks.","arXiv.org",2023,"Qifan Yu,Juncheng Li,Wentao Ye,Siliang Tang,Yueting Zhuang",0,37,0
"de8121dc3d2c69bdab172f37e31168ddf2e6e62f","https://www.semanticscholar.org/paper/de8121dc3d2c69bdab172f37e31168ddf2e6e62f",2,"Segment Everything Everywhere All at Once","SEEM is a promptable, interactive model for Segmenting Everything Everywhere all at once in an image by incorporating learnable memory prompts to retain dialog history information via mask-guided cross-attention.","arXiv.org",2023,"Xueyan Zou,Jianwei Yang,Hao Zhang,Feng Li,Linjie Li,Jianfeng Gao,Yong Jae Lee",14,65,5
"508d9b43832790b4d35f4ae1fa76e9712859d6aa","https://www.semanticscholar.org/paper/508d9b43832790b4d35f4ae1fa76e9712859d6aa",2,"Vision and Structured-Language Pretraining for Cross-Modal Food Retrieval","VLPCook outperforms current SoTA by a significant margin on the task of Cross-Modal Food Retrieval on the large Recipe1M dataset and validates the generalization of the approach to other tasks and domains with structured text such as the Medical domain on the ROCO dataset.","",2022,"Mustafa Shukor,Nicolas Thome,M. Cord",0,85,0
"1329484d20c470b84e46ed7453786cee0acad2e0","https://www.semanticscholar.org/paper/1329484d20c470b84e46ed7453786cee0acad2e0",2,"BLIP-2: Bootstrapping Language-Image Pre-training with Frozen Image Encoders and Large Language Models","BLIP-2 achieves state-of-the-art performance on various vision-language tasks, despite having significantly fewer trainable parameters than existing methods, and is demonstrated's emerging capabilities of zero-shot image-to-text generation that can follow natural language instructions.","arXiv.org",2023,"Junnan Li,Dongxu Li,S. Savarese,Steven Hoi",141,43,43
