"id","url","score","title","summary","venue","year","authors","citationCount","referenceCount","influentialCitationCount"
"584ca135b61482fd89247113da87d784f738dbfa","https://www.semanticscholar.org/paper/584ca135b61482fd89247113da87d784f738dbfa",7,"Foundational Models Defining a New Era in Vision: A Survey and Outlook","A comprehensive review of emerging foundational models in computer vision, including typical architecture designs to combine different modalities, training objectives, pre-training datasets, fine-tuning mechanisms, and the common prompting patterns; textual, visual, and heterogeneous.","arXiv.org",2023,"Muhammad Awais,Muzammal Naseer,Salman Siddique Khan,R. Anwer,Hisham Cholakkal,M. Shah,Ming Yang,F. Khan",8,365,2
"d6d3604f369bb0415cbe814e43ca3131323b03e2","https://www.semanticscholar.org/paper/d6d3604f369bb0415cbe814e43ca3131323b03e2",6,"Otter: A Multi-Modal Model with In-Context Instruction Tuning","Otter, a multi-modal model based on OpenFlamingo (open-sourced version of DeepMind's Flamingo), trained on MIMIC-IT and showcasing improved instruction-following ability and in-context learning is introduced.","arXiv.org",2023,"Bo Li,Yuanhan Zhang,Liangyu Chen,Jinghao Wang,Jingkang Yang,Ziwei Liu",87,38,17
"86cbd30d1096b0c7e4ac6b03d97a8df12fd21457","https://www.semanticscholar.org/paper/86cbd30d1096b0c7e4ac6b03d97a8df12fd21457",6,"PathAsst: Redefining Pathology through Generative Foundation AI Assistant for Pathology","The PathAsst is presented, which is a generative foundation AI assistant to revolutionize diagnostic and predictive analytics in pathology, trained based on Vicuna-13B language model in coordination with the CLIP vision encoder.","arXiv.org",2023,"Yuxuan Sun,Chenglu Zhu,S. Zheng,Kai Zhang,Zhongyi Shui,Xiaoxuan Yu,Yi-Lei Zhao,Honglin Li,Yunlong Zhang,Ruojia Zhao,Xinheng Lyu,Lin Yang",5,47,1
"4eb87eaa193929dbef93fa2db9419245a8e8916f","https://www.semanticscholar.org/paper/4eb87eaa193929dbef93fa2db9419245a8e8916f",6,"TextBind: Multi-turn Interleaved Multimodal Instruction-following in the Wild","This work introduces TextBind, an almost annotation-free framework for empowering larger language models with the multi-turn interleaved multimodal instruction-following capabilities, and devise MIM, a language model-centric architecture that seamlessly integrates image encoder and decoder models.","arXiv.org",2023,"Huayang Li,Siheng Li,Deng Cai,Longyue Wang,Lemao Liu,Taro Watanabe,Yujiu Yang,Shuming Shi",0,51,0
"570079bbdd8758dfe865097e05719313c9c1301a","https://www.semanticscholar.org/paper/570079bbdd8758dfe865097e05719313c9c1301a",5,"LLaMA-Adapter V2: Parameter-Efficient Visual Instruction Model","This work augments LLaMA-Adapter by unlocking more learnable parameters and proposes an early fusion strategy to feed visual tokens only into the early LLM layers, contributing to better visual knowledge incorporation and achieves strong multi-modal reasoning with only a small-scale image-text and instruction dataset.","arXiv.org",2023,"Peng Gao,Jiaming Han,Renrui Zhang,Ziyi Lin,Shijie Geng,Aojun Zhou,W. Zhang,Pan Lu,Conghui He,Xiangyu Yue,Hongsheng Li,Y. Qiao",92,79,12
"7cf64070fd3d7e53d80f260c10e6bd7018d580e1","https://www.semanticscholar.org/paper/7cf64070fd3d7e53d80f260c10e6bd7018d580e1",5,"IdealGPT: Iteratively Decomposing Vision and Language Reasoning via Large Language Models","The IdealGPT framework is presented, a framework that iteratively decomposes VL reasoning using large language models (LLMs) and outperforms the best existing GPT-4-like models by an absolute 10% on VCR and 15% on SNLI-VE.","arXiv.org",2023,"Haoxuan You,Rui Sun,Zhecan Wang,Long Chen,Gengyu Wang,Hammad A. Ayyubi,Kai-Wei Chang,Shih-Fu Chang",9,46,2
"f8f8267a2acd7598de6c15327f3953241901a62d","https://www.semanticscholar.org/paper/f8f8267a2acd7598de6c15327f3953241901a62d",5,"On Evaluating Adversarial Robustness of Large Vision-Language Models","Evaluating the robustness of open-source large VLMs in the most realistic and high-risk setting, where adversaries have only black-box system access and seek to deceive the model into returning the targeted responses is proposed.","arXiv.org",2023,"Yunqing Zhao,Tianyu Pang,Chao Du,Xiao Yang,Chongxuan Li,Ngai-Man Cheung,Min Lin",16,102,1
"fd755dc7b5b206c17fd953db04e1c888d45b6e4e","https://www.semanticscholar.org/paper/fd755dc7b5b206c17fd953db04e1c888d45b6e4e",5,"LAMM: Language-Assisted Multi-Modal Instruction-Tuning Dataset, Framework, and Benchmark","This work extends the research of MLLMs to point clouds and presents the LAMM-Dataset and LAMm-Benchmark for 2D image and 3D point cloud understanding and establishes an extensible framework to facilitate the extension of M LLMs to additional modalities.","arXiv.org",2023,"Zhen-fei Yin,Jiong Wang,Jianjian Cao,Zhelun Shi,Dingning Liu,Mukai Li,Lu Sheng,Lei Bai,Xiaoshui Huang,Zhiyong Wang,Wanli Ouyang,Jing Shao",19,99,6
"051549d8ef56937b2f4d113afdcf8c7586d3770b","https://www.semanticscholar.org/paper/051549d8ef56937b2f4d113afdcf8c7586d3770b",5,"Towards AGI in Computer Vision: Lessons Learned from GPT and Large Language Models","It is pointed out that the essential weakness of CV lies in lacking a paradigm to learn from environments, yet NLP has accomplished the task in the text world and is still far from a system like GPT that naturally integrates all tasks.","arXiv.org",2023,"Lingxi Xie,Longhui Wei,Xiaopeng Zhang,Kaifeng Bi,Xiaotao Gu,Jianlong Chang,Qi Tian",2,169,0
"966852963a88a28786b798c91b6662d6e501e590","https://www.semanticscholar.org/paper/966852963a88a28786b798c91b6662d6e501e590",5,"AssistGPT: A General Multi-modal Assistant that can Plan, Execute, Inspect, and Learn","A multi-modal AI assistant with an interleaved code and language reasoning approach called Plan, Execute, Inspect, and Learn (PEIL) to integrate LLMs with various tools, and a Learner is designed to enable the model to autonomously explore and discover the optimal solution.","arXiv.org",2023,"Difei Gao,Lei Ji,Luowei Zhou,Kevin Lin,Joya Chen,Zihan Fan,Mike Zheng Shou",8,73,0
"d6c2523ab97416c2692cbbeab082ed1790e8e55e","https://www.semanticscholar.org/paper/d6c2523ab97416c2692cbbeab082ed1790e8e55e",5,"VisIT-Bench: A Benchmark for Vision-Language Instruction Following Inspired by Real-World Use","This work introduces VisIT-Bench (Visual InsTruction Benchmark), a benchmark for evaluation of instruction-following vision-language models for real-world use, and curates 70 'instruction families' that it envision instruction tuned vision- language models should be able to address.","arXiv.org",2023,"Yonatan Bitton,Hritik Bansal,Jack Hessel,Rulin Shao,Wanrong Zhu,Anas Awadalla,Josh Gardner,Rohan Taori,L. Schimdt",4,98,0
"894ed1aba8e42a4ec27ba53ecde383b14c5128ca","https://www.semanticscholar.org/paper/894ed1aba8e42a4ec27ba53ecde383b14c5128ca",5,"Examining User-Friendly and Open-Sourced Large GPT Models: A Survey on Language, Multimodal, and Scientific GPT Models","This survey paper provides an examination of alternative open-sourced models of large GPTs, focusing on user-friendly and relatively small models that facilitate easier deployment and accessibility, and aims to equip researchers, practitioners, and enthusiasts with a thorough understanding of these models.","arXiv.org",2023,"Kaiyuan Gao,Su He,Zhenyu He,Jiacheng Lin,Qizhi Pei,Jie Shao,Wei Zhang",0,178,0
"f34b6b4f75fb4e6f2c5654ee13fb2479c6170b3a","https://www.semanticscholar.org/paper/f34b6b4f75fb4e6f2c5654ee13fb2479c6170b3a",5,"Kosmos-2.5: A Multimodal Literate Model","Kosmos-2.5 can be readily adapted for any text-intensive image understanding task with different prompts through supervised fine-tuning, making it a general-purpose tool for real-world applications involving text-rich images and paves the way for the future scaling of multimodal large language models.","arXiv.org",2023,"Tengchao Lv,Yupan Huang,Jingye Chen,Lei Cui,Shuming Ma,Ya-Chi Chang,Shaohan Huang,Wenhui Wang,Li Dong,Weiyao Luo,Shaoxiang Wu,Guoxin Wang,Cha Zhang,Furu Wei",0,85,0
"7b689adb8c156d6158660f90d1c86888ee281f63","https://www.semanticscholar.org/paper/7b689adb8c156d6158660f90d1c86888ee281f63",5,"DreamLLM: Synergistic Multimodal Comprehension and Creation","A learning framework that first achieves versatile Multimodal Large Language Models (MLLMs) empowered with frequently overlooked synergy between multimodal comprehension and creation, reaping from the enhanced learning synergy.","arXiv.org",2023,"Runpei Dong,Chunrui Han,Yuang Peng,Zekun Qi,Zheng Ge,Jinrong Yang,Liang Zhao,Jian‐Yuan Sun,Hongyu Zhou,Hao-Ran Wei,Xiangwen Kong,Xiangyu Zhang,Kaisheng Ma,Li Yi",4,169,0
"092245d86b77181c36f972b1b7a17a59cd989c4a","https://www.semanticscholar.org/paper/092245d86b77181c36f972b1b7a17a59cd989c4a",5,"Guiding Instruction-based Image Editing via Multimodal Large Language Models","This work investigates how MLLMs facilitate edit instructions and presents MLLM-Guided Image Editing (MGIE), which learns to derive expressive instructions and provides explicit guidance and can lead to a notable improvement in automatic metrics and human evaluation while maintaining competitive inference efficiency.","arXiv.org",2023,"Tsu-Jui Fu,Wenze Hu,Xianzhi Du,William Yang Wang,Yinfei Yang,Zhe Gan",0,63,0
"a710efa9247207a72f06e0c9db302fd3ecab5fbb","https://www.semanticscholar.org/paper/a710efa9247207a72f06e0c9db302fd3ecab5fbb",5,"Towards Robust Multi-Modal Reasoning via Model Selection","This framework improves model selection and bolsters the robustness of multi-modal agents in multi-step reasoning, and enables dynamic model selection, considering both user inputs and subtask dependencies, thereby robustifying the overall reasoning process.","",2023,"Xiangyan Liu,Rongxue Li,Wei Ji,Tao Lin",0,57,0
"0ebc861f5478561f12941e6b48aad30574e996d8","https://www.semanticscholar.org/paper/0ebc861f5478561f12941e6b48aad30574e996d8",5,"Video ChatCaptioner: Towards Enriched Spatiotemporal Descriptions","This work introduces Video ChatCaptioner, an innovative approach for creating more comprehensive spatiotemporal video descriptions, specifically designed to select frames for posing video content-driven questions and shows promise as a method for enhancing video content.","arXiv.org",2023,"Jun Chen,Deyao Zhu,Kilichbek Haydarov,Xiang Li,Mohamed Elhoseiny",9,44,0
"42a30dc5470f54ec249f25d3c31e05d7c376c8e3","https://www.semanticscholar.org/paper/42a30dc5470f54ec249f25d3c31e05d7c376c8e3",5,"VisionLLM: Large Language Model is also an Open-Ended Decoder for Vision-Centric Tasks","This work presents an LLM-based framework for vision-centric tasks, termed VisionLLM, which provides a unified perspective for vision and language tasks by treating images as a foreign language and aligning vision-focused tasks with language tasks that can be flexibly defined and managed using language instructions.","arXiv.org",2023,"Wen Wang,Zhe Chen,Xiaokang Chen,Jiannan Wu,Xizhou Zhu,Gang Zeng,Ping Luo,Tong Lu,Jie Zhou,Y. Qiao,Jifeng Dai",43,78,6
"833cdd713c27ab5899bb912a1d511c10af61cefb","https://www.semanticscholar.org/paper/833cdd713c27ab5899bb912a1d511c10af61cefb",5,"Making Multimodal Generation Easier: When Diffusion Models Meet LLMs","Efficient model designed to enhance multimodal understanding and generation by harnessing the capabilities of diffusion models and large language models, built upon a bidirectional conditional diffusion model named BiDiffuser, which promotes more efficient interactions between modalities.","",2023,"Xiangyu Zhao,Bo Liu,Qijiong Liu,Guangyuan Shi,Xiao-Ming Wu",0,58,0
"06091944b864d6dc473cab63321a95fb9c4067cc","https://www.semanticscholar.org/paper/06091944b864d6dc473cab63321a95fb9c4067cc",5,"ChatCAD+: Towards a Universal and Reliable Interactive CAD using LLMs","ChatCAD+, which is designed to be universal and reliable, is introduced, capable of handling medical images from diverse domains and leveraging up-to-date information from reputable medical websites to provide reliable medical advice.","arXiv.org",2023,"Zihao Zhao,Sheng Wang,Jinchen Gu,Yitao Zhu,Lanzhuju Mei,Zixu Zhuang,Zhiming Cui,Qian Wang,Dinggang Shen",5,51,0
"d47524cd5c3c4b57af2e5a29f6f91c420310f236","https://www.semanticscholar.org/paper/d47524cd5c3c4b57af2e5a29f6f91c420310f236",5,"MIMIC-IT: Multi-Modal In-Context Instruction Tuning","MultI-Modal In-Context Instruction Tuning (MIMIC-IT), a dataset comprising 2.8 million multimodal instruction-response pairs, with 2.2 million unique instructions derived from images and videos, is presented and a large VLM named Otter is trained.","arXiv.org",2023,"Bo Li,Yuanhan Zhang,Liangyu Chen,Jinghao Wang,Fanyi Pu,Jingkang Yang,C. Li,Ziwei Liu",36,55,5
"ad113d8b6f8f6dace7abd12dc88af520aaaf3fc7","https://www.semanticscholar.org/paper/ad113d8b6f8f6dace7abd12dc88af520aaaf3fc7",5,"LISA: Reasoning Segmentation via Large Language Model","This work proposes a new segmentation task -- reasoning segmentation, designed to output a segmentation mask given a complex and implicit query text, and presents LISA, which inherits the language generation capabilities of the multi-modal Large Language Model (LLM) while also possessing the ability to produce segmentation masks.","arXiv.org",2023,"Xin Lai,Zhuotao Tian,Yukang Chen,Yanwei Li,Yuhui Yuan,Shu Liu,Jiaya Jia",6,64,2
"ebedc4d7a2356090904baba4104ef0832bc236df","https://www.semanticscholar.org/paper/ebedc4d7a2356090904baba4104ef0832bc236df",5,"A Survey on Multimodal Large Language Models","This paper presents the formulation of MLLM and delineate its related concepts, and discusses the key techniques and applications, including Multimodal Instruction Tuning (M-IT), Multimmodal In-Context Learning (M -ICL), MultIModal Chain of Thought (m-CoT), and LLM-Aided Visual Reasoning (LAVR).","arXiv.org",2023,"Shukang Yin,Chaoyou Fu,Sirui Zhao,Ke Li,Xing Sun,Tong Xu,Enhong Chen",42,108,1
"c7492913370b5726eaa6ced163a60de6c9d4bb7f","https://www.semanticscholar.org/paper/c7492913370b5726eaa6ced163a60de6c9d4bb7f",5,"A Survey of Large Language Models for Healthcare: from Data, Technology, and Applications to Accountability and Ethics","It is contended that a significant paradigm shift is underway, transitioning from PLMs to LLMs, which encompasses a move from discriminative AI approaches to generativeAI approaches, as well as a shift from model-centered methodologies to datacentered methodologies.","",2023,"Kai He,Rui Mao,Qika Lin,Yucheng Ruan,Xiang Lan,Mengling Feng,Erik Cambria",0,377,0
"094883e42bb9a41f602c0715c1059bc431e33fb2","https://www.semanticscholar.org/paper/094883e42bb9a41f602c0715c1059bc431e33fb2",4,"GPT4RoI: Instruction Tuning Large Language Model on Region-of-Interest","Spatial instruction tuning is proposed, which introduces the reference to the region-of-interest (RoI) in the instruction, which achieves a remarkable accuracy of 81.6%, surpassing all existing models by a significant margin and almost reaching human-level performance of 85.0%.","arXiv.org",2023,"Shilong Zhang,Pei Sun,Shoufa Chen,Min Xiao,Wenqi Shao,Wenwei Zhang,Kai Chen,Ping Luo",13,98,2
"ca6a2bc279be5a3349a22bfd6866ed633d18734b","https://www.semanticscholar.org/paper/ca6a2bc279be5a3349a22bfd6866ed633d18734b",4,"MiniGPT-4: Enhancing Vision-Language Understanding with Advanced Large Language Models","MiniGPT-4 is presented, which aligns a frozen visual encoder with a frozen advanced LLM, Vicuna, using one projection layer to uncovers that properly aligning the visual features with an advanced large language model can possess numerous advanced multi-modal abilities demonstrated by G PT-4.","arXiv.org",2023,"Deyao Zhu,Jun Chen,Xiaoqian Shen,Xiang Li,Mohamed Elhoseiny",270,49,87
"7e32aac43e9f1df49e116add03327ee6f365dbf3","https://www.semanticscholar.org/paper/7e32aac43e9f1df49e116add03327ee6f365dbf3",4,"mPLUG-Owl: Modularization Empowers Large Language Models with Multimodality",,"arXiv.org",2023,"Qinghao Ye,Haiyang Xu,Guohai Xu,Jiabo Ye,Ming Yan,Yi Zhou,Junyan Wang,Anwen Hu,Pengcheng Shi,Yaya Shi,Chenliang Li,Yuanhong Xu,Hehong Chen,Junfeng Tian,Qiang Qi,Ji Zhang,Feiyan Huang",125,36,20
"54a8b153ed04a872da878d695239bdc413dc782c","https://www.semanticscholar.org/paper/54a8b153ed04a872da878d695239bdc413dc782c",4,"InternGPT: Solving Vision-Centric Tasks by Interacting with Chatbots Beyond Language","By incorporating pointing instructions, the proposed iGPT significantly improves the efficiency of communication between users and chatbots, as well as the accuracy of chatbots in vision-centric tasks, especially in complicated visual scenarios where the number of objects is greater than 2.","arXiv.org",2023,"Zhaoyang Liu,Yinan He,Wenhai Wang,Weiyun Wang,Yi Wang,Shoufa Chen,Qing-Long Zhang,Yang Yang,Qingyun Li,Jiashuo Yu,Kunchang Li,Zhe Chen,Xuecheng Yang,Xizhou Zhu,Yali Wang,Limin Wang,Ping Luo,Jifeng Dai,Yu Qiao",20,84,1
"d48cb91b9e555194f7494c4d4bb9815021d3ee45","https://www.semanticscholar.org/paper/d48cb91b9e555194f7494c4d4bb9815021d3ee45",4,"VideoChat: Chat-Centric Video Understanding","VideoChat is introduced, an end-to-end chat-centric video understanding system that integrates video foundation models and large language models via a learnable neural interface, excelling in spatiotemporal reasoning, event localization, and causal relationship inference.","arXiv.org",2023,"Kunchang Li,Yinan He,Yi Wang,Yizhuo Li,Wen Wang,Ping Luo,Yali Wang,Limin Wang,Yu Qiao",47,59,9
"9837349417e36ef5be06da0fd6c74042148bdaa2","https://www.semanticscholar.org/paper/9837349417e36ef5be06da0fd6c74042148bdaa2",4,"Visual Programming for Text-to-Image Generation and Evaluation","This work proposes two novel interpretable/explainable visual programming frameworks for text-to-image (T2I) generation and evaluation and introduces VPEval, an interpretable and explainable evaluation framework for T2I generation based on visual programming.","arXiv.org",2023,"Jaemin Cho,Abhaysinh Zala,Mohit Bansal",5,62,1
"6238fd213197ccf0d79191662828e38118a06d79","https://www.semanticscholar.org/paper/6238fd213197ccf0d79191662828e38118a06d79",4,"ECHo: Event Causality Inference via Human-centric Reasoning","A unified framework aligned with the Chain-of-Thought (CoT) paradigm is proposed to assess the reasoning capability of current AI systems and scrutinize the advanced large language and multimodal models via three complementary human-centric ECHo tasks.","arXiv.org",2023,"Yuxi Xie,Guanzhen Li,MingSung Kan",0,68,0
"00cb69a9f280317d1c59ac5827551ee9b10642b8","https://www.semanticscholar.org/paper/00cb69a9f280317d1c59ac5827551ee9b10642b8",4,"EmbodiedGPT: Vision-Language Pre-Training via Embodied Chain of Thought","This work introduces EmbodiedGPT, an end-to-end multi-modal foundation model for embodied AI, empowering embodied agents with multi- modal understanding and execution capabilities, and significantly enhances the success rate of the embodied control task by extracting more effective features.","arXiv.org",2023,"Yao Mu,Qinglong Zhang,Mengkang Hu,Wen Wang,Mingyu Ding,Jun Jin,Bin Wang,Jifeng Dai,Y. Qiao,Ping Luo",30,73,2
"c5c5b9c6660bb2089b781d851cb3fd0ba271d742","https://www.semanticscholar.org/paper/c5c5b9c6660bb2089b781d851cb3fd0ba271d742",4,"Cheap and Quick: Efficient Vision-Language Instruction Tuning for Large Language Models","A novel and affordable solution for the effective VL adaption of LLMs, called Mixture-of-Modality Adaptation (MMA), which adopts lightweight modules, i.e., adapters, to bridge the gap between LLMs and VL tasks, which also enables the joint optimization of the image and language models","arXiv.org",2023,"Gen Luo,Yiyi Zhou,Tianhe Ren,Shen Chen,Xiaoshuai Sun,Rongrong Ji",19,48,3
"b458fc5261595f44b36325e5eaea1f874d65138f","https://www.semanticscholar.org/paper/b458fc5261595f44b36325e5eaea1f874d65138f",4,"GPT4Tools: Teaching Large Language Model to Use Tools via Self-instruction","The GPT4Tools based on self-instruct to enable open-source LLMs, such as LLaMA and OPT, to use tools, generates an instruction-following dataset by prompting an advanced teacher with various multi-modal contexts using the Low-Rank Adaptation (LoRA) optimization.","arXiv.org",2023,"Rui Yang,Lin Song,Yanwei Li,Sijie Zhao,Yixiao Ge,Xiu Li,Ying Shan",24,63,2
"4c4d176c6e28f48041f215d563f6ee8633534cff","https://www.semanticscholar.org/paper/4c4d176c6e28f48041f215d563f6ee8633534cff",4,"Valley: Video Assistant with Large Language model Enhanced abilitY","A novel multi-modal foundation model capable of comprehending video, image, and language within a general framework is developed, and Qualitative experiments demonstrate that Valley has the potential to function as a highly effective video assistant that can make complex video understanding scenarios easy.","arXiv.org",2023,"Ruipu Luo,Ziwang Zhao,Min Yang,Junwei Dong,Ming-Hui Qiu,Pengcheng Lu,Tao Wang,Zhongyu Wei",10,39,3
"b335d23c0a7db5c6de74d2d4fffdc396b1f5b5ba","https://www.semanticscholar.org/paper/b335d23c0a7db5c6de74d2d4fffdc396b1f5b5ba",4,"AVIS: Autonomous Visual Information Seeking with Large Language Models","An autonomous information seeking visual question answering framework that leverages a Large Language Model to dynamically strategize the utilization of external tools and to investigate their outputs, thereby acquiring the indispensable knowledge needed to provide answers to the posed questions is proposed.","arXiv.org",2023,"Ziniu Hu,Ahmet Iscen,Chen Sun,Kai-Wei Chang,Yizhou Sun,David A. Ross,C. Schmid,A. Fathi",3,131,0
"efc694164312006c543ef745611348ef64e68dda","https://www.semanticscholar.org/paper/efc694164312006c543ef745611348ef64e68dda",4,"Towards Language Models That Can See: Computer Vision Through the LENS of Natural Language","This work proposes LENS, a modular approach for tackling computer vision problems by leveraging the power of large language models (LLMs) with a language model to reason over outputs from a set of independent and highly descriptive vision modules that provide exhaustive information about an image.","arXiv.org",2023,"William M. Berrios,Gautam Mittal,Tristan Thrush,Douwe Kiela,Amanpreet Singh",9,64,1
"4ad771a10145e5e3b7e74bf6e98b165d7258889f","https://www.semanticscholar.org/paper/4ad771a10145e5e3b7e74bf6e98b165d7258889f",4,"What Matters in Training a GPT4-Style Language Model with Multimodal Inputs?","Lynx is presented, which performs the most accurate multi-modal understanding while keeping the best multi- modal generation ability compared to existing open-sourced GPT4-style models.","arXiv.org",2023,"Yan Zeng,Hanbo Zhang,Jiani Zheng,Jiangnan Xia,Guoqiang Wei,Yang Wei,Yuchen Zhang,Tao Kong",12,107,1
"b86a3606dd3eeabe6504a1d2d0d737ee2d6033c7","https://www.semanticscholar.org/paper/b86a3606dd3eeabe6504a1d2d0d737ee2d6033c7",4,"A Comprehensive Overview of Large Language Models","This review article is intended to provide a systematic survey, but also a quick comprehensive reference for the researchers and practitioners to draw insights from extensive informative summaries of the existing works to advance the LLM research direction.","arXiv.org",2023,"Humza Naveed,Asad Ullah Khan,Shi Qiu,Muhammad Saqib,Saeed Anwar,Muhammad Usman,N. Barnes,A. Mian",10,387,0
"2e52178416b93a0a7dc1cb7d21d04c7e72c2ce0f","https://www.semanticscholar.org/paper/2e52178416b93a0a7dc1cb7d21d04c7e72c2ce0f",4,"ChatSpot: Bootstrapping Multimodal LLMs via Precise Referring Instruction Tuning","This study proposes ChatSpot, a unified end-to-end multimodal large language model that supports diverse forms of interactivity including mouse clicks, drag-and-drop, and drawing boxes, which provides a more flexible and seamless interactive experience.","arXiv.org",2023,"Liang Zhao,En Yu,Zheng Ge,Jinrong Yang,Hao-Ran Wei,Hongyu Zhou,Jian‐Yuan Sun,Yuang Peng,Runpei Dong,Chunrui Han,Xiangyu Zhang",5,39,2
"d53945d4afb4528590d79e20de52883d29037e86","https://www.semanticscholar.org/paper/d53945d4afb4528590d79e20de52883d29037e86",4,"FashionLOGO: Prompting Multimodal Large Language Models for Fashion Logo Embeddings","This work explores how MLLMs can improve logo embedding by prompting them to generate explicit textual knowledge through three types of prompts, including image OCR, brief captions, and detailed descriptions prompts, in a zero-shot setting and adopt a cross-attention transformer to enable image embedding queries to learn supplementary knowledge from textual embeddings automatically.","arXiv.org",2023,"Yulin Su,Min Yang,Minghui Qiu,Jing Wang,Tao Wang",0,44,0
"eb5cf10406a8ad31e0ebe56b36571d5db4758a62","https://www.semanticscholar.org/paper/eb5cf10406a8ad31e0ebe56b36571d5db4758a62",4,"PUMGPT: A Large Vision-Language Model for Product Understanding","This paper presents PUMGPT, a large vision-language model that aims at unifying all product understanding tasks under a singular model structure, and proposes Layer-wise Adapters (LA), an approach that provides enhanced alignment with fewer visual tokens and enables parameter-efficient fine-tuning.","arXiv.org",2023,"Shuhui Wu,Zengming Tang,Zongyi Guo,Weiwei Zhang,Baoliang Cui,Haihong Tang,Weiming Lu",0,38,0
"25f7401d87f9b3cf8a2511a76b181a3559a1833f","https://www.semanticscholar.org/paper/25f7401d87f9b3cf8a2511a76b181a3559a1833f",4,"PointLLM: Empowering Large Language Models to Understand Point Clouds","PointLLM leverages a point cloud encoder with a powerful LLM to effectively fuse geometric, appearance, and linguistic information, thereby enabling LLMs to understand point clouds and offering a new avenue beyond 2D visual data.","arXiv.org",2023,"Runsen Xu,Xiaolong Wang,Tai Wang,Yilun Chen,Jiangmiao Pang,Dahua Lin",3,56,0
