"id","url","score","title","summary","venue","year","authors","citationCount","referenceCount","influentialCitationCount"
"e62937949aa18caeebaf1263ef5d86d447acbc6e","https://www.semanticscholar.org/paper/e62937949aa18caeebaf1263ef5d86d447acbc6e",1,"Pre-trained Language Models in Biomedical Domain: A Systematic Survey","The recent progress of pre-trained language models in the biomedical domain and their applications in biomedical downstream tasks are summarized and a taxonomy of existing biomedical PLMs is proposed.","arXiv.org",2021,"Benyou Wang,Qianqian Xie,Jiahuan Pei,P. Tiwari,Zhao Li,Jie Fu",24,379,3
"e3c70b0b71b51872bbdaa0f4bf2b56908f97abec","https://www.semanticscholar.org/paper/e3c70b0b71b51872bbdaa0f4bf2b56908f97abec",1,"MedKLIP: Medical Knowledge Enhanced Language-Image Pre-Training","This paper adopts a novel report filter to extract the medical entities, and proposes a novel entity embedding module by querying an external knowledge description base to exploit the rich context of additional information that the medical domain affords, and implicitly build relationships between entities in the language embedding space.","medRxiv",2023,"Chaoyi Wu,Xiaoman Zhang,Ya Zhang,Yanfeng Wang,Weidi Xie",6,67,1
"10a8e7a7e07256178665f90074c5c41b071e73d3","https://www.semanticscholar.org/paper/10a8e7a7e07256178665f90074c5c41b071e73d3",1,"MDF-Net: Multimodal Dual-Fusion Network for Abnormality Detection using CXR Images and Clinical Data","Results show that incorporating patients' clinical data in a DL model together with the proposed fusion methods improves the performance of disease localization in chest X-rays by 12\% in terms of Average Precision compared to a standard Mask R-CNN using only chestX-rays.","arXiv.org",2023,"Chih-Jou Hsieh,Isabel Blanco Nobre,Sandra Costa Sousa,Chun Ouyang,Margot Brereton,J. Nascimento,Joaquim Jorge,Catarina Moreira",0,49,0
"a39adffc4e6de100a950f4476e113bfc402119f2","https://www.semanticscholar.org/paper/a39adffc4e6de100a950f4476e113bfc402119f2",1,"Knowledge-enhanced Visual-Language Pre-training on Chest Radiology Images","KAD is evaluated on four external X-ray datasets and it is demonstrated that its zero-shot performance is not only comparable to that of fully-supervised models, but also superior to the average of three expert radiologists for three pathologies with statistical significance.","",2023,"Xiaoman Zhang,Chaoyi Wu,Ya Zhang,Yanfeng Wang,Weidi Xie",0,73,0
"8700c5af25450bf8e84b94783344b054d268738b","https://www.semanticscholar.org/paper/8700c5af25450bf8e84b94783344b054d268738b",1,"Bi-VLGM : Bi-Level Class-Severity-Aware Vision-Language Graph Matching for Text Guided Medical Image Segmentation","A Bi-level class-severity-aware Vision-Language Graph Matching (Bi-VLGM) for text guided medical image segmentation and its superiority to existing methods is introduced.","",2023,"Chen Wenting,Liu Jie,Yuan Yixuan",0,48,0
"201e3519a2b77e3d4852a909d8edfa19796e219e","https://www.semanticscholar.org/paper/201e3519a2b77e3d4852a909d8edfa19796e219e",1,"Generalist Vision Foundation Models for Medical Imaging: A Case Study of Segment Anything Model on Zero-Shot Medical Segmentation","The study indicates the versatility of generalist vision foundation models on solving specific tasks in medical imaging, and their great potential to achieve desired performance through fine-turning and eventually tackle the challenges of accessing large diverse medical datasets and the complexity of medical domains.","arXiv.org",2023,"Peilun Shi,Jianing Qiu,Sai Mu Dalike Abaxi,Hao Wei,F. P. Lo,Wu Yuan",1,37,0
"80785017029cab501fcdb90b98985cd2b36e1fb8","https://www.semanticscholar.org/paper/80785017029cab501fcdb90b98985cd2b36e1fb8",1,"Evaluation of GPT-3.5 and GPT-4 for supporting real-world information needs in healthcare delivery","It is suggested that while general purpose LLMs are able to provide safe and credible responses, they often do not meet the specific information need of a given question.","arXiv.org",2023,"Debadutta Dash,Rahul Thapa,J. Banda,Akshay Swaminathan,Morgan Cheatham,M. Kashyap,N. Kotecha,Jonathan H. Chen,S. Gombar,L. Downing,Rachel A. Pedreira,Ethan Goh,A. Arnaout,Garret K. Morris,H. Magon,M. Lungren,E. Horvitz,N. Shah",0,38,0
"d0ee000f30420953f10dfcfd608a7f9ad40f1635","https://www.semanticscholar.org/paper/d0ee000f30420953f10dfcfd608a7f9ad40f1635",1,"Humans are Still Better than ChatGPT: Case of the IEEEXtreme Competition","This paper presents an instance where human performance excels in typical tasks suited for ChatGPT, specifically in the domain of computer programming, and provides evidence that contrary to popular belief, human programmers maintain a competitive edge overChatGPT in certain aspects of problem-solving within the programming context.","arXiv.org",2023,"A. Koubâa,B. Qureshi,Adel Ammar,Zahid Khan,W. Boulila,L. Ghouti",1,34,0
"e1a12117f15a6ee07133851a51439394bb9e7406","https://www.semanticscholar.org/paper/e1a12117f15a6ee07133851a51439394bb9e7406",1,"ChemCrow: Augmenting large-language models with chemistry tools","This study introduces ChemCrow, an LLM chemistry agent designed to accomplish tasks across organic synthesis, drug discovery, and materials design by integrating 13 expert-designed tools, which augments the LLM performance in chemistry, and new capabilities emerge.","",2023,"A. Bran,Sam Cox,Andrew D. White,P. Schwaller",4,78,0
"66d4631c28582b496d8e77653556893a9a6d8c3a","https://www.semanticscholar.org/paper/66d4631c28582b496d8e77653556893a9a6d8c3a",1,"MultiModal-GPT: A Vision and Language Model for Dialogue with Humans","A vision and language model named MultiModal-GPT to conduct multi-round dialogue with humans and finds the quality of training data is vital for the dialogue performance, where few data containing short answers can lead the model to respond shortly to any instructions.","arXiv.org",2023,"T. Gong,Chengqi Lyu,Shilong Zhang,Yudong Wang,Miao Zheng,Qianmengke Zhao,Kuikun Liu,Wenwei Zhang,Ping Luo,Kai Chen",5,17,0
"2d3905c1a92c28c056dff1225d89e4ca72ac4d8e","https://www.semanticscholar.org/paper/2d3905c1a92c28c056dff1225d89e4ca72ac4d8e",1,"Man vs the machine: The Struggle for Effective Text Anonymisation in the Age of Large Language Models","An experiment is conducted using GPT over anonymised texts of famous people to determine whether such trained networks can deanonymise them and introduces a novel methodology that employs Large Language Models to improve the anonymity of texts.","arXiv.org",2023,"C. Patsakis,Nikolaos Lykousas",1,38,0
"6139b6bc065b24562cb7f4f08227a42f5766138f","https://www.semanticscholar.org/paper/6139b6bc065b24562cb7f4f08227a42f5766138f",1,"Diffusion Models: A Comprehensive Survey of Methods and Applications","An overview of the rapidly expanding body of work on diffusion models is provided, categorizing the research into three key areas: efficient sampling, improved likelihood estimation, and handling data with special structures.","arXiv.org",2022,"Ling Yang,Zhilong Zhang,Shenda Hong,Runsheng Xu,Yue Zhao,Yingxia Shao,Wentao Zhang,Ming-Hsuan Yang,Bin Cui",121,364,7
"09ca5072a76796c65e5936b6fb4968afead61944","https://www.semanticscholar.org/paper/09ca5072a76796c65e5936b6fb4968afead61944",1,"Semantics-Empowered Communication: A Tutorial-cum-Survey","This work proposes to categorize the critical enabling techniques by explicit and implicit reasoning-based methods, and elaborate on how they evolve and contribute to modern content&channel semantics-empowered communications.","arXiv.org",2022,"Zhilin Lu,Rongpeng Li,Kun Lu,Xianfu Chen,E. Hossain,Zhifeng Zhao,Honggang Zhang",2,243,1
"419eb47fea3931c4098232f44ccbc216275d3f56","https://www.semanticscholar.org/paper/419eb47fea3931c4098232f44ccbc216275d3f56",1,"Decoding Visual Neural Representations by Multimodal Learning of Brain-Visual-Linguistic Features","The BraVL model can be trained under various semi-supervised scenarios to incorporate the visual and textual features obtained from the extra categories and constructed three trimodal matching datasets, leading to some interesting conclusions and cognitive insights.","IEEE Transactions on Pattern Analysis and Machine Intelligence",2022,"Changde Du,Kaicheng Fu,Jinpeng Li,Huiguang He",2,87,1
"9fe9af7cf3d54b707a7be3c53ce94b77dcc3bae5","https://www.semanticscholar.org/paper/9fe9af7cf3d54b707a7be3c53ce94b77dcc3bae5",1,"A Short Survey of Viewing Large Language Models in Legal Aspect","","arXiv.org",2023,"Zhongxiang Sun",6,25,0
"74e8ae03a385e72f5ae377667ba9858fb3e0bfa0","https://www.semanticscholar.org/paper/74e8ae03a385e72f5ae377667ba9858fb3e0bfa0",1,"Unleashing the Power of Edge-Cloud Generative AI in Mobile Networks: A Survey of AIGC Services","This survey paper focuses on the deployment of AIGC applications, e.g., ChatGPT and Dall-E, at mobile edge networks, that provide personalized and customized AigC services in real time while maintaining user privacy.","arXiv.org",2023,"Minrui Xu,Hongyang Du,D. Niyato,Jiawen Kang,Zehui Xiong,Shiwen Mao,Zhu Han,A. Jamalipour,Dong In Kim,X. Shen,Victor C. M. Leung,H. V. Poor",3,232,0
"1d29334cfbe9a1a943082058876f0c22d44c62fd","https://www.semanticscholar.org/paper/1d29334cfbe9a1a943082058876f0c22d44c62fd",1,"A Survey of Large Language Models","A review of the recent advances of large language models by introducing the background, key findings, and mainstream techniques, and focusing on four major aspects of LLMs, namely pre-training, adaptation tuning, utilization, and capacity evaluation.","arXiv.org",2023,"Wayne Xin Zhao,Kun Zhou,Junyi Li,Tianyi Tang,Xiaolei Wang,Yupeng Hou,Yingqian Min,Beichen Zhang,Junjie Zhang,Zican Dong,Yifan Du,Chen Yang,Yushuo Chen,Z. Chen,Jinhao Jiang,Ruiyang Ren,Yifan Li,Xinyu Tang,Zikang Liu,Peiyu Liu,J. Nie,Ji-rong Wen",66,415,7
"26ccfbd8bfad44aeed695c12579ff7126adbfae9","https://www.semanticscholar.org/paper/26ccfbd8bfad44aeed695c12579ff7126adbfae9",1,"Summary of ChatGPT/GPT-4 Research and Perspective Towards the Future of Large Language Models","A comprehensive survey of ChatGPT and GPT-4, state-of-the-art large language models from the GPT series, and their prospective applications across diverse domains, encompassing trend analysis, word cloud representation, and distribution analysis across various application domains is presented.","arXiv.org",2023,"Yi-Hsien Liu,Tianle Han,Siyuan Ma,Jia-Yu Zhang,Yuanyu Yang,Jiaming Tian,Haoyang He,Antong Li,Mengshen He,Zheng Liu,Zihao Wu,Dajiang Zhu,Xiang Li,Ning Qiang,Dingang Shen,Tianming Liu,Bao Ge",17,106,2
"9fd980237e7fdfa4c103a2dc08657e73adf847c4","https://www.semanticscholar.org/paper/9fd980237e7fdfa4c103a2dc08657e73adf847c4",1,"OpenAGI: When LLM Meets Domain Experts","OpenAGI is developed, an open-source AGI research platform, specifically designed to offer complex, multi-step tasks and accompanied by task-specific datasets, evaluation metrics, and a diverse range of extensible models.","arXiv.org",2023,"Yingqiang Ge,Wenyue Hua,Jianchao Ji,Juntao Tan,Shuyuan Xu,Yongfeng Zhang",5,42,0
"6316cbb4f1e7dba5806a3310ec7f89f3571bc3db","https://www.semanticscholar.org/paper/6316cbb4f1e7dba5806a3310ec7f89f3571bc3db",1,"Boosting Cross-task Transferability of Adversarial Patches with Visual Relations","A novel Visual Relation-based cross-task Adversarial Patch generation method called VRAP is proposed, which aims to evaluate the robustness of various visual tasks, especially those involving visual reasoning, such as Visual Question Answering and Image Captioning.","arXiv.org",2023,"Tony Ma,Songze Li,Yisong Xiao,Shunchang Liu",0,22,0
"be2b0396de9431bae931642516a1d3e4906329f5","https://www.semanticscholar.org/paper/be2b0396de9431bae931642516a1d3e4906329f5",1,"Low-code LLM: Visual Programming over LLMs","A novel human-LLM interaction framework that incorporates six types of simple low-code visual programming interactions, all supported by clicking, dragging, or text editing, to achieve more controllable and stable responses.","arXiv.org",2023,"Yuzhe Cai,Shaoguang Mao,Wenshan Wu,Zehua Wang,Yaobo Liang,Tao Ge,Chenfei Wu,Wang You,Ting Song,Yan Xia,Jonathan Tien,Nan Duan",1,27,0
"93cedc10eda0e89757c1d1de67d78cb7e1b5c55b","https://www.semanticscholar.org/paper/93cedc10eda0e89757c1d1de67d78cb7e1b5c55b",1,"Learning to Program with Natural Language","The Learning to Program (LP) method is proposed to ask LLMs themselves to learn natural language programs from the training dataset of complex tasks and then use the learned program to guide inference.","arXiv.org",2023,"Yiduo Guo,Yaobo Liang,Chenfei Wu,Wenshan Wu,Dongyan Zhao,Nan Duan",1,30,0
"4c8ef2db0c77aba453783f5211ebafc6695d3835","https://www.semanticscholar.org/paper/4c8ef2db0c77aba453783f5211ebafc6695d3835",1,"ChatABL: Abductive Learning via Natural Language Interaction with ChatGPT","This paper presents a novel method (ChatABL) for integrating LLMs into the ABL framework, aiming at unifying the three abilities in a more user-friendly and understandable manner, and is the first attempt to explore a new pattern for further approaching human-level cognitive ability via natural language interaction with ChatGPT.","arXiv.org",2023,"Tianyang Zhong,Yaonai Wei,Li Yang,Zihao Wu,Zheng Liu,Xiaozheng Wei,WenJu Sun,Junjie Yao,Chongfei Ma,Xiang Li,Dajiang Zhu,Xi Jiang,Jun-Feng Han,Dinggang Shen,Tianming Liu,Tuo Zhang",1,69,0
"7a5c31341e7ec22409e175542368eb76e08900aa","https://www.semanticscholar.org/paper/7a5c31341e7ec22409e175542368eb76e08900aa",1,"The Potential of Visual ChatGPT For Remote Sensing","","arXiv.org",2023,"L. Osco,Eduardo Lopes de Lemos,W. Gonçalves,A. P. Ramos,J. M. Junior",0,36,0
"8bc617c9139648d7a92991d70c671230bac7b2e2","https://www.semanticscholar.org/paper/8bc617c9139648d7a92991d70c671230bac7b2e2",1,"AudioGPT: Understanding and Generating Speech, Music, Sound, and Talking Head","A multi-modal AI system named AudioGPT is proposed, which complements LLMs with 1) foundation models to process complex audio information and solve numerous understanding and generation tasks; and 2) the input/output interface (ASR, TTS) to support spoken dialogue.","arXiv.org",2023,"Rongjie Huang,Mingze Li,Dongchao Yang,Jiatong Shi,Xuankai Chang,Zhenhui Ye,Yuning Wu,Zhiqing Hong,Jia-Bin Huang,Jinglin Liu,Yixiang Ren,Zhou Zhao,Shinji Watanabe",10,46,1
"37ba1833e844f5178f91f50d82bfff616551e6ad","https://www.semanticscholar.org/paper/37ba1833e844f5178f91f50d82bfff616551e6ad",1,"The Role of Summarization in Generative Agents: A Preliminary Perspective","","arXiv.org",2023,"Xiachong Feng,Xiaocheng Feng,Bing Qin",0,11,0
"c77d908ba29567445a9a4ad1bd4461d441cce174","https://www.semanticscholar.org/paper/c77d908ba29567445a9a4ad1bd4461d441cce174",1,"AutoML-GPT: Automatic Machine Learning with GPT","The AutoML-GPT is presented, which employs GPT as the bridge to diverse AI models and dynamically trains models with optimized hyperparameters and achieves remarkable results in computer vision, natural language processing, and other challenging areas.","arXiv.org",2023,"Shujian Zhang,Chengyue Gong,Lemeng Wu,Xingchao Liu,Mi Zhou",0,33,0
"d473847dff63e3f5d238251cb23597f8205f72f2","https://www.semanticscholar.org/paper/d473847dff63e3f5d238251cb23597f8205f72f2",1,"Generating Virtual On-body Accelerometer Data from Virtual Textual Descriptions for Human Activity Recognition","This work introduces an automated pipeline that first uses ChatGPT to generate diverse textual descriptions of activities that are later converted to streams of virtual IMU data and demonstrates how HAR models can be improved through the generation of virtual training data that do not require any manual effort.","arXiv.org",2023,"Zi-Jian Leng,HyeokHyen Kwon,T. Plotz",0,33,0
"e0dc8e113dbdd2896fb6420ac93e0b976c47f2a2","https://www.semanticscholar.org/paper/e0dc8e113dbdd2896fb6420ac93e0b976c47f2a2",1,"Augmented Large Language Models with Parametric Knowledge Guiding","The novel Parametric Knowledge Guiding (PKG) framework is proposed, which equips LLMs with a knowledge-guiding module to access relevant knowledge without altering the LLMs' parameters, and is based on open-source language models, allowing offline memory of any knowledge that LLMs require.","arXiv.org",2023,"Ziyang Luo,Can Xu,Pu Zhao,Xiubo Geng,Chongyang Tao,Jing Ma,Qingwei Lin,Daxin Jiang",0,57,0
"09bd70e820427a711ed4bff29985d2885c8a379e","https://www.semanticscholar.org/paper/09bd70e820427a711ed4bff29985d2885c8a379e",1,"Autonomous GIS: the next-generation AI-powered GIS","Although still in its infancy and lacking several important modules such as logging and code testing, LLM-Geo demonstrates a potential path towards next-generation AI-powered GIS, and advocates for the GIScience community to dedicate more effort to the research and development of autonomous GIS.","arXiv.org",2023,"Zhenlong Li,H. Ning",0,64,0
"8dbb29f93292d8b1b861c322d232fe087b2ef7b1","https://www.semanticscholar.org/paper/8dbb29f93292d8b1b861c322d232fe087b2ef7b1",1,"Small Models are Valuable Plug-ins for Large Language Models","The experiments demonstrate that SuperICL can improve performance beyond state-of-the-art fine-tuned models while addressing the instability problem of in-context learning, and can enhance the capabilities of smaller models, such as multilinguality and interpretability.","arXiv.org",2023,"Canwen Xu,Yichong Xu,Shuo Wang,Yang Liu,Chenguang Zhu,Julian McAuley",3,35,0
"7787efaf502421eac9b6b0fd946a82e1ecf4c8c9","https://www.semanticscholar.org/paper/7787efaf502421eac9b6b0fd946a82e1ecf4c8c9",1,"Generating coherent comic with rich story using ChatGPT and Stable Diffusion","A novel way to evaluate AI-generated stories is introduced, and SOTA performance on character fidelity and art style is achieved by fine-tuning stable diffusion using LoRA, ControlNet, etc.","arXiv.org",2023,"Ze Jin,Zorina Song",0,17,0
"43f17d08125a07f101a52170f068c0354a2f8ada","https://www.semanticscholar.org/paper/43f17d08125a07f101a52170f068c0354a2f8ada",1,"Chain-of-Symbol Prompting Elicits Planning in Large Langauge Models","A novel method called CoS (Chain-of-Symbol Prompting) that represents the complex environments with condensed symbolic spatial representations during the chained intermediate thinking steps and is easy to use and does not need additional training on LLMs.","arXiv.org",2023,"Hanxu Hu,Hongyuan Lu,Huajian Zhang,Wai Lam,Yue Zhang",0,26,0
"dc26beda5a94fba16194a25e35857df2aa04d8c2","https://www.semanticscholar.org/paper/dc26beda5a94fba16194a25e35857df2aa04d8c2",1,"Empower Large Language Model to Perform Better on Industrial Domain-Specific Question Answering","This paper provides a benchmark Question Answering (QA) dataset named MSQA, which is about Microsoft products and IT technical problems encountered by customers, and proposes a new model interaction paradigm that can empower LLM to achieve better performance on domain-specific tasks where it is not proficient.","arXiv.org",2023,"Zezhong Wang,Fan Yang,Pu Zhao,Lu Wang,Jue Zhang,Mohit Garg,Qingwei Lin,Dongmei Zhang",0,41,0
"fbd4a876cee20eaf98f344aca597a55338f663f5","https://www.semanticscholar.org/paper/fbd4a876cee20eaf98f344aca597a55338f663f5",1,"Examining the Inter-Consistency of Large Language Models: An In-depth Analysis via Debate","Through extensive experiments on the commonsense reasoning task, LLMs not only become more inter-consistent but also achieve higher performance and the importance of a competent judge, such as GPT-4, is highlighted.","arXiv.org",2023,"Kai Xiong,Xiao Ding,Yixin Cao,Ting Liu,Bing Qin",0,40,0
"eb291a2e237774b162d9c51c21c4868795589e94","https://www.semanticscholar.org/paper/eb291a2e237774b162d9c51c21c4868795589e94",1,"Diving into the Inter-Consistency of Large Language Models: An Insightful Analysis through Debate","A formal debate framework is designed to delve into the inter-consistency problem among LLMs with three-stage debate: fair debate, mismatched debate, and roundtable debate and shows how a much stronger LLM would be dominant in mismatched debates, while it will be easily misled by relatively weaker LLMs in a more complex debate scenario such as round table debate.","",2023,"Kai Xiong,Xiao Ding,Yixin Cao,Ting Liu,Bing Qin",0,42,0
"205d2ed0906440f07a0275d7d6a63bced60951fc","https://www.semanticscholar.org/paper/205d2ed0906440f07a0275d7d6a63bced60951fc",1,"InstructVid2Vid: Controllable Video Editing with Natural Language Instructions","Experiments demonstrate that InstructVid2Vid is able to generate high-quality, temporally coherent videos and perform diverse edits, including attribute editing, change of background, and style transfer, which highlight the versatility and effectiveness of the proposed method.","arXiv.org",2023,"Bosheng Qin,Juncheng Li,Siliang Tang,Tat-Seng Chua,Yueting Zhuang",0,61,0
"0f19e94f30b99d6c4b349900057cdae9262034f9","https://www.semanticscholar.org/paper/0f19e94f30b99d6c4b349900057cdae9262034f9",1,"The Contribution of Knowledge in Visiolinguistic Learning: A Survey on Tasks and Challenges","This survey analyzes tasks that have benefited from hybrid approaches to visiolinguistic learning, and categorizes existing knowledge sources and types, proceeding to discussion regarding the KG vs LLM dilemma and its potential impact to future hybrid approaches.","arXiv.org",2023,"Maria Lymperaiou,G. Stamou",0,140,0
"09840a5c151f858ed0eaf1db2a4d3741516f693b","https://www.semanticscholar.org/paper/09840a5c151f858ed0eaf1db2a4d3741516f693b",1,"ICL-D3IE: In-Context Learning with Diverse Demonstrations Updating for Document Information Extraction","A simple but effective in-context learning framework called ICL-D3IE, which enables LLMs to perform DIE with different types of demonstration examples and enables GPT-3/ChatGPT to achieve superior performance when compared to previous pre-trained methods fine-tuned with full training in both the in-dist distribution (ID) setting and in the out-of-distribution (OOD) setting.","arXiv.org",2023,"Jiabang He,Lei Wang,Yingpeng Hu,Ning Liu,Hui-juan Liu,Xingdong Xu,Hengtao Shen",6,55,0
"5dea6facab090a070be1444920230689e7189599","https://www.semanticscholar.org/paper/5dea6facab090a070be1444920230689e7189599",1,"SurgicalGPT: End-to-End Language-Vision GPT for Visual Question Answering in Surgery","An end-to-end trainable Language-Vision GPT model that expands the GPT2 model to include vision input (image) and extensively study and present the effects of token sequencing, token type and pose embedding for vision tokens in the LV-GPT model.","arXiv.org",2023,"L. Seenivasan,Mobarakol Islam,Gokul Kannan,Hongliang Ren",1,25,0
"d00ca5c49415d3a45bfcf3fabaf0a60a1c52a6ff","https://www.semanticscholar.org/paper/d00ca5c49415d3a45bfcf3fabaf0a60a1c52a6ff",1,"PromptCap: Prompt-Guided Task-Aware Image Captioning","PromptCap (Prompt-guided image Captioning), a captioning model designed to serve as a better connector between images and black-box LMs, achieves state-of-the-art accuracy on knowledge-based VQA tasks and generalizes well to unseen domains.","arXiv.org",2022,"Yushi Hu,Hang Hua,Zhengyuan Yang,Weijia Shi,Noah A. Smith,Jiebo Luo",15,100,0
"1367dcff4ccb927a5e95c452041288b3f0dd0eff","https://www.semanticscholar.org/paper/1367dcff4ccb927a5e95c452041288b3f0dd0eff",1,"Tune-A-Video: One-Shot Tuning of Image Diffusion Models for Text-to-Video Generation","A new T2V generation setting, where only one text-video pair is presented, and Tune-A-Video, which involves a tailored spatio-temporal attention mechanism and an efficient one-shot tuning strategy, is introduced.","arXiv.org",2022,"Jay Zhangjie Wu,Yixiao Ge,Xintao Wang,Weixian Lei,Yuchao Gu,W. Hsu,Ying Shan,Xiaohu Qie,Mike Zheng Shou",38,67,12
"00c1ff63468305ea3fa430c2b3aef156d580c4ff","https://www.semanticscholar.org/paper/00c1ff63468305ea3fa430c2b3aef156d580c4ff",1,"P ROMPT C AP : Prompt-Guided Image Captioning for VQA with GPT-3","P ROMPT C AP is a captioning model designed to serve as a better connector between images and black-box LMs that outperforms generic captions by a large margin and achieves state-of-the-art accuracy on knowledge-based VQA tasks.","",2023,"Yushi Hu,Hang Hua,Zhengyuan Yang,Weijia Shi,Noah A. Smith,Jiebo Luo",1,72,0
"3062bb79d12ff55c29c8731211a84e8cf344e235","https://www.semanticscholar.org/paper/3062bb79d12ff55c29c8731211a84e8cf344e235",1,"Vision Learners Meet Web Image-Text Pairs","A new visual representation pre-training method, MUlti-modal Generator~(MUG), that learns from scalable web sourced image-text data that achieves state-of-the-art transfer performance on a variety of tasks and demonstrates promising scaling properties.","arXiv.org",2023,"Bingchen Zhao,Quan Cui,Hao Wu,O. Yoshie,Cheng Yang",0,88,0
"a082b61a7d9d6c890861661be919fd9190893b38","https://www.semanticscholar.org/paper/a082b61a7d9d6c890861661be919fd9190893b38",1,"Bias-to-Text: Debiasing Unknown Visual Biases through Language Interpretation","The bias-to-text (B2T) framework is introduced, which uses language interpretation to identify and mitigate biases in vision models, such as image classifiers and text- to-image generative models, and its effectiveness on various image classification and generation tasks is demonstrated.","",2023,"Younghyun Kim,Sangwoo Mo,Minkyu Kim,Kyungmin Lee,Jaeho Lee,Jinwoo Shin",0,102,0
"fccada3fc530ea98d612126399f13ecb0844fc21","https://www.semanticscholar.org/paper/fccada3fc530ea98d612126399f13ecb0844fc21",1,"Contrast with Reconstruct: Contrastive 3D Representation Learning Guided by Generative Pretraining","ReCon is trained to learn from both generative modeling teachers and single/cross-modal contrastive teachers through ensemble distillation, where the generative student guides the contrastive student.","arXiv.org",2023,"Zekun Qi,Runpei Dong,Guo Fan,Zheng Ge,Xiangyu Zhang,Kaisheng Ma,Li Yi",5,103,1
