"id","url","score","title","summary","venue","year","authors","citationCount","referenceCount","influentialCitationCount"
"ac7771c332da42b29a913b116bd6ef622cbf89cf","https://www.semanticscholar.org/paper/ac7771c332da42b29a913b116bd6ef622cbf89cf",2,"TaskMatrix.AI: Completing Tasks by Connecting Foundation Models with Millions of APIs","The vision of how to build such an ecosystem is presented, each key component is explained, and study cases are used to illustrate both the feasibility of this vision and the main challenges the authors need to address next.","arXiv.org",2023,"Yaobo Liang,Chenfei Wu,Ting Song,Wenshan Wu,Yan Xia,Yu Liu,Yangyiwen Ou,Shuai Lu,Lei Ji,Shaoguang Mao,Yun Wang,Linjun Shou,Ming Gong,Nan Duan",31,27,3
"01f9b773408115a16fe872147348db175789e82f","https://www.semanticscholar.org/paper/01f9b773408115a16fe872147348db175789e82f",2,"Tool Learning with Foundation Models","A systematic investigation of tool learning is presented, including its cognitive origins, the paradigm shift of foundation models, and the complementary roles of tools and models to inspire future research in integrating tools with foundation models.","arXiv.org",2023,"Yujia Qin,Shengding Hu,Yankai Lin,Weize Chen,Ning Ding,Ganqu Cui,Zheni Zeng,Yufei Huang,Chaojun Xiao,Chi Han,Y. Fung,Yusheng Su,Huadong Wang,Cheng Qian,Runchu Tian,Kunlun Zhu,Shi Liang,Xingyu Shen,Bokai Xu,Zhen Zhang,Yining Ye,Bo Li,Ziwei Tang,Jing Yi,Yu Zhu,Zhenning Dai,Lan Yan,Xin Cong,Ya-Ting Lu,Weilin Zhao,Yuxiang Huang,Jun-Han Yan,Xu Han,Xian Sun,Dahai Li,Jason Phang,Cheng Yang,Tongshuang Wu,Heng Ji,Zhiyuan Liu,Maosong Sun",13,224,2
"2195676f111ad492c50f4d4c96abb2bd3d72f7fc","https://www.semanticscholar.org/paper/2195676f111ad492c50f4d4c96abb2bd3d72f7fc",2,"Instruct2Act: Mapping Multi-modality Instructions to Robotic Actions with Large Language Model","This paper presents Instruct2Act, a framework that utilizes Large Language Models to map multi-modal instructions to sequential actions for robotic manipulation tasks, employing the LLM model to generate Python programs that constitute a comprehensive perception, planning, and action loop for robotic tasks.","arXiv.org",2023,"Siyuan Huang,Zhengkai Jiang,Hao-Wen Dong,Y. Qiao,Peng Gao,Hongsheng Li",1,45,1
"13a5140fc0b269c408ecfc666cb297410bc753c5","https://www.semanticscholar.org/paper/13a5140fc0b269c408ecfc666cb297410bc753c5",2,"Matcher: Segment Anything with One Shot Using All-Purpose Feature Matching","This work presents Matcher, which segments anything with one shot by integrating an all-purpose feature extraction model and a class-agnostic segmentation model, and proposes a novel instance-level matching strategy for controllable mask merging.","arXiv.org",2023,"Yang Liu,Muzhi Zhu,Hengtao Li,Hao Chen,Xinlong Wang,Chunhua Shen",1,44,0
"ba704774f194938b04b1e2be40b1d111a4ca08e1","https://www.semanticscholar.org/paper/ba704774f194938b04b1e2be40b1d111a4ca08e1",2,"CREATOR: Disentangling Abstract and Concrete Reasonings of Large Language Models through Tool Creation",,"arXiv.org",2023,"Cheng Qian,Chi Han,Y. Fung,Yujia Qin,Zhiyuan Liu,Heng Ji",1,30,0
"90027ca7802645671a69b00b65e1fa94e6b63544","https://www.semanticscholar.org/paper/90027ca7802645671a69b00b65e1fa94e6b63544",2,"ReWOO: Decoupling Reasoning from Observations for Efficient Augmented Language Models","This study proposes a modular paradigm ReWOO (Reasoning WithOut Observation) that detaches the reasoning process from external observations, thus significantly reducing token consumption and demonstrating robustness under tool-failure scenarios.","arXiv.org",2023,"Binfeng Xu,Zhiyuan Peng,Bowen Lei,Subhabrata Mukherjee,Yuchen Liu,Dongkuan Xu",1,41,0
"615962d8969c8e0ffe43319689dce6c50cbf1f29","https://www.semanticscholar.org/paper/615962d8969c8e0ffe43319689dce6c50cbf1f29",2,"Responsible Task Automation: Empowering Large Language Models as Responsible Task Automators","This paper presents Responsible Task Automation (ResponsibleTA) as a fundamental framework to facilitate responsible collaboration between LLM-based coordinators and executors for task automation with three empowered capabilities: predicting the feasibility of the commands for executors, verifying the completeness of executors and enhancing the security.","",2023,"Zhizheng Zhang,Xiaoyi Zhang,Wenxuan Xie,Yan Lu",0,44,0
"30c0cdc414f68211d5d0514df027cec22e005174","https://www.semanticscholar.org/paper/30c0cdc414f68211d5d0514df027cec22e005174",2,"A Survey for In-context Learning","This paper presents a formal definition of ICL and clarify its correlation to related studies, and organizes and discusses advanced techniques, including training strategies, demonstration designing strategies, as well as related analysis.","arXiv.org",2022,"Qingxiu Dong,Lei Li,Damai Dai,Ce Zheng,Zhiyong Wu,Baobao Chang,Xu Sun,Jingjing Xu,Zhifang Sui",2,125,0
"7562e25b666cba841b1dd5cf6e700978922beb04","https://www.semanticscholar.org/paper/7562e25b666cba841b1dd5cf6e700978922beb04",2,"SkinGPT: A Dermatology Diagnostic System with Vision Large Language Model","The ability to deploy it locally and protect user privacy makes SkinGPT an attractive option for patients seeking an accurate and reliable diagnosis of their skin conditions and the system can autonomously determine the characteristics and categories of skin conditions, perform analysis, and provide treatment recommendations.","arXiv.org",2023,"Juexiao Zhou,Xin Gao",1,35,1
"c56a51728678e5b2e3ff95e51caf21d267439c36","https://www.semanticscholar.org/paper/c56a51728678e5b2e3ff95e51caf21d267439c36",2,"ChatVideo: A Tracklet-centric Multimodal and Versatile Video Understanding System","The vision for multimodal and versatile video understanding is presented and a prototype system, built upon a tracklet-centric paradigm, which treats tracklets as the basic video unit and employs various Video Foundation Models to annotate their properties e.g., appearance, motion, etc.","arXiv.org",2023,"Junke Wang,Dongdong Chen,Chong Luo,Xiyang Dai,Lu Yuan,Zuxuan Wu,Yu-Gang Jiang",2,43,0
"8f95859cd6ccbe2c039fe8214f76c22382ebb9c3","https://www.semanticscholar.org/paper/8f95859cd6ccbe2c039fe8214f76c22382ebb9c3",2,"Caption Anything: Interactive Image Description with Diverse Multimodal Controls","Caption AnyThing (CAT) is presented, a foundation model augmented image captioning framework supporting a wide range of multimodel controls: 1) visual controls, including points, boxes, and trajectories; 2) language controls, such as sentiment, length, language, and factuality.","arXiv.org",2023,"Teng Wang,Jinrui Zhang,Junjie Fei,Yixiao Ge,Hao Zheng,Yun-Qiu Tang,Zhe Li,Mingqi Gao,Shanshan Zhao,Ying Shan,Feng Zheng",2,48,1
"80c44fab16852ea9599411da14de7079c4514172","https://www.semanticscholar.org/paper/80c44fab16852ea9599411da14de7079c4514172",2,"Vision-Language Models in Remote Sensing: Current Progress and Future Trends","A comprehensive review of the research on vision-language models in remote sensing, summarizing the latest progress, highlighting the current challenges, and identifying potential research opportunities is provided.","arXiv.org",2023,"Congcong Wen,Yuan Hu,Xiang Li,Zhenghang Yuan,Xiao Xiang Zhu",1,195,0
"affd5837492019cf252f4bf89afcda3708d2abac","https://www.semanticscholar.org/paper/affd5837492019cf252f4bf89afcda3708d2abac",2,"InstructBLIP: Towards General-purpose Vision-Language Models with Instruction Tuning","A systematic and comprehensive study on vision-language instruction tuning based on the pre-trained BLIP-2 models, which achieves state-of-the-art zero-shot performance across all 13 held-out datasets and qualitatively demonstrate the advantages of InstructBLIP over concurrent multimodal models.","arXiv.org",2023,"Wenliang Dai,Junnan Li,Dongxu Li,A. M. H. Tiong,Junqi Zhao,Weisheng Wang,Boyang Li,Pascale Fung,Steven Hoi",12,48,3
"abac9af9174e8be2f605453695d98e3686768a27","https://www.semanticscholar.org/paper/abac9af9174e8be2f605453695d98e3686768a27",2,"ArtGPT-4: Artistic Vision-Language Understanding with Adapter-enhanced MiniGPT-4","A novel multimodal model called ArtGPT-4 has been proposed to address some challenges in image understanding, particularly in artistic pictures, and novel benchmarks for evaluating the performance of vision-language models are proposed.","arXiv.org",2023,"Zheng Yuan,HU Xue,Xinyi Wang,Yongming Liu,Zhuanzhe Zhao,Kun Wang",0,42,0
"af0775ba00f359bc99c8be6f26506295d4089be2","https://www.semanticscholar.org/paper/af0775ba00f359bc99c8be6f26506295d4089be2",2,"On the Hidden Mystery of OCR in Large Multimodal Models","This study conducted a comprehensive study of existing publicly available multimodal models, evaluating their performance in text recognition, text-based visual question answering, key information extraction, and handwritten mathematical expression recognition.","arXiv.org",2023,"Yuliang Liu,Zhang Li,Hongliang Li,Wenwen Yu,Mingxin Huang,Dezhi Peng,Mingyu Liu,Mingrui Chen,Chunyuan Li,Lianwen Jin,Xiang Bai",1,61,0
"3f0c4d50050e8d74993b020897abaee8d1e8054d","https://www.semanticscholar.org/paper/3f0c4d50050e8d74993b020897abaee8d1e8054d",2,"Evaluating Object Hallucination in Large Vision-Language Models","This work presents the first systematic study on object hallucination of LVLMs, and designs an improved evaluation method by proposing a polling-based query method called POPE, which can evaluate the object hallucinated objects in a more stable and flexible way.","arXiv.org",2023,"Yifan Li,Yifan Du,Kun Zhou,Jinpeng Wang,Wayne Xin Zhao,Ji-rong Wen",2,41,0
"a979975d1a0aea0e01423f092249cc3de575b6cd","https://www.semanticscholar.org/paper/a979975d1a0aea0e01423f092249cc3de575b6cd",2,"X-IQE: eXplainable Image Quality Evaluation for Text-to-Image Generation with Visual Large Language Models","A novel explainable image quality evaluation approach called X-IQE, which leverages visual large language models (LLMs) to evaluate text-to-image generation methods by generating textual explanations by utilizing a hierarchical Chain of Thought to enable MiniGPT-4 to produce self-consistent, unbiased texts that are highly correlated with human evaluation.","arXiv.org",2023,"Yixiong Chen,Li Liu,C. Ding",1,56,0
"1bdd5fc17cc580efe998304692639c57c857cc84","https://www.semanticscholar.org/paper/1bdd5fc17cc580efe998304692639c57c857cc84",2,"Going Denser with Open-Vocabulary Part Segmentation","A detector with the ability to predict both open-vocabulary objects and their part segmentation and training on the joint of part-level, object-level and image-level data to build the multi-granularity alignment between language and image.","arXiv.org",2023,"Pei Sun,Shoufa Chen,Chenchen Zhu,Fanyi Xiao,Ping Luo,Saining Xie,Zhicheng Yan",0,94,0
"33f9ddca2469bf4831dcab085e1620792b1a6a80","https://www.semanticscholar.org/paper/33f9ddca2469bf4831dcab085e1620792b1a6a80",2,"LLM Itself Can Read and Generate CXR Images","This work presents a novel method to fine-tune a pre-trained LLM to read and generate images like text without any structural changes, extra training objectives, or the need for training an ad-hoc network while still preserving the of the instruction-following capability of the LLM.","arXiv.org",2023,"Suhyeon Lee,Won Jun Kim,Jong-Chul Ye",0,49,0
"f9bfc6d9ba1665b73af3323d46c7642b852759ef","https://www.semanticscholar.org/paper/f9bfc6d9ba1665b73af3323d46c7642b852759ef",2,"VideoLLM: Modeling Video Sequence with Large Language Models","This work proposes a novel framework called VideoLLM that leverages the sequence reasoning capabilities of pre-trained LLMs from natural language processing (NLP) for video sequence understanding and demonstrates that the understanding and Reasoning capabilities of LLMs can be effectively transferred to video understanding tasks.","arXiv.org",2023,"Guo Chen,Yin-Dong Zheng,Jiahao Wang,Jilan Xu,Yifei Huang,Junting Pan,Yi Wang,Yali Wang,Y. Qiao,Tong Lu,Limin Wang",0,101,0
"43a55dbd95c9d5cd82de8db276f41adeec4a937d","https://www.semanticscholar.org/paper/43a55dbd95c9d5cd82de8db276f41adeec4a937d",2,"Interactive Data Synthesis for Systematic Vision Adaptation via LLMs-AIGCs Collaboration","This work extensively study how LLMs communicate with AIGC model to achieve more controllable image generation and makes the first attempt to collaborate them for automatic data augmentation for a variety of downstream tasks.","arXiv.org",2023,"Qifan Yu,Juncheng Li,Wentao Ye,Siliang Tang,Yueting Zhuang",0,37,0
"e9a37d881abf7d94cb2c586f1cb26978343750ba","https://www.semanticscholar.org/paper/e9a37d881abf7d94cb2c586f1cb26978343750ba",2,"ReSee: Responding through Seeing Fine-grained Visual Knowledge in Open-domain Dialogue","Empirical, encouraging results not only demonstrate the effectiveness of introducing visual knowledge at both entity and turn level but also verify the proposed model ReSee outperforms several state-of-the-art methods on automatic and human evaluations.","arXiv.org",2023,"Haoqin Tu,Yitong Li,Fei Mi,Zhongliang Yang",0,55,0
"b82c1b0512d25307e3c81bb8d9df1607267a7a52","https://www.semanticscholar.org/paper/b82c1b0512d25307e3c81bb8d9df1607267a7a52",2,"MemeCap: A Dataset for Captioning and Interpreting Memes","The task of meme captioning is presented and a new dataset, MemeCap, containing 6.3K memes along with the title of the post containing the meme, the meme captions, the literal image caption, and the visual metaphors is released.","arXiv.org",2023,"EunJeong Hwang,V. Shwartz",1,38,0
"2ad8183c72a90511383a32ccaeea313eb85f4085","https://www.semanticscholar.org/paper/2ad8183c72a90511383a32ccaeea313eb85f4085",2,"DetGPT: Detect What You Need via Reasoning","This paper introduces a new paradigm for object detection that is called reasoning-based object detection, and leverages state-of-the-art multi-modal models and open-vocabulary object detectors to perform reasoning within the context of the user's instructions and the visual scene.","arXiv.org",2023,"Renjie Pi,Jiahui Gao,Shizhe Diao,Rui Pan,Hanze Dong,Jipeng Zhang,Lewei Yao,Jianhua Han,Hang Xu,Lingpeng Kong Tong Zhang",2,54,0
"d3f79210b54e168c76b8c311488f42d7d1048b81","https://www.semanticscholar.org/paper/d3f79210b54e168c76b8c311488f42d7d1048b81",2,"PandaGPT: One Model To Instruction-Follow Them All","PandaGPT is an approach to emPower large lANguage moDels with visual and Auditory instruction-following capabilities that can perform complex tasks such as detailed image description generation, writing stories inspired by videos, and answering questions about audios.","arXiv.org",2023,"Yixuan Su,Tian Lan,Huayang Li,Jialu Xu,Yan Wang,Deng Cai",2,29,0
"b13242323021bc1483a0d76e23428e324d409315","https://www.semanticscholar.org/paper/b13242323021bc1483a0d76e23428e324d409315",2,"NavGPT: Explicit Reasoning in Vision-and-Language Navigation with Large Language Models","The NavGPT is introduced, a purely LLM-based instruction-following navigation agent, to reveal the reasoning capability of GPT models in complex embodied scenes by performing zero-shot sequential action prediction for vision-and-language navigation (VLN).","arXiv.org",2023,"Gengze Zhou,Yicong Hong,Qi Wu",0,72,0
"7e3bbd7be60bb50a8093152795f269a69a4a0fd9","https://www.semanticscholar.org/paper/7e3bbd7be60bb50a8093152795f269a69a4a0fd9",2,"Chatting Makes Perfect - Chat-based Image Retrieval","This work introduces ChatIR: a chat-based image retrieval system that engages in a conversation with the user to elicit information, in addition to an initial query, in order to clarify the user's search intent.","arXiv.org",2023,"Matan Levy,Rami Ben-Ari,N. Darshan,D. Lischinski",0,55,0
"5fb7afae5fcacae1d40f109a348b43e00aa5d486","https://www.semanticscholar.org/paper/5fb7afae5fcacae1d40f109a348b43e00aa5d486",2,"Dense and Aligned Captions (DAC) Promote Compositional Reasoning in VL Models","A fine-tuning approach is proposed for automatically treating two factors limiting the VL models' compositional reasoning performance: the caption quality, or in other words `image-alignment', of the texts and the `density' of the captions in the sense of mentioning all the details appearing on the image.","arXiv.org",2023,"Sivan Doveh,Assaf Arbelle,Sivan Harary,Roei Herzig,Donghyun Kim,Paola Cascante-Bonilla,Amit Alfassy,R. Panda,R. Giryes,R. Feris,S. Ullman,Leonid Karlinsky",0,86,0
"0867f7029b3726740fb41ca8171833bf6f82e483","https://www.semanticscholar.org/paper/0867f7029b3726740fb41ca8171833bf6f82e483",2,"Exploring Open-Vocabulary Semantic Segmentation without Human Labels","This work presents ZeroSeg, a novel method that leverages the existing pretrained vision-language (VL) model to train open-vocabulary zero-shot semantic segmentation models, achieving state-of-the-art performance when compared to other zero- shot segmentation methods under the same training data, while also performing competitively compared to strongly supervised methods.","",2023,"Jun Chen,Deyao Zhu,Guocheng Qian,Bernard Ghanem,Zhicheng Yan,Chenchen Zhu,Fanyi Xiao,Mohamed Elhoseiny,S. Culatana",0,58,0
"31a68755ca6899e6c360ec8568704ae74f223a25","https://www.semanticscholar.org/paper/31a68755ca6899e6c360ec8568704ae74f223a25",2,"GPT4Image: Can Large Pre-trained Models Help Vision Models on Perception Tasks?","This paper presents a new learning paradigm in which the knowledge extracted from large pre-trained models are utilized to help models like CNN and ViT learn enhanced representations and achieve better performance.","",2023,"N. Ding,Yehui Tang,Zhongqian Fu,Chaoting Xu,Kai Han,Yunhe Wang",0,50,0
"de8121dc3d2c69bdab172f37e31168ddf2e6e62f","https://www.semanticscholar.org/paper/de8121dc3d2c69bdab172f37e31168ddf2e6e62f",2,"Segment Everything Everywhere All at Once","SEEM is a promptable, interactive model for Segmenting Everything Everywhere all at once in an image by incorporating learnable memory prompts to retain dialog history information via mask-guided cross-attention.","arXiv.org",2023,"Xueyan Zou,Jianwei Yang,Hao Zhang,Feng Li,Linjie Li,Jianfeng Gao,Yong Jae Lee",19,65,5
"508d9b43832790b4d35f4ae1fa76e9712859d6aa","https://www.semanticscholar.org/paper/508d9b43832790b4d35f4ae1fa76e9712859d6aa",2,"Vision and Structured-Language Pretraining for Cross-Modal Food Retrieval","VLPCook outperforms current SoTA by a significant margin on the task of Cross-Modal Food Retrieval on the large Recipe1M dataset and validates the generalization of the approach to other tasks and domains with structured text such as the Medical domain on the ROCO dataset.","",2022,"Mustafa Shukor,Nicolas Thome,M. Cord",0,85,0
"1329484d20c470b84e46ed7453786cee0acad2e0","https://www.semanticscholar.org/paper/1329484d20c470b84e46ed7453786cee0acad2e0",2,"BLIP-2: Bootstrapping Language-Image Pre-training with Frozen Image Encoders and Large Language Models","BLIP-2 achieves state-of-the-art performance on various vision-language tasks, despite having significantly fewer trainable parameters than existing methods, and is demonstrated's emerging capabilities of zero-shot image-to-text generation that can follow natural language instructions.","arXiv.org",2023,"Junnan Li,Dongxu Li,S. Savarese,Steven Hoi",191,43,66
"fbfef4723d8c8467d7bd523e1d0b703cce0e0f9c","https://www.semanticscholar.org/paper/fbfef4723d8c8467d7bd523e1d0b703cce0e0f9c",2,"Language Is Not All You Need: Aligning Perception with Language Models","This work introduces Kosmos-1, a Multimodal Large Language Model (MLLM) that can perceive general modalities, learn in context, and follow instructions, and shows that MLLMs can benefit from cross-modal transfer, i.e., transfer knowledge from language to multimodals, and from multimodal to language.","arXiv.org",2023,"Shaohan Huang,Li Dong,Wenhui Wang,Y. Hao,Saksham Singhal,Shuming Ma,Tengchao Lv,Lei Cui,O. Mohammed,Qiang Liu,Kriti Aggarwal,Zewen Chi,Johan Bjorck,Vishrav Chaudhary,Subhojit Som,Xia Song,Furu Wei",55,67,8
"69cfdc8df16ae63b7acba4ac6f727f78b86893c3","https://www.semanticscholar.org/paper/69cfdc8df16ae63b7acba4ac6f727f78b86893c3",2,"ChatGPT Asks, BLIP-2 Answers: Automatic Questioning Towards Enriched Visual Descriptions","This paper introduces ChatCaptioner, a novel automatic-questioning method deployed in image captioning that identifies 53% more objects within the image than BLIP-2 alone measured by WordNet synset matching.","arXiv.org",2023,"Deyao Zhu,Jun Chen,Kilichbek Haydarov,Xiaoqian Shen,Wenxuan Zhang,Mohamed Elhoseiny",10,51,2
"9d12916dd46df7a6446cbec0bc4d054f7dafcdab","https://www.semanticscholar.org/paper/9d12916dd46df7a6446cbec0bc4d054f7dafcdab",2,"Scaling Vision-Language Models with Sparse Mixture of Experts","The effectiveness of MoE in scaling vision-language models is explored, demonstrating its potential to achieve state-of-the-art performance on a range of benchmarks over dense models of equivalent computational cost.","arXiv.org",2023,"Sheng Shen,Z. Yao,Chunyuan Li,Trevor Darrell,K. Keutzer,Yuxiong He",3,74,1
"4396e30f28eb49bb07c63cf62ca90415ebbe43d4","https://www.semanticscholar.org/paper/4396e30f28eb49bb07c63cf62ca90415ebbe43d4",2,"IRGen: Generative Modeling for Image Retrieval","The framework, IRGen, is a unified model that enables end-to-end differentiable search, thus achieving superior performance thanks to direct optimization and tackling the key technical challenge of converting an image into quite a short sequence of semantic units in order to enable efficient and effective retrieval.","arXiv.org",2023,"Yidan Zhang,Ting Zhang,Dong Chen,Yujing Wang,Qi Chen,Xingxu Xie,Hao Sun,Weiwei Deng,Qi Zhang,Fan Yang,Mao Yang,Q. Liao,B. Guo",1,110,0
"3049c992adbd56e29c4d957ee0c4e9d05fe3c6d1","https://www.semanticscholar.org/paper/3049c992adbd56e29c4d957ee0c4e9d05fe3c6d1",2,"EVA-02: A Visual Representation for Neon Genesis","EVA-02, a next-generation Transformer-based visual representation pre-trained to reconstruct strong and robust language-aligned vision features via masked image modeling, is launched, demonstrating superior performance compared to prior state-of-the-art approaches across various representative vision tasks, while utilizing significantly fewer parameters and compute budgets.","arXiv.org",2023,"Yuxin Fang,Quan Sun,Xinggang Wang,Tiejun Huang,Xinlong Wang,Yue Cao",6,146,2
"d064075c47e358f604034d06df4b985356757c71","https://www.semanticscholar.org/paper/d064075c47e358f604034d06df4b985356757c71",2,"Equivariant Similarity for Vision-Language Foundation Models","This study proposes EqSim, a regularization loss that can be efficiently calculated from any two matched training pairs and easily pluggable into existing image-text retrieval fine-tuning and presents a new challenging benchmark EqBen, the first to focus on ""visual-minimal change"".","arXiv.org",2023,"Tan Wang,Kevin Lin,Linjie Li,Chung-Ching Lin,Zhengyuan Yang,Hanwang Zhang,Zicheng Liu,Lijuan Wang",1,73,1
"b259d853b71a2d03cefa844bb9343b8e3ed816b1","https://www.semanticscholar.org/paper/b259d853b71a2d03cefa844bb9343b8e3ed816b1",2,"LLaMA-Adapter: Efficient Fine-tuning of Language Models with Zero-init Attention","A zero-init attention mechanism with zero gating is proposed, which adaptively injects the new instructional cues into LLaMA, while effectively preserves its pre-trained knowledge.","arXiv.org",2023,"Renrui Zhang,Jiaming Han,Aojun Zhou,Xiangfei Hu,Shilin Yan,Pan Lu,Hongsheng Li,Peng Gao,Y. Qiao",30,63,2
"c84e2801512069acbc63f1a7f73273281939428c","https://www.semanticscholar.org/paper/c84e2801512069acbc63f1a7f73273281939428c",2,"A Study of Autoregressive Decoders for Multi-Tasking in Computer Vision","This work takes a close look at autoregressive decoders for multi-task learning in multimodal computer vision, including classification, captioning, visual question answering, and optical character recognition and compares these to well-tuned single-task baselines to highlight the cost incurred by multi-tasking.","arXiv.org",2023,"L. Beyer,Bo Wan,Gagan Madan,Filip Pavetic,A. Steiner,Alexander Kolesnikov,André Susano Pinto,Emanuele Bugliarello,Xiao Wang,Qihang Yu,Liang-Chieh Chen,Xiaohua Zhai",1,98,0
"db1c83ef73d2f7731b0dd255835f2f26db749e17","https://www.semanticscholar.org/paper/db1c83ef73d2f7731b0dd255835f2f26db749e17",2,"Not All Features Matter: Enhancing Few-shot CLIP with Adaptive Prior Refinement","This paper proposes APE, an Adaptive Prior rEfinement method for CLIP's pre-trained knowledge, which achieves superior accuracy with high computational efficiency and introduces two model variants, a training-free APE and aTraining-required APE-T.","arXiv.org",2023,"Xiang-yu Zhu,Renrui Zhang,Bowei He,A-Long Zhou,D. Wang,Bingyan Zhao,Peng Gao",2,100,0
"a43a3fadc9190e61b34f59a913f1716e443519e4","https://www.semanticscholar.org/paper/a43a3fadc9190e61b34f59a913f1716e443519e4",2,"On the Opportunities and Challenges of Foundation Models for Geospatial Artificial Intelligence","It is proposed that one of the major challenges of developing a FM for GeoAI is to address the multimodality nature of geospatial tasks and the possibility of a multimodal foundation model which can reason over various types ofGeoAI data through geosp spatial alignments is suggested.","arXiv.org",2023,"Gengchen Mai,Weiming Huang,Jin Sun,Suhang Song,Deepak Mishra,Ninghao Liu,Song Gao,Tianming Liu,G. Cong,Yingjie Hu,Chris Cundy,Ziyuan Li,Rui Zhu,Ni Lao",10,158,1
"b7d73f22d861f526541575a3b17449bd3c58ca74","https://www.semanticscholar.org/paper/b7d73f22d861f526541575a3b17449bd3c58ca74",2,"MVP-SEG: Multi-View Prompt Learning for Open-Vocabulary Semantic Segmentation","Experiments show that the multi-view prompts learned from seen categories have strong generalization to unseen categories, and MVP-SEG+ which combines the knowledge transfer stage significantly outperforms previous methods on several benchmarks, justifying that MVP- SEG does lead to better focus on different local parts.","arXiv.org",2023,"Jie Guo,Qimeng Wang,Yan Gao,Xiaolong Jiang,Xu Tang,Yao Hu,Baochang Zhang",1,56,0
