"id","url","score","title","summary","venue","year","authors","citationCount","referenceCount","influentialCitationCount"
"3f5b31c4f7350dc88002c121aecbdc82f86eb5bb","https://www.semanticscholar.org/paper/3f5b31c4f7350dc88002c121aecbdc82f86eb5bb",2,"BLIP-2: Bootstrapping Language-Image Pre-training with Frozen Image Encoders and Large Language Models","BLIP-2 achieves state-of-the-art performance on various vision-language tasks, despite having significantly fewer trainable parameters than existing methods, and is demonstrated's emerging capabilities of zero-shot image-to-text generation that can follow natural language instructions.","arXiv.org",2023,"Junnan Li,Dongxu Li,S. Savarese,Steven Hoi",286,43,91
"fbfef4723d8c8467d7bd523e1d0b703cce0e0f9c","https://www.semanticscholar.org/paper/fbfef4723d8c8467d7bd523e1d0b703cce0e0f9c",2,"Language Is Not All You Need: Aligning Perception with Language Models","This work introduces Kosmos-1, a Multimodal Large Language Model (MLLM) that can perceive general modalities, learn in context, and follow instructions, and shows that MLLMs can benefit from cross-modal transfer, i.e., transfer knowledge from language to multimodals, and from multimodal to language.","arXiv.org",2023,"Shaohan Huang,Li Dong,Wenhui Wang,Y. Hao,Saksham Singhal,Shuming Ma,Tengchao Lv,Lei Cui,O. Mohammed,Qiang Liu,Kriti Aggarwal,Zewen Chi,Johan Bjorck,Vishrav Chaudhary,Subhojit Som,Xia Song,Furu Wei",90,67,13
"69cfdc8df16ae63b7acba4ac6f727f78b86893c3","https://www.semanticscholar.org/paper/69cfdc8df16ae63b7acba4ac6f727f78b86893c3",2,"ChatGPT Asks, BLIP-2 Answers: Automatic Questioning Towards Enriched Visual Descriptions","This paper introduces ChatCaptioner, a novel automatic-questioning method deployed in image captioning that identifies 53% more objects within the image than BLIP-2 alone measured by WordNet synset matching.","arXiv.org",2023,"Deyao Zhu,Jun Chen,Kilichbek Haydarov,Xiaoqian Shen,Wenxuan Zhang,Mohamed Elhoseiny",13,51,3
"9d12916dd46df7a6446cbec0bc4d054f7dafcdab","https://www.semanticscholar.org/paper/9d12916dd46df7a6446cbec0bc4d054f7dafcdab",2,"Scaling Vision-Language Models with Sparse Mixture of Experts","The effectiveness of MoE in scaling vision-language models is explored, demonstrating its potential to achieve state-of-the-art performance on a range of benchmarks over dense models of equivalent computational cost.","arXiv.org",2023,"Sheng Shen,Z. Yao,Chunyuan Li,Trevor Darrell,K. Keutzer,Yuxiong He",4,74,1
"4396e30f28eb49bb07c63cf62ca90415ebbe43d4","https://www.semanticscholar.org/paper/4396e30f28eb49bb07c63cf62ca90415ebbe43d4",2,"IRGen: Generative Modeling for Image Retrieval","The framework, IRGen, is a unified model that enables end-to-end differentiable search, thus achieving superior performance thanks to direct optimization and tackling the key technical challenge of converting an image into quite a short sequence of semantic units in order to enable efficient and effective retrieval.","arXiv.org",2023,"Yidan Zhang,Ting Zhang,Dong Chen,Yujing Wang,Qi Chen,Xingxu Xie,Hao Sun,Weiwei Deng,Qi Zhang,Fan Yang,Mao Yang,Q. Liao,B. Guo",2,110,0
"3049c992adbd56e29c4d957ee0c4e9d05fe3c6d1","https://www.semanticscholar.org/paper/3049c992adbd56e29c4d957ee0c4e9d05fe3c6d1",2,"EVA-02: A Visual Representation for Neon Genesis","EVA-02, a next-generation Transformer-based visual representation pre-trained to reconstruct strong and robust language-aligned vision features via masked image modeling, is launched, demonstrating superior performance compared to prior state-of-the-art approaches across various representative vision tasks, while utilizing significantly fewer parameters and compute budgets.","arXiv.org",2023,"Yuxin Fang,Quan Sun,Xinggang Wang,Tiejun Huang,Xinlong Wang,Yue Cao",7,146,2
"d064075c47e358f604034d06df4b985356757c71","https://www.semanticscholar.org/paper/d064075c47e358f604034d06df4b985356757c71",2,"Equivariant Similarity for Vision-Language Foundation Models","This study proposes EqSim, a regularization loss that can be efficiently calculated from any two matched training pairs and easily pluggable into existing image-text retrieval fine-tuning and presents a new challenging benchmark EqBen, the first to focus on ""visual-minimal change"".","arXiv.org",2023,"Tan Wang,Kevin Lin,Linjie Li,Chung-Ching Lin,Zhengyuan Yang,Hanwang Zhang,Zicheng Liu,Lijuan Wang",2,73,1
"a757999ed260d7bc45484dc6b4456bf33fe6f679","https://www.semanticscholar.org/paper/a757999ed260d7bc45484dc6b4456bf33fe6f679",2,"LLaMA-Adapter: Efficient Fine-tuning of Language Models with Zero-init Attention","A zero-initialized attention mechanism with zero gating is proposed, which adaptively injects the new instructional cues into LLaMA, while effectively preserves its pre-trained knowledge on traditional vision and language tasks, demonstrating the superior generalization capacity of the approach.","arXiv.org",2023,"Renrui Zhang,Jiaming Han,Aojun Zhou,Xiangfei Hu,Shilin Yan,Pan Lu,Hongsheng Li,Peng Gao,Y. Qiao",53,99,7
"c84e2801512069acbc63f1a7f73273281939428c","https://www.semanticscholar.org/paper/c84e2801512069acbc63f1a7f73273281939428c",2,"A Study of Autoregressive Decoders for Multi-Tasking in Computer Vision","This work takes a close look at autoregressive decoders for multi-task learning in multimodal computer vision, including classification, captioning, visual question answering, and optical character recognition and compares these to well-tuned single-task baselines to highlight the cost incurred by multi-tasking.","arXiv.org",2023,"L. Beyer,Bo Wan,Gagan Madan,Filip Pavetic,A. Steiner,Alexander Kolesnikov,André Susano Pinto,Emanuele Bugliarello,Xiao Wang,Qihang Yu,Liang-Chieh Chen,Xiaohua Zhai",3,98,0
"db1c83ef73d2f7731b0dd255835f2f26db749e17","https://www.semanticscholar.org/paper/db1c83ef73d2f7731b0dd255835f2f26db749e17",2,"Not All Features Matter: Enhancing Few-shot CLIP with Adaptive Prior Refinement","This paper proposes APE, an Adaptive Prior rEfinement method for CLIP's pre-trained knowledge, which achieves superior accuracy with high computational efficiency and introduces two model variants, a training-free APE and aTraining-required APE-T.","arXiv.org",2023,"Xiang-yu Zhu,Renrui Zhang,Bowei He,A-Long Zhou,D. Wang,Bingyan Zhao,Peng Gao",2,100,0
"a43a3fadc9190e61b34f59a913f1716e443519e4","https://www.semanticscholar.org/paper/a43a3fadc9190e61b34f59a913f1716e443519e4",2,"On the Opportunities and Challenges of Foundation Models for Geospatial Artificial Intelligence","It is proposed that one of the major challenges of developing a FM for GeoAI is to address the multimodality nature of geospatial tasks and the possibility of a multimodal foundation model which can reason over various types ofGeoAI data through geosp spatial alignments is suggested.","arXiv.org",2023,"Gengchen Mai,Weiming Huang,Jin Sun,Suhang Song,Deepak Mishra,Ninghao Liu,Song Gao,Tianming Liu,G. Cong,Yingjie Hu,Chris Cundy,Ziyuan Li,Rui Zhu,Ni Lao",19,158,1
"b7d73f22d861f526541575a3b17449bd3c58ca74","https://www.semanticscholar.org/paper/b7d73f22d861f526541575a3b17449bd3c58ca74",2,"MVP-SEG: Multi-View Prompt Learning for Open-Vocabulary Semantic Segmentation","Experiments show that the multi-view prompts learned from seen categories have strong generalization to unseen categories, and MVP-SEG+ which combines the knowledge transfer stage significantly outperforms previous methods on several benchmarks, justifying that MVP- SEG does lead to better focus on different local parts.","arXiv.org",2023,"Jie Guo,Qimeng Wang,Yan Gao,Xiaolong Jiang,Xu Tang,Yao Hu,Baochang Zhang",2,56,0
"c3068e2a9f4cd374c7ff3be1b8f877b3d653e880","https://www.semanticscholar.org/paper/c3068e2a9f4cd374c7ff3be1b8f877b3d653e880",2,"Multimodal Neural Databases","This paper proposes a new framework, inspired by recent work on neural databases, which is named Multimodal Neural Databases (MMNDBs), which can answer complex database-like queries that involve reasoning over different input modalities, such as text and images, at scale.","arXiv.org",2023,"Giovanni Trappolini,Andrea Santilli,E. Rodolà,A. Halevy,F. Silvestri",1,38,0
"b07fa63a6d2f39900f0f2cae8f58cd5507010aad","https://www.semanticscholar.org/paper/b07fa63a6d2f39900f0f2cae8f58cd5507010aad",2,"Multi-Prompt with Depth Partitioned Cross-Modal Learning","This study introduces the Partitioned Multi-modal Prompt (PMPO), a multi- modal prompting technique that extends the soft prompt from a single learnable prompt to multiple prompts, and incorporates prior information from manually designed templates and learnable multi-prompts, thus improving the generalization capabilities of the approach.","arXiv.org",2023,"Yiqi Wang,Xianda Guo,Zheng Hua Zhu,Yingjie Tian",0,43,0
"0340c850e033abbf71c7214e403c8fe2be5ef91f","https://www.semanticscholar.org/paper/0340c850e033abbf71c7214e403c8fe2be5ef91f",2,"Visual Tuning","This survey characterizes a large and thoughtful selection of recent works, providing a systematic and comprehensive overview of existing work and models and categorizes recent visual tuning techniques into five groups: prompt tuning, adapter tuning, parameter tuning, and remapping tuning.","arXiv.org",2023,"Bruce X. B. Yu,Jianlong Chang,Haixin Wang,Lin Liu,Shijie Wang,Zhiyu Wang,Junfan Lin,Lingxi Xie,Haojie Li,Zhouchen Lin,Qi Tian,Chang Wen Chen",0,289,0
"8badb0587fef2ffc078b0cec549eb8ec96ed3ad4","https://www.semanticscholar.org/paper/8badb0587fef2ffc078b0cec549eb8ec96ed3ad4",2,"Self-Chained Image-Language Model for Video Localization and Question Answering","Self-Chained Video Localization-Answering (SeViLA), a novel framework that leverages a single image-language model (BLIP-2) to tackle both temporal keyframe localization and QA on videos, outperforms several strong baselines/previous works on five video QA and event prediction tasks, and achieves the state-of-the-art in both fine-tuning and zero-shot settings.","arXiv.org",2023,"Shoubin Yu,Jaemin Cho,Prateek Yadav,Mohit Bansal",0,80,0
"38be7643bcad936739550a1802220eb53ca9b1df","https://www.semanticscholar.org/paper/38be7643bcad936739550a1802220eb53ca9b1df",2,"Simple Token-Level Confidence Improves Caption Correctness","This work explores Token-Level Confidence, or TLC, as a simple yet surprisingly effective method to assess caption correctness, and fine-tune a vision-language model on image captioning, input an image and proposed caption to the model, and aggregate either algebraic or learned token confidences over words or sequences to estimate image-caption consistency.","arXiv.org",2023,"Suzanne Petryk,Spencer Whitehead,Joseph Gonzalez,Trevor Darrell,Anna Rohrbach,Marcus Rohrbach",0,73,0
"8ae2e81495d426419e6fd96940b651002c046b61","https://www.semanticscholar.org/paper/8ae2e81495d426419e6fd96940b651002c046b61",2,"Enhancing Vision-Language Pre-Training with Jointly Learned Questioner and Dense Captioner","A novel method called Joint QA and DC GEneration (JADE), which utilizes a pre-trained multimodal model and easily-crawled image-text pairs to automatically generate and filter large-scale VQA and dense captioning datasets.","arXiv.org",2023,"Zikang Liu,Sihan Chen,Longteng Guo,Handong Li,Xingjian He,J. Liu",0,57,0
"6118eb18023429fa8bad64b7a1d95533127a62d7","https://www.semanticscholar.org/paper/6118eb18023429fa8bad64b7a1d95533127a62d7",2,"Prompt ChatGPT In MNER: Improved multimodal named entity recognition method based on auxiliary refining knowledge from ChatGPT","This paper uses ChatGPT as an implicit knowledge engine to acquire auxiliary refined knowledge, thereby bolstering the model's performance in MNER tasks and significantly outperforms all existing state-of-the-art methods on two classic MNER datasets.","arXiv.org",2023,"Jinyuan Li,Han Li,Zhufeng Pan,Gang Pan",1,48,0
"d57caa06a42baa90eb741a9afb10fe4fff8be82a","https://www.semanticscholar.org/paper/d57caa06a42baa90eb741a9afb10fe4fff8be82a",2,"SmartTrim: Adaptive Tokens and Parameters Pruning for Efficient Vision-Language Models","This work proposes an adaptive acceleration method SmartTrim for VLMs, which adjusts the inference overhead based on the complexity of instances, and incorporates lightweight trimming modules into the backbone to perform task-specific pruning on redundant inputs and parameters without the need for additional pre-training or data augmentation.","arXiv.org",2023,"Zekun Wang,Jingchang Chen,Wangchunshu Zhou,Ming Liu,Bing Qin",0,85,0
"c2c7ad3112c4b575e5d8163a0e574f9eb743cb52","https://www.semanticscholar.org/paper/c2c7ad3112c4b575e5d8163a0e574f9eb743cb52",2,"Zero-shot Visual Question Answering with Language Model Feedback","A novel language model guided captioning approach, LAMOC, for knowledge-based visual question answering (VQA), which outperforms several competitive zero-shot methods and even achieves comparable results to a fine-tuned VLP model.","arXiv.org",2023,"Yifan Du,Junyi Li,Tianyi Tang,Wayne Xin Zhao,Ji-rong Wen",0,40,0
"5c183d241fe54a6d67e21eea48fbd5ea6b31ec1c","https://www.semanticscholar.org/paper/5c183d241fe54a6d67e21eea48fbd5ea6b31ec1c",2,"VAST: A Vision-Audio-Subtitle-Text Omni-Modality Foundation Model and Dataset","Based on the proposed VAST-27M dataset, an omni-modality video-text foundational model named VAST is trained, which can perceive and process vision, audio, and subtitle modalities from video, and better support various tasks including vision- Text, audio-text, and multi-modal video- text tasks (retrieval, captioning and QA).","arXiv.org",2023,"Sihan Chen,Handong Li,Qunbo Wang,Zijia Zhao,Ming-Ting Sun,Xinxin Zhu,J. Liu",0,100,0
"fd928577d67dd01048d13f284a6256164bbcf2f0","https://www.semanticscholar.org/paper/fd928577d67dd01048d13f284a6256164bbcf2f0",2,"Learning without Forgetting for Vision-Language Models","ProjectiOn Fusion (PROOF) is proposed that enables VLMs to learn without forgetting and jointly adjusting visual and textual features, the model can capture semantic information with stronger representation ability.","arXiv.org",2023,"Da-Wei Zhou,Yuanhan Zhang,Jingyi Ning,Han-Jia Ye,De-chuan Zhan,Ziwei Liu",0,84,0
"8213492345c67d2b0e692b6bb5c814d4f1aef8d2","https://www.semanticscholar.org/paper/8213492345c67d2b0e692b6bb5c814d4f1aef8d2",2,"Benchmarking Robustness of Adaptation Methods on Pre-trained Vision-Language Models","The robustness of 11 widely-used adaptation methods across 4 vision-language datasets under multimodal corruptions is assessed and it is indicated that increasing the number of adaptation data and parameters does not guarantee enhanced robustness; instead it results in even lower robustness.","arXiv.org",2023,"Shuo Chen,Jindong Gu,Zhen Han,Yunpu Ma,Philip H. S. Torr,Volker Tresp",0,77,0
"99368d6fc86e2eb181d9d36165cfed578bfe938d","https://www.semanticscholar.org/paper/99368d6fc86e2eb181d9d36165cfed578bfe938d",2,"Q: How to Specialize Large Vision-Language Models to Data-Scarce VQA Tasks? A: Self-Train on Unlabeled Images!","This work introduces SelTDA (Self-Taught Data Augmentation), a strategy for finetuning large VLMs on small-scale VQA datasets and describes a series of experiments showing that the proposed strategy increases robustness to adversarially searched questions, counterfactual examples and rephrasings, improves domain generalization, and results in greater retention of numerical reasoning skills.","arXiv.org",2023,"Zaid Khan,B. Vijaykumar,S. Schulter,Xiang Yu,Y. Fu,Manmohan Chandraker",0,64,0
"c581d2ad3b092a2cc152d0c6f55fd6320f78eb3a","https://www.semanticscholar.org/paper/c581d2ad3b092a2cc152d0c6f55fd6320f78eb3a",2,"A Survey of Vision-Language Pre-training from the Lens of Multimodal Machine Translation","The landscape of language-and-vision pre-training from the lens of multimodal machine translation is surveyed, which summarizes the common architectures, pre- training objectives, and datasets from literature and conjecture what further is needed to make progress on multimodAL machine translation.","arXiv.org",2023,"Jeremy Gwinnup,Kevin Duh",0,50,0
"a42fc49a300136d60aaebb668369010ee7746150","https://www.semanticscholar.org/paper/a42fc49a300136d60aaebb668369010ee7746150",2,"Visual Language Pretrained Multiple Instance Zero-Shot Transfer for Histopathology Images","This paper presents MI-Zero, a simple and intuitive framework for unleashing the zero-shot transfer capabilities of contrastively aligned image and text models on gigapixel histopathology whole slide images, enabling multiple downstream diagnostic tasks to be carried out by pretrained encoders without requiring any additional labels.","arXiv.org",2023,"Ming Y. Lu,Bowen Chen,Andrew Zhang,Drew F. K. Williamson,Richard J. Chen,Tong Ding,L. Le,Yung-Sung Chuang,Faisal Mahmood",0,88,0
"1474d4248e1cbcc91183456cdf1e7272e8a931de","https://www.semanticscholar.org/paper/1474d4248e1cbcc91183456cdf1e7272e8a931de",2,"COSA: Concatenated Sample Pretrained Vision-Language Foundation Model","COSA, a COncatenated SAmple pretrained vision-language foundation model, jointly models visual contents and event-level temporal cues using only image-text corpora and achieves state-of-the-art results on various competitive benchmarks.","arXiv.org",2023,"Sihan Chen,Xingjian He,Handong Li,Xiaojie Jin,Jiashi Feng,J. Liu",0,82,0
"e9e6e08a9a39aa8d60b41da22cfb5670e64adeaf","https://www.semanticscholar.org/paper/e9e6e08a9a39aa8d60b41da22cfb5670e64adeaf",2,"RS5M: A Large Scale Vision-Language Dataset for Remote Sensing Vision-Language Foundation Model","A new framework that includes the Domain Foundation Model (DFM), bridging the gap between the General Foundation model (GFM) and domain-specific downstream tasks is proposed, and an image-text paired dataset in the field of remote sensing, RS5M, which has 5 million RS images with English descriptions is presented.","arXiv.org",2023,"Zilun Zhang,Tiancheng Zhao,Yulong Guo,Jianwei Yin",0,107,0
"dedbac319177d04ce63fe00d2fec24bdaab90d6d","https://www.semanticscholar.org/paper/dedbac319177d04ce63fe00d2fec24bdaab90d6d",2,"SugarCrepe: Fixing Hackable Benchmarks for Vision-Language Compositionality","This work introduces SugarCrepe, a new benchmark for vision-language compositionality evaluation that employs large language models, instead of rule-based templates used in previous benchmarks, to generate fluent and sensical hard negatives, and utilizes an adversarial refinement mechanism to maximally reduce biases.","arXiv.org",2023,"Cheng-Yu Hsieh,Jieyu Zhang,Zixian Ma,Aniruddha Kembhavi,Ranjay Krishna",1,44,0
"d212fa27f5868f0fd106e1a7bba908fd47da0816","https://www.semanticscholar.org/paper/d212fa27f5868f0fd106e1a7bba908fd47da0816",2,"MotionGPT: Human Motion as a Foreign Language","This work proposes MotionGPT, a unified, versatile, and user-friendly motion-language model to handle multiple motion-relevant tasks that achieves state-of-the-art performances on multiple motion tasks including text-driven motion generation, motion captioning, motion prediction, and motion in-between.","arXiv.org",2023,"Biao Jiang,Xin Chen,Wen Liu,Jingyi Yu,Gang Yu,Tao Chen",1,73,0
"2f8e2feb7161135c778b0f128e9e6557a51fc7bf","https://www.semanticscholar.org/paper/2f8e2feb7161135c778b0f128e9e6557a51fc7bf",2,"Distilling Large Vision-Language Model with Out-of-Distribution Generalizability","This paper investigates the distillation of visual representations in large teacher vision-language models into lightweight student models using a small- or mid-scale dataset and proposes two principles from vision and language modality perspectives to enhance student's OOD generalization.","arXiv.org",2023,"Xuanlin Li,Yunhao Fang,Minghua Liu,Z. Ling,Z. Tu,Haoran Su",0,68,0
"420f03d44a3bee8c1c51216e1045d0ff92e8fefc","https://www.semanticscholar.org/paper/420f03d44a3bee8c1c51216e1045d0ff92e8fefc",2,"Vision Language Transformers: A Survey","A broad synthesis of the currently available research on vision language transformer models is provided and some analysis of their strengths, limitations and some open questions that remain are offered.","arXiv.org",2023,"Clayton Fields,C. Kennington",1,92,0
"5d8fd04c436367b18b35e28332ee8e452a477f3f","https://www.semanticscholar.org/paper/5d8fd04c436367b18b35e28332ee8e452a477f3f",2,"Medical Image Understanding with Pretrained Vision Language Models: A Comprehensive Study","It is shown that well-designed medical prompts are the key to elicit knowledge from pre-trained VLMs, and by prompting with expressive attributes that are shared between domains, the VLM can carry the knowledge across domains and improve its generalization.","International Conference on Learning Representations",2022,"Ziyuan Qin,Huahui Yi,Qicheng Lao,Kang Li",9,53,0
"131c6f328c11706de2c43cd16e0b7c5d5e610b6a","https://www.semanticscholar.org/paper/131c6f328c11706de2c43cd16e0b7c5d5e610b6a",2,"Harnessing the Power of LLMs in Practice: A Survey on ChatGPT and Beyond","A comprehensive and practical guide for practitioners and end-users working with Large Language Models in their downstream natural language processing (NLP) tasks, enabling the successful implementation of these models in a wide range of NLP tasks.","arXiv.org",2023,"Jingfeng Yang,Hongye Jin,Ruixiang Tang,Xiaotian Han,Qizhang Feng,Haoming Jiang,Bing Yin,Xia Hu",32,127,2
"51b169701290cd129e0781fc9f3a9918604c89b5","https://www.semanticscholar.org/paper/51b169701290cd129e0781fc9f3a9918604c89b5",2,"Improving accuracy of GPT-3/4 results on biomedical data using a retrieval-augmented language model","It is suggested that RetA models, supplemented with domain-specific corpora, may outperform general-purpose LLMs in accuracy and relevance within specific domains.","arXiv.org",2023,"D. Soong,S. Sridhar,Han Si,J. Wagner,Ana Caroline Costa S'a,Christina Y. Yu,Kubra Karagoz,Meijian Guan,Hisham K Hamadeh,Brandon Higgs",1,51,0
"362d4e00506f9bb39d42185a0b128f8602e139a8","https://www.semanticscholar.org/paper/362d4e00506f9bb39d42185a0b128f8602e139a8",2,"Utilizing ChatGPT to Enhance Clinical Trial Enrollment","","arXiv.org",2023,"Georgios Peikos,S. Symeonidis,Pranav Kasela,G. Pasi",0,105,0
"f646d3056ca02daa99820917b3ba48a43a0022e2","https://www.semanticscholar.org/paper/f646d3056ca02daa99820917b3ba48a43a0022e2",2,"SUR-adapter: Enhancing Text-to-Image Pre-trained Diffusion Models with Large Language Models","This work proposes a simple-yet-effective parameter-efficient fine-tuning approach called the Semantic Understanding and Reasoning adapter (SUR-adapter) for pre-trained diffusion models that can make text-to-image diffusion models easier to use with better user experience.","arXiv.org",2023,"Shan Zhong,Zhongzhan Huang,Wushao Wen,Jinghui Qin,Liang Lin",3,54,0
"052a5e2bcc999810ee6f1eedcf758c528e4f125f","https://www.semanticscholar.org/paper/052a5e2bcc999810ee6f1eedcf758c528e4f125f",2,"Retrieving Multimodal Information for Augmented Generation: A Survey","This survey provides an in-depth review of retrieval-augmented generation in different modalities and discusses potential future directions of this emerging field.","arXiv.org",2023,"Ruochen Zhao,Hailin Chen,Weishi Wang,Fangkai Jiao,Xuan Long Do,Chengwei Qin,Bosheng Ding,Xiaobao Guo,Minzhi Li,Xingxuan Li,Shafiq R. Joty",5,150,0
"357fc385caf2e5b9898c9140fa3ac9955e6bb3c6","https://www.semanticscholar.org/paper/357fc385caf2e5b9898c9140fa3ac9955e6bb3c6",2,"TeamS at VQA-Med 2021: BBN-Orchestra for Long-tailed Medical Visual Question Answering","The proposed BBN-Orchestra is an ensemble of bilateral-branch networks (BBN) and successfully reduces overfitting to train and validation data in addition to effectively modeling the imbalanced long-tailed image distribution.","Conference and Labs of the Evaluation Forum",2021,"Sedigheh Eslami,Gerard de Melo,C. Meinel",6,13,0
"2441230bd2f3cca924d597b3044ad63aaff269ec","https://www.semanticscholar.org/paper/2441230bd2f3cca924d597b3044ad63aaff269ec",2,"Self-supervised Co-learning of Uncurated Images and Reports Enables Oversight AI in Radiology","A self-supervised model tailored for efficient vision-language pre-training that exploits cross attention in the radiological images and - trained medical X-VL model outperforms the current state-of-the-art models in various vision- language tasks in medical domains.","",2022,"Sangjoon Park,Eunha Lee,K. Shin,Jeonghyeon Lee,Jong-Chul Ye",4,49,0
"79478a2ac67b9fdbeadcde13faa2d84eb239e080","https://www.semanticscholar.org/paper/79478a2ac67b9fdbeadcde13faa2d84eb239e080",2,"Vision-Language Pretraining Enables Radiographs and Reports to be Learned without Curation","It is experimentally demonstrated that the pre-trained medical X-VL model outperforms the current state-of-the-art models in various vision-language tasks in medical domains, which suggests the potential of the model for widespread applicability in different medical applications.","",2022,"Sangjoon Park,Eunha Lee,Jeonghyeon Lee,Jong-Chul Ye",0,50,0
"b047b3b7d76b79958e23b0fcab985be22b1ce42d","https://www.semanticscholar.org/paper/b047b3b7d76b79958e23b0fcab985be22b1ce42d",2,"Alternating Cross-attention Vision-Language Model for Efficient Learning with Medical Image and Report without Curation","It is experimentally demonstrated that the pre-trained MAX-VL model outperforms the current state-of-the-art vision language models in various vision-language tasks and suggested the clinical utility for the diagnosis of newly emerging diseases and human error detection as well as showed the widespread applicability of the model in different domain data.","arXiv.org",2022,"Sangjoon Park,Eunha Lee,Jeonghyeon Lee,Jong-Chul Ye",0,47,0
