"id","url","score","title","summary","venue","year","authors","citationCount","referenceCount","influentialCitationCount"
"a3ff4df653b6970898c04e6b768e58b99786d073","https://www.semanticscholar.org/paper/a3ff4df653b6970898c04e6b768e58b99786d073",1,"Learning gain differences between ChatGPT and human tutor generated algebra hints","This paper conducts the first learning gain evaluation of ChatGPT by comparing the efficacy of its hints with hints authored by human tutors with 77 participants across two algebra topic areas, Elementary Algebra and Intermediate Algebra.","arXiv.org",2023,"Z. Pardos,Shreya Bhandari",5,30,2
"c8f98f28f1f28a9f5db7c4b4d9a6b7853a100214","https://www.semanticscholar.org/paper/c8f98f28f1f28a9f5db7c4b4d9a6b7853a100214",1,"Can Pre-trained Vision and Language Models Answer Visual Information-Seeking Questions?","The analysis shows that it is challenging for the state-of-the-art multi-modal pre-trained models to answer visual information seeking questions, but this capability is improved through fine-tuning on the automated InfoSeek dataset.","arXiv.org",2023,"Yang Chen,Hexiang Hu,Yi Luan,Haitian Sun,Soravit Changpinyo,Alan Ritter,Ming-Wei Chang",1,58,0
"467b839cb8a2475477ca004df94b797d967ad057","https://www.semanticscholar.org/paper/467b839cb8a2475477ca004df94b797d967ad057",1,"Human-Art: A Versatile Human-Centric Dataset Bridging Natural and Artificial Scenes","The Human-Art dataset is introduced and contains 50k high-quality images with over 123k person instances from 5 natural and 15 artificial scenarios, which are annotated with bounding boxes, keypoints, self-contact points, and text information for humans represented in both 2D and 3D.","arXiv.org",2023,"Xu Ju,Ailing Zeng,Jianan Wang,Qian Xu,Lei Zhang",2,88,0
"a7b3a868a80dbe97689135c99b1a6b6e10dcdfe5","https://www.semanticscholar.org/paper/a7b3a868a80dbe97689135c99b1a6b6e10dcdfe5",1,"A Comprehensive Survey of AI-Generated Content (AIGC): A History of Generative AI from GAN to ChatGPT","This survey provides a comprehensive review on the history of generative models, and basic components, recent advances in AIGC from unimmodal interaction and multimodal interaction, and introduces the generation tasks and relative models of text and image.","arXiv.org",2023,"Yihan Cao,Siyu Li,Yixin Liu,Zhiling Yan,Yutong Dai,Philip S. Yu,Lichao Sun",16,280,0
"6a4ef6c4799dc871a4253c0536126d397ca3ec1e","https://www.semanticscholar.org/paper/6a4ef6c4799dc871a4253c0536126d397ca3ec1e",1,"Interpretable Visual Question Answering Referring to Outside Knowledge","A novel multimodal interpretable VQA model that can answer the question more accurately and generate diverse explanations and can outperform state-of-the-art methods regarding answer accuracy and explanation rationality.","arXiv.org",2023,"He Zhu,Ren Togo,Takahiro Ogawa,M. Haseyama",0,29,0
"e5a7be5b9e6c368a1839455bfbb51bc07ed161f1","https://www.semanticscholar.org/paper/e5a7be5b9e6c368a1839455bfbb51bc07ed161f1",1,"ODIN: On-demand Data Formulation to Mitigate Dataset Lock-in","This work evaluated ODIN on various datasets in terms of model accuracy and data diversity to demonstrate its potential, and conducted post-experiments for further investigation.","arXiv.org",2023,"SP Choi,Jihun Lee,HyeongSeok Ahn,S. Jung,Bumsoo Kang",0,38,0
"aa75ec0ee1aa18d3b0603d5a425e92eabcb7ac02","https://www.semanticscholar.org/paper/aa75ec0ee1aa18d3b0603d5a425e92eabcb7ac02",1,"Breaking Common Sense: WHOOPS! A Vision-and-Language Benchmark of Synthetic and Compositional Images","This work introduces WHOOPS!, a new dataset and benchmark for visual commonsense, comprised of purposefully commonsense-defying images created by designers using publicly-available image generation tools like Midjourney and introduces a difficult explanation generation task, where models must identify and explain why a given image is unusual.","arXiv.org",2023,"Nitzan Bitton-Guetta,Yonatan Bitton,Jack Hessel,Ludwig Schmidt,Y. Elovici,G. Stanovsky,Roy Schwartz",4,44,1
"cf41ae462687f81ce95b27113c6a4f9c2751de42","https://www.semanticscholar.org/paper/cf41ae462687f81ce95b27113c6a4f9c2751de42",1,"Vision-Language Models as Success Detectors","This work focuses on developing robust success detectors that leverage large, pretrained vision-language models and human reward annotations, and investigates the generalisation properties of a Flamingo-based success detection model across unseen language and visual changes in the first two domains.","arXiv.org",2023,"Yuqing Du,Ksenia Konyushkova,Misha Denil,A. Raju,Jessica Landon,Felix Hill,N. D. Freitas,Serkan Cabi",3,54,0
"3c39a600adb254f7520f513ed9c3412c9c62f17f","https://www.semanticscholar.org/paper/3c39a600adb254f7520f513ed9c3412c9c62f17f",1,"MRIS: A Multi-modal Retrieval Approach for Image Synthesis on Diverse Modalities","The proposed method outperforms direct image synthesis and that the synthesized thickness maps retain information relevant to downstream tasks such as progression prediction and Kellgren-Lawrence grading (KLG).","arXiv.org",2023,"Boqi Chen,M. Niethammer",0,27,0
"049a62ac86f59f2a912cd59f1cb179b82c4ae6b9","https://www.semanticscholar.org/paper/049a62ac86f59f2a912cd59f1cb179b82c4ae6b9",1,"TIFA: Accurate and Interpretable Text-to-Image Faithfulness Evaluation with Question Answering","This work introduces TIFA (Text-to-Image Faithfulness evaluation with question Answering), an automatic evaluation metric that measures the faithfulness of a generated image to its text input via visual question answering (VQA).","arXiv.org",2023,"Yushi Hu,Benlin Liu,Jungo Kasai,Yizhong Wang,Mari Ostendorf,Ranjay Krishna,Noah A. Smith",7,62,4
"7733cf84e5447339dd57ca96133e14e36c29e0e7","https://www.semanticscholar.org/paper/7733cf84e5447339dd57ca96133e14e36c29e0e7",1,"Contrastive Alignment of Vision to Language Through Parameter-Efficient Transfer Learning","The feasibility and benefits of parameter-efficient contrastive vision-language alignment through transfer learning are explored: creating a model such as CLIP by minimally updating an already-trained vision and language model is found.","arXiv.org",2023,"Zaid Khan,Yun Fu",0,60,0
"285dae5c2f2ef55c70971094a1ddd45afe720eee","https://www.semanticscholar.org/paper/285dae5c2f2ef55c70971094a1ddd45afe720eee",1,"Fundamentals of Generative Large Language Models and Perspectives in Cyber-Defense","This review aims to provide a brief overview of the history, state of the art, and implications of Generative Language Models in terms of their principles, abilities, limitations, and future prospects -- especially in the context of cyber-defense, with a focus on the Swiss operational environment.","arXiv.org",2023,"Andrei Kucharavy,Z. Schillaci,Loic Mar'echal,Maxime Wursch,L. Dolamic,Remi Sabonnadiere,Dimitri Percia David,Alain Mermoud,Vincent Lenders",1,100,0
"0d3817ae7fecc204c7c79a039dc47ae88890d5f3","https://www.semanticscholar.org/paper/0d3817ae7fecc204c7c79a039dc47ae88890d5f3",1,"ChatGPT for Shaping the Future of Dentistry: The Potential of Multi-Modal Large Language Model","","arXiv.org",2023,"Hanyao Huang,Ou Zheng,Dongdong Wang,Jiayi Yin,Zijin Wang,Shengxuan Ding,H. Yin,Chuan Xu,R. Yang,Q. Zheng,B. Shi",1,46,0
"d84616f108ccbd958735fef7622e58d148b32139","https://www.semanticscholar.org/paper/d84616f108ccbd958735fef7622e58d148b32139",1,"Make-It-3D: High-Fidelity 3D Creation from A Single Image with Diffusion Prior","This work leverages prior knowledge from a well-trained 2D diffusion model to act as 3D-aware supervision for 3D creation and presents the first attempt to achieve high-quality3D creation from a single image for general objects.","arXiv.org",2023,"Junshu Tang,Tengfei Wang,Bo Zhang,Ting Zhang,Ran Yi,Lizhuang Ma,Dong Chen",4,63,1
"a08b7123a7158f1a7fbbc18e8b5aaebd47980ecf","https://www.semanticscholar.org/paper/a08b7123a7158f1a7fbbc18e8b5aaebd47980ecf",1,"EVA-CLIP: Improved Training Techniques for CLIP at Scale","This paper proposes a series of models that significantly improve the efficiency and effectiveness of CLIP training, and incorporates new techniques for representation learning, optimization, and augmentation, enabling EVA-CLIP to achieve superior performance compared to previous CLIP models with the same number of parameters but significantly smaller training costs.","arXiv.org",2023,"Quan Sun,Yuxin Fang,Ledell Yu Wu,Xinlong Wang,Yue Cao",7,52,2
"1c7471996a4f2e08a5ef592a6ffcde65a034a1e4","https://www.semanticscholar.org/paper/1c7471996a4f2e08a5ef592a6ffcde65a034a1e4",1,"GlyphDraw: Learning to Draw Chinese Characters in Image Synthesis Models Coherently","GlyphDraw is a general learning framework aiming at endowing image generation models with the capacity to generate images embedded with coherent text, and is the first work in the field of image synthesis to address the generation of Chinese characters.","arXiv.org",2023,"Jiancang Ma,Mingjun Zhao,Chen Chen,Ruichen Wang,Di Niu,H. Lu,Xiaodong Lin",1,42,1
"4d94dcc6c9c261c8edcd0f3c5a1318a98a45b79d","https://www.semanticscholar.org/paper/4d94dcc6c9c261c8edcd0f3c5a1318a98a45b79d",1,"HRS-Bench: Holistic, Reliable and Scalable Benchmark for Text-to-Image Models","HRS-Bench is introduced, a concrete evaluation benchmark for T2I models that is Holistic, Reliable, and Scalable and measures 13 skills that can be categorized into five major categories: accuracy, robustness, generalization, fairness, and bias.","arXiv.org",2023,"Eslam Mohamed Bakr,Pengzhan Sun,Xiaoqian Shen,Faizan Farooq Khan,Li Erran Li,Mohamed Elhoseiny",1,73,1
"f12ebcc9a0a7296cc6c85b243a003f7205c68b3d","https://www.semanticscholar.org/paper/f12ebcc9a0a7296cc6c85b243a003f7205c68b3d",1,"What does CLIP know about a red circle? Visual prompt engineering for VLMs","This work explores the idea of visual prompt engineering for solving computer vision tasks beyond classification by editing in image space instead of text, and discovers an emergent ability of CLIP, where, by simply drawing a red circle around an object, it can direct the model's attention to that region, while also maintaining global information.","arXiv.org",2023,"Aleksandar Shtedritski,C. Rupprecht,A. Vedaldi",2,63,0
"f603b9dc81dfea56d437e967b724636d4d72d000","https://www.semanticscholar.org/paper/f603b9dc81dfea56d437e967b724636d4d72d000",1,"LLM as A Robotic Brain: Unifying Egocentric Memory and Control","A novel and generalizable framework called LLM-Brain: using Large-scale Language Model as a robotic brain to unify egocentric memory and control, utilizing a zero-shot learning approach.","arXiv.org",2023,"Jinjie Mai,Jun Chen,Bing-chuan Li,Guocheng Qian,Mohamed Elhoseiny,Bernard Ghanem",1,24,0
"8fce3142bc144bdc08bf0cab1db908c7ad3f8454","https://www.semanticscholar.org/paper/8fce3142bc144bdc08bf0cab1db908c7ad3f8454",1,"Contrastive Language, Action, and State Pre-training for Robot Learning","The method, Contrastive Language, Action, and State Pre-training (CLASP), extends the CLIP formulation by incorporating distributional learning, capturing the inherent complexities and one-to-many relationships in behaviour-text alignment.","arXiv.org",2023,"Krishan Rana,Andrew Melnik,N. Sunderhauf",0,30,0
"598b3961f767c1ad40cbb393afd936de4e30d578","https://www.semanticscholar.org/paper/598b3961f767c1ad40cbb393afd936de4e30d578",1,"SATIN: A Multi-Task Metadataset for Classifying Satellite Imagery using Vision-Language Models","This work introduces SATellite ImageNet (SATIN), a metadataset curated from 27 existing remotely sensed datasets, and comprehensively evaluates the zero-shot transfer classification capabilities of a broad range of vision-language (VL) models on SATIN.","arXiv.org",2023,"J. Roberts,K. Han,Samuel Albanie",0,86,0
"59dfa986cc7468561d2c19cdb43f816406ea30d8","https://www.semanticscholar.org/paper/59dfa986cc7468561d2c19cdb43f816406ea30d8",1,"TR0N: Translator Networks for 0-Shot Plug-and-Play Conditional Generation","TR0N is proposed, a highly general framework to turn pre-trained unconditional generative models, such as GANs and VAEs, into conditional models, and shows how to turn unconditional models into class-conditional ones with the help of a classifier, and also into text-to-image models by leveraging CLIP.","arXiv.org",2023,"Zhao-Qian Liu,Noël Vouitsis,S. Gorti,Jimmy Ba,G. Loaiza-Ganem",0,85,0
"b1c26d02a44407de29ee11205d62a9ae72d51057","https://www.semanticscholar.org/paper/b1c26d02a44407de29ee11205d62a9ae72d51057",1,"Segment Anything is A Good Pseudo-label Generator for Weakly Supervised Semantic Segmentation","This report attempts to explore the potential of 'prompt to masks' from the powerful class-agnostic large segmentation model, segment-anything, by using different weak labels to be used as prompts to the segment- Anything model, generating precise class masks.","arXiv.org",2023,"Peng-Tao Jiang,Yuqi Yang",1,45,1
"b7e6408841054dcf6efcd9cd77de2561841210b4","https://www.semanticscholar.org/paper/b7e6408841054dcf6efcd9cd77de2561841210b4",1,"Personalize Segment Anything Model with One Shot","A training-free Personalization approach for SAM, termed as PerSAM, which effectively adapt SAM for private use without any training, and can enhance DreamBooth to personalize Stable Diffusion for text-to-image generation, which discards the background disturbance for better target appearance learning.","arXiv.org",2023,"Renrui Zhang,Zhengkai Jiang,Ziyu Guo,Shilin Yan,Junting Pan,Hao-Wen Dong,Peng Gao,Hongsheng Li",4,61,1
"042459a38c1efb4118030309f0bcd7d5ed77d83f","https://www.semanticscholar.org/paper/042459a38c1efb4118030309f0bcd7d5ed77d83f",1,"Image Captioners Sometimes Tell More Than Images They See","This work evaluates several image captioning models with respect to a disaster image classification task, CrisisNLP, and shows that descriptive text classifiers can sometimes achieve higher accuracy than standard image-based classifiers and that fusing an image- based classifier with a descriptive textclassifier can provide improvement in accuracy.","arXiv.org",2023,"Honori Udo,Takafumi Koshinaka",0,24,0
"69fa5dabbdc98ec63c3eaf95c0f70ec50699f0ce","https://www.semanticscholar.org/paper/69fa5dabbdc98ec63c3eaf95c0f70ec50699f0ce",1,"Towards Applying Powerful Large AI Models in Classroom Teaching: Opportunities, Challenges and Prospects","","arXiv.org",2023,"Kehui Tan,Tianqi Pang,Chenyou Fan",0,53,0
"1509f216ef556a68aa5639d07b61882945651e60","https://www.semanticscholar.org/paper/1509f216ef556a68aa5639d07b61882945651e60",1,"ChinaOpen: A Dataset for Open-world Multimodal Learning","An extensive evaluation of the state-of-the-art single-task / multi-task models on the new dataset, ChinaOpen, is conducted, resulting in a number of novel findings and insights.","arXiv.org",2023,"Aozhu Chen,Ziyuan Wang,Chengbo Dong,Kaibin Tian,Ruixiang Zhao,Xun Liang,Zhanhui Kang,Xirong Li",0,39,0
"240bc60c98c9b860c27c6f962992618a6775cab1","https://www.semanticscholar.org/paper/240bc60c98c9b860c27c6f962992618a6775cab1",1,"Musketeer (All for One, and One for All): A Generalist Vision-Language Model with Task Explanation Prompts","A sequence-to-sequence vision-language model whose parameters are jointly trained on all tasks and fully shared among multiple tasks, resulting in a single model which is named Musketeer.","arXiv.org",2023,"Zhaoyang Zhang,Yantao Shen,Kunyu Shi,Zhaowei Cai,Jun Fang,Siqi Deng,Hao Yang,Davide Modolo,Z. Tu,S. Soatto",0,68,0
"65051f6836a4a618586c01deff43b46ab5e3f887","https://www.semanticscholar.org/paper/65051f6836a4a618586c01deff43b46ab5e3f887",1,"Measuring Progress in Fine-grained Vision-and-Language Understanding","This work investigates four competitive V&L models on four fine-grained benchmarks, and finds that X-VLM consistently outperforms other baselines, and that modelling innovations can impact performance more than scaling Web data, which even degrades performance sometimes.","arXiv.org",2023,"Emanuele Bugliarello,Laurent Sartran,Aishwarya Agrawal,Lisa Anne Hendricks,Aida Nematzadeh",1,66,1
"4b203ee52e27cbf27d210dd671951150729a8259","https://www.semanticscholar.org/paper/4b203ee52e27cbf27d210dd671951150729a8259",1,"ULIP-2: Towards Scalable Multimodal Pre-training for 3D Understanding","ULIP-2 is introduced, a tri-modal pre-training framework that leverages state-of-the-art large multimodal models to automatically generate holistic language counterparts for 3D objects that does not require any 3D annotations, and is therefore scalable to large datasets.","arXiv.org",2023,"Le Xue,Ning Yu,Shu Zhang,Junnan Li,Roberto Mart'in-Mart'in,Jiajun Wu,Caiming Xiong,Ran Xu,Juan Carlos Niebles,S. Savarese",0,60,0
"adf4655e6bb531ec1a03d8ec9e8c5c63ae771fb6","https://www.semanticscholar.org/paper/adf4655e6bb531ec1a03d8ec9e8c5c63ae771fb6",1,"Edit As You Wish: Video Description Editing with Multi-grained Commands","A novel Video Description Editing (VDEdit) task to automatically revise an existing video description guided by flexible user requests is proposed and a unified framework to convert the {operation, position, attribute} triplet into a textual control sequence to handle multi-grained editing commands is proposed.","arXiv.org",2023,"Linli Yao,Yuanmeng Zhang,Ziheng Wang,Xinglin Hou,T. Ge,Yuning Jiang,Qin Jin",0,43,0
"83a734dee0809a46bc7189c12cd9956927d14836","https://www.semanticscholar.org/paper/83a734dee0809a46bc7189c12cd9956927d14836",1,"Bridging the Domain Gap: Self-Supervised 3D Scene Understanding with Foundation Models","This paper introduces a novel method that employs foundation models to generate highly accurate object-level masks and semantic text information at the object level, and notably outshines state-of-the-art methods in 3D object detection and semantic segmentation tasks.","arXiv.org",2023,"Zhimin Chen,Bing Li",0,68,0
"5f51eda9f7abddca027941d50fb0b6bf6f508eff","https://www.semanticscholar.org/paper/5f51eda9f7abddca027941d50fb0b6bf6f508eff",1,"Make-A-Protagonist: Generic Video Editing with An Ensemble of Experts","This work proposes a generic video editing framework called Make-A-Protagonist, which utilizes textual and visual clues to edit videos with the goal of empowering individuals to become the protagonists, and proposes a visual-textual-based video generation model that employs mask-guided denoising sampling to generate the desired output.","arXiv.org",2023,"Yuyang Zhao,Enze Xie,Lanqing Hong,Zhenguo Li,G. Lee",1,43,0
"3ef08e54c8f97804a89383b497347c8a7eefff7d","https://www.semanticscholar.org/paper/3ef08e54c8f97804a89383b497347c8a7eefff7d",1,"A Video Is Worth 4096 Tokens: Verbalize Story Videos To Understand Them In Zero Shot","This work proposes verbalizing story videos to generate their descriptions in natural language and then performing video-understanding tasks on the generated story as opposed to the original video, demonstrating that this method, despite being zero-shot, achieves significantly better results than supervised baselines for video understanding.","arXiv.org",2023,"Aanisha Bhattacharya,Yaman Kumar Singla,Balaji Krishnamurthy,R. Shah,Changan Chen",1,49,0
"1a3d6119d9513ad27fa4fc3262e517ec6a6d2261","https://www.semanticscholar.org/paper/1a3d6119d9513ad27fa4fc3262e517ec6a6d2261",1,"FastComposer: Tuning-Free Multi-Subject Image Generation with Localized Attention","FastComposer enables efficient, personalized, multi-subject text-to-image generation without fine-tuning, and proposes delayed subject conditioning in the denoising step to maintain both identity and editability in subject-driven image generation.","arXiv.org",2023,"Guangxuan Xiao,Tianwei Yin,W. Freeman,F. Durand,Song Han",0,38,0
"9b3ff4c05be2ee57021099ab07fadfb77440be45","https://www.semanticscholar.org/paper/9b3ff4c05be2ee57021099ab07fadfb77440be45",1,"IMAD: IMage-Augmented multi-modal Dialogue","This work proposes a two-stage approach to automatically construct a multi-modal dialogue dataset that can serve as a validated dataset for this task and proposes a baseline model trained on this dataset, which outperforms modeltrained on the same data without images and BlenderBot.","",2023,"Moskvoretskii Viktor,Frolov Anton,Kuznetsov Denis",0,67,0
"413bc628ef54effa9d59f93aa7ffd86a38fd1143","https://www.semanticscholar.org/paper/413bc628ef54effa9d59f93aa7ffd86a38fd1143",1,"What You See is What You Read? Improving Text-Image Alignment Evaluation","Two automatic methods to determine alignment are described, the first involving a pipeline based on question generation and visual question answering models, and the second employing an end-to-end classification approach by finetuning multimodal pretrained models.","arXiv.org",2023,"Michal Yarom,Yonatan Bitton,Soravit Changpinyo,Roee Aharoni,Jonathan Herzig,Oran Lang,E. Ofek,Idan Szpektor",1,60,0
"c3eee48481b3b8f4be18026e389fadf9a53ad192","https://www.semanticscholar.org/paper/c3eee48481b3b8f4be18026e389fadf9a53ad192",1,"Content-based Unrestricted Adversarial Attack","This work proposes a novel unrestricted attack framework called Content-based Unrestricted Adversarial Attack based on Stable Diffusion that can generate high transferable unrestricted adversarial examples with various adversarial contents and demonstrates the efficacy of ACA.","arXiv.org",2023,"Zhaoyu Chen,Bo Li,Shuang Wu,Kaixun Jiang,Shouhong Ding,Wenqiang Zhang",0,57,0
"2da2f8284c03a0c0df0e8b13e90bf215dd5ac786","https://www.semanticscholar.org/paper/2da2f8284c03a0c0df0e8b13e90bf215dd5ac786",1,"Listen, Think, and Understand","LTU is the first audio-enabled large language model that bridges audio perception with advanced reasoning, and demonstrates strong performance and generalization ability on conventional audio tasks such as classification and captioning.","arXiv.org",2023,"Yuan Gong,Hongyin Luo,Alexander H. Liu,Leonid Karlinsky,James Glass",0,49,0
"86ea4aa29241149c3999301f0285d8cbb8542b11","https://www.semanticscholar.org/paper/86ea4aa29241149c3999301f0285d8cbb8542b11",1,"Vision-Language Pre-training with Object Contrastive Learning for 3D Scene Understanding","This work carefully investigates three common tasks in semantic 3D scene understanding, and derives key insights into the development of a pre-training model 3DVLP, which transfers flexibly on 3D vision-language downstream tasks.","arXiv.org",2023,"Zhang Tao,Su He,D. Tao,Bin Chen,Zhi Wang,Shutao Xia",0,52,0
"daf34122a0c38531aeeb55069ba98e564c263d53","https://www.semanticscholar.org/paper/daf34122a0c38531aeeb55069ba98e564c263d53",1,"MedBLIP: Bootstrapping Language-Image Pre-training from 3D Medical Images and Texts","This paper considers developing a VLP model in the medical domain for making computer-aided diagnoses (CAD) based on image scans and text descriptions in electronic health records, as done in practice, and presents a lightweight CAD system MedBLIP, a new paradigm for bootstrapping VLP from off-the-shelf frozen pre-trained image encoders and frozen large language models.","arXiv.org",2023,"Qiuhui Chen,Xinyue Hu,Zirui Wang,Yi Hong",0,35,0
"8ce6ad6d8a73757309d3b9f525cf15cb68e32397","https://www.semanticscholar.org/paper/8ce6ad6d8a73757309d3b9f525cf15cb68e32397",1,"Efficient Prompting via Dynamic In-Context Learning","DynaICL is proposed, a recipe for efficient prompting with black-box generalist models that dynamically allocate in-context examples according to the input complexity and the computational budget and it is found that a meta controller trained on a certain backbone model and tasks can successfully generalize to unseen models and tasks.","arXiv.org",2023,"Wangchunshu Zhou,Yuchen Jiang,Ryan Cotterell,Mrinmaya Sachan",0,62,0
"757940cef62b06f6abdb427d5a7fe61d512a2e3f","https://www.semanticscholar.org/paper/757940cef62b06f6abdb427d5a7fe61d512a2e3f",1,"UniControl: A Unified Diffusion Model for Controllable Visual Generation In the Wild","This work introduces UniControl, a new generative foundation model that consolidates a wide array of controllable condition-to-image (C2I) tasks within a singular framework, while still allowing for arbitrary language prompts, and enables pixel-level-precise image generation.","arXiv.org",2023,"Can Qin,Shu Zhang,Ning Yu,Yihao Feng,Xinyi Yang,Yingbo Zhou,Haiquan Wang,Juan Carlos Niebles,Caiming Xiong,S. Savarese,S. Ermon,Yun Fu,Ran Xu",0,58,0
"972501b057e2b84d6ce6506f70bcac697bab7872","https://www.semanticscholar.org/paper/972501b057e2b84d6ce6506f70bcac697bab7872",1,"LLMScore: Unveiling the Power of Large Language Models in Text-to-Image Synthesis Evaluation","This work proposes LLMScore, a new framework that offers evaluation scores with multi-granularity compositionality that achieves Kendall's tau correlation with human evaluations that is 58.8% and 31.2% higher than the commonly-used text-image matching metrics CLIP and BLIP, respectively.","arXiv.org",2023,"Yujie Lu,Xianjun Yang,Xiujun Li,X. Wang,William Yang Wang",0,51,0
"a90f2b1fa484a9ee9a6efa13c1734f7510eaf044","https://www.semanticscholar.org/paper/a90f2b1fa484a9ee9a6efa13c1734f7510eaf044",1,"VideoFactory: Swap Attention in Spatiotemporal Diffusions for Text-to-Video Generation","Object metrics and user studies demonstrate the superiority of the novel approach that strengthens the interaction between spatial and temporal perceptions in 3D windows in terms of per-frame quality, temporal correlation, and text-video alignment, with clear margins.","arXiv.org",2023,"Wenjing Wang,Huan Yang,Zixi Tuo,Huiguo He,Junchen Zhu,Jianlong Fu,Jiaying Liu",1,64,0
"9f411fda2ad5b141a3115f707bcf5ee865b3fb94","https://www.semanticscholar.org/paper/9f411fda2ad5b141a3115f707bcf5ee865b3fb94",1,"Any-to-Any Generation via Composable Diffusion","CoDi employs a novel composable generation strategy which involves building a shared multimodal space by bridging alignment in the diffusion process, enabling the synchronized generation of intertwined modalities, such as temporally aligned video and audio.","arXiv.org",2023,"Zineng Tang,Ziyi Yang,Chenguang Zhu,Michael Zeng,Mohit Bansal",0,58,0
