"id","url","score","title","summary","venue","year","authors","citationCount","referenceCount","influentialCitationCount"
"8700c5af25450bf8e84b94783344b054d268738b","https://www.semanticscholar.org/paper/8700c5af25450bf8e84b94783344b054d268738b",1,"Bi-VLGM : Bi-Level Class-Severity-Aware Vision-Language Graph Matching for Text Guided Medical Image Segmentation","A Bi-level class-severity-aware Vision-Language Graph Matching (Bi-VLGM) for text guided medical image segmentation and its superiority to existing methods is introduced.","",2023,"Chen Wenting,Liu Jie,Yuan Yixuan",0,48,0
"78b03df885cbb57361e8efc5ce5ad5eea211dda6","https://www.semanticscholar.org/paper/78b03df885cbb57361e8efc5ce5ad5eea211dda6",1,"Generalist Vision Foundation Models for Medical Imaging: A Case Study of Segment Anything Model on Zero-Shot Medical Segmentation","The study indicates the versatility of generalist vision foundation models on medical imaging, and their great potential to achieve desired performance through fine-turning and eventually address the challenges associated with accessing large and diverse medical datasets in support of clinical diagnostics.","Diagnostics",2023,"Peilun Shi,Jianing Qiu,Sai Mu Dalike Abaxi,Hao Wei,F. P. Lo,Wu Yuan",3,44,0
"80785017029cab501fcdb90b98985cd2b36e1fb8","https://www.semanticscholar.org/paper/80785017029cab501fcdb90b98985cd2b36e1fb8",1,"Evaluation of GPT-3.5 and GPT-4 for supporting real-world information needs in healthcare delivery","It is suggested that while general purpose LLMs are able to provide safe and credible responses, they often do not meet the specific information need of a given question.","arXiv.org",2023,"Debadutta Dash,Rahul Thapa,J. Banda,Akshay Swaminathan,Morgan Cheatham,M. Kashyap,N. Kotecha,Jonathan H. Chen,S. Gombar,L. Downing,Rachel A. Pedreira,Ethan Goh,A. Arnaout,Garret K. Morris,H. Magon,M. Lungren,E. Horvitz,N. Shah",4,38,1
"d0ee000f30420953f10dfcfd608a7f9ad40f1635","https://www.semanticscholar.org/paper/d0ee000f30420953f10dfcfd608a7f9ad40f1635",1,"Humans are Still Better than ChatGPT: Case of the IEEEXtreme Competition","This paper presents an instance where human performance excels in typical tasks suited for ChatGPT, specifically in the domain of computer programming, and provides evidence that contrary to popular belief, human programmers maintain a competitive edge overChatGPT in certain aspects of problem-solving within the programming context.","arXiv.org",2023,"A. Koubâa,B. Qureshi,Adel Ammar,Zahid Khan,W. Boulila,L. Ghouti",1,34,0
"e1a12117f15a6ee07133851a51439394bb9e7406","https://www.semanticscholar.org/paper/e1a12117f15a6ee07133851a51439394bb9e7406",1,"ChemCrow: Augmenting large-language models with chemistry tools","This study introduces ChemCrow, an LLM chemistry agent designed to accomplish tasks across organic synthesis, drug discovery, and materials design by integrating 13 expert-designed tools, which augments the LLM performance in chemistry, and new capabilities emerge.","",2023,"A. Bran,Sam Cox,Andrew D. White,P. Schwaller",9,78,1
"32dcd0887537cece54e214f531d2c384470b023f","https://www.semanticscholar.org/paper/32dcd0887537cece54e214f531d2c384470b023f",1,"Large Language Models as Tool Makers","A closed-loop framework, referred to as LLMs As Tool Makers (LATM), where LLMs create their own reusable tools for problem-solving, which can achieve performance that is on par with using GPT-4 for both tool making and tool using, while the inference cost is significantly reduced.","arXiv.org",2023,"Tianle Cai,Xuezhi Wang,Tengyu Ma,Xinyun Chen,Denny Zhou",2,37,0
"811115d36e1eabe2cef03b38a0809514e40b658e","https://www.semanticscholar.org/paper/811115d36e1eabe2cef03b38a0809514e40b658e",1,"Chain-Of-Thought Prompting Under Streaming Batch: A Case Study","This paper presents a case study on how to construct and optimize chain-of-thought prompting using batch data in streaming settings and concludes that all test data is visible before testing and only select a small subset to generate rationales, which is an unrealistic assumption.","",2023,"Yuxin Tang",0,16,0
"66d4631c28582b496d8e77653556893a9a6d8c3a","https://www.semanticscholar.org/paper/66d4631c28582b496d8e77653556893a9a6d8c3a",1,"MultiModal-GPT: A Vision and Language Model for Dialogue with Humans","A vision and language model named MultiModal-GPT to conduct multi-round dialogue with humans and finds the quality of training data is vital for the dialogue performance, where few data containing short answers can lead the model to respond shortly to any instructions.","arXiv.org",2023,"T. Gong,Chengqi Lyu,Shilong Zhang,Yudong Wang,Miao Zheng,Qianmengke Zhao,Kuikun Liu,Wenwei Zhang,Ping Luo,Kai Chen",6,17,0
"7bf902fb94a577d15293ac4f90d8967163850fb1","https://www.semanticscholar.org/paper/7bf902fb94a577d15293ac4f90d8967163850fb1",1,"Let's Think Frame by Frame: Evaluating Video Chain of Thought with Video Infilling and Prediction","A new research direction of VideoCOT on video keyframes is proposed, which leverages the multimodal generative abilities of vision-language models to enhance video reasoning while reducing the computational complexity of processing hundreds or thousands of frames.","arXiv.org",2023,"Vaishnavi Himakunthala,Andy Ouyang,Daniel Rose,Ryan He,Alex Mei,Yujie Lu,Chinmay Sonar,Michael Stephen Saxon,William Yang Wang",0,37,0
"5d44f16a36ba7ae6b3d9d7c98bbc1b877e598f35","https://www.semanticscholar.org/paper/5d44f16a36ba7ae6b3d9d7c98bbc1b877e598f35",1,"The False Promise of Imitating Proprietary LLMs","It is concluded that model imitation is a false promise: there exists a substantial capabilities gap between open and closed LMs that can be bridged using an unwieldy amount of imitation data or by using more capable base LMs.","arXiv.org",2023,"Arnav Gudibande,Eric Wallace,Charles Burton Snell,Xinyang Geng,Hao Liu,P. Abbeel,S. Levine,Dawn Song",4,45,1
"f6c23f3fe897b3836e29e91e7842c12f711c68fe","https://www.semanticscholar.org/paper/f6c23f3fe897b3836e29e91e7842c12f711c68fe",1,"Pre-trained transformer for adversarial purification","This work proposes a new scenario, RaPiD (Rapid Plug-in Defender), which is to rapidly defend against a certain attack for the frozen original service model with limitations of few clean and adversarial examples.","",2023,"K. Wu,Yujian Li,Xiaoyu Zhang,Handing Wang,J. Liu",0,34,0
"0244aeb7c6927e2fb0c2e668687e160a00737dbe","https://www.semanticscholar.org/paper/0244aeb7c6927e2fb0c2e668687e160a00737dbe",1,"Orca: Progressive Learning from Complex Explanation Traces of GPT-4","Orca is developed, a 13-billion parameter model that learns to imitate the reasoning process of LFMs, indicating that learning from step-by-step explanations, whether these are generated by humans or more advanced AI models, is a promising direction to improve model capabilities and skills.","",2023,"Subhabrata Mukherjee,Arindam Mitra,Ganesh Jawahar,Sahaj Agarwal,H. Palangi,A. Awadallah",0,32,0
"2d3905c1a92c28c056dff1225d89e4ca72ac4d8e","https://www.semanticscholar.org/paper/2d3905c1a92c28c056dff1225d89e4ca72ac4d8e",1,"Man vs the machine: The Struggle for Effective Text Anonymisation in the Age of Large Language Models","An experiment is conducted using GPT over anonymised texts of famous people to determine whether such trained networks can deanonymise them and introduces a novel methodology that employs Large Language Models to improve the anonymity of texts.","arXiv.org",2023,"C. Patsakis,Nikolaos Lykousas",1,38,0
"03b2dab693da1e8af9624750c0759fd1eb7b197e","https://www.semanticscholar.org/paper/03b2dab693da1e8af9624750c0759fd1eb7b197e",1,"Beyond One-Model-Fits-All: A Survey of Domain Specialization for Large Language Models","A systematic taxonomy is proposed that categorizes the LLM domain-specialization techniques based on the accessibility to LLMs and summarizes the framework for all the subcategories as well as their relations and differences to each other.","arXiv.org",2023,"Chen Ling,Xujiang Zhao,Jiaying Lu,Chengyuan Deng,Can Zheng,Junxiang Wang,Tanmoy Chowdhury,Yun-Qing Li,Hejie Cui,Tian-yu Zhao,Amit Panalkar,Wei Cheng,Haoyu Wang,Yanchi Liu,Zhengzhang Chen,Haifeng Chen,Chris White,Quanquan Gu,Carl Yang,Liang Zhao",0,286,0
"e81bfacbf3f03375860dbea28f9f12a3b0b2697a","https://www.semanticscholar.org/paper/e81bfacbf3f03375860dbea28f9f12a3b0b2697a",1,"Data Augmentation Approaches for Source Code Models: A Survey","This paper conducts a comprehensive and integrative survey of data augmentation for source code, wherein it systematically compile and encapsulate existing literature to provide a comprehensive overview of the field.","arXiv.org",2023,"Terry Yue Zhuo,Zhou Yang,Zhensu Sun,Yufei Wang,Li Li,Xiaoning Du,Zhenchang Xing,David Lo",0,118,0
"6139b6bc065b24562cb7f4f08227a42f5766138f","https://www.semanticscholar.org/paper/6139b6bc065b24562cb7f4f08227a42f5766138f",1,"Diffusion Models: A Comprehensive Survey of Methods and Applications","An overview of the rapidly expanding body of work on diffusion models is provided, categorizing the research into three key areas: efficient sampling, improved likelihood estimation, and handling data with special structures.","arXiv.org",2022,"Ling Yang,Zhilong Zhang,Shenda Hong,Runsheng Xu,Yue Zhao,Yingxia Shao,Wentao Zhang,Ming-Hsuan Yang,Bin Cui",133,364,8
"09ca5072a76796c65e5936b6fb4968afead61944","https://www.semanticscholar.org/paper/09ca5072a76796c65e5936b6fb4968afead61944",1,"Semantics-Empowered Communication: A Tutorial-cum-Survey","This work proposes to categorize the critical enabling techniques by explicit and implicit reasoning-based methods, and elaborate on how they evolve and contribute to modern content&channel semantics-empowered communications.","arXiv.org",2022,"Zhilin Lu,Rongpeng Li,Kun Lu,Xianfu Chen,E. Hossain,Zhifeng Zhao,Honggang Zhang",2,243,1
"419eb47fea3931c4098232f44ccbc216275d3f56","https://www.semanticscholar.org/paper/419eb47fea3931c4098232f44ccbc216275d3f56",1,"Decoding Visual Neural Representations by Multimodal Learning of Brain-Visual-Linguistic Features","The BraVL model can be trained under various semi-supervised scenarios to incorporate the visual and textual features obtained from the extra categories and constructed three trimodal matching datasets, leading to some interesting conclusions and cognitive insights.","IEEE Transactions on Pattern Analysis and Machine Intelligence",2022,"Changde Du,Kaicheng Fu,Jinpeng Li,Huiguang He",3,87,1
"9fe9af7cf3d54b707a7be3c53ce94b77dcc3bae5","https://www.semanticscholar.org/paper/9fe9af7cf3d54b707a7be3c53ce94b77dcc3bae5",1,"A Short Survey of Viewing Large Language Models in Legal Aspect","","arXiv.org",2023,"Zhongxiang Sun",7,25,0
"74e8ae03a385e72f5ae377667ba9858fb3e0bfa0","https://www.semanticscholar.org/paper/74e8ae03a385e72f5ae377667ba9858fb3e0bfa0",1,"Unleashing the Power of Edge-Cloud Generative AI in Mobile Networks: A Survey of AIGC Services","This survey paper focuses on the deployment of AIGC applications, e.g., ChatGPT and Dall-E, at mobile edge networks, that provide personalized and customized AigC services in real time while maintaining user privacy.","arXiv.org",2023,"Minrui Xu,Hongyang Du,D. Niyato,Jiawen Kang,Zehui Xiong,Shiwen Mao,Zhu Han,A. Jamalipour,Dong In Kim,X. Shen,Victor C. M. Leung,H. V. Poor",6,232,2
"1d29334cfbe9a1a943082058876f0c22d44c62fd","https://www.semanticscholar.org/paper/1d29334cfbe9a1a943082058876f0c22d44c62fd",1,"A Survey of Large Language Models","A review of the recent advances of large language models by introducing the background, key findings, and mainstream techniques, and focusing on four major aspects of LLMs, namely pre-training, adaptation tuning, utilization, and capacity evaluation.","arXiv.org",2023,"Wayne Xin Zhao,Kun Zhou,Junyi Li,Tianyi Tang,Xiaolei Wang,Yupeng Hou,Yingqian Min,Beichen Zhang,Junjie Zhang,Zican Dong,Yifan Du,Chen Yang,Yushuo Chen,Z. Chen,Jinhao Jiang,Ruiyang Ren,Yifan Li,Xinyu Tang,Zikang Liu,Peiyu Liu,J. Nie,Ji-rong Wen",87,415,8
"26ccfbd8bfad44aeed695c12579ff7126adbfae9","https://www.semanticscholar.org/paper/26ccfbd8bfad44aeed695c12579ff7126adbfae9",1,"Summary of ChatGPT/GPT-4 Research and Perspective Towards the Future of Large Language Models","A comprehensive survey of ChatGPT and GPT-4, state-of-the-art large language models from the GPT series, and their prospective applications across diverse domains, encompassing trend analysis, word cloud representation, and distribution analysis across various application domains is presented.","arXiv.org",2023,"Yi-Hsien Liu,Tianle Han,Siyuan Ma,Jia-Yu Zhang,Yuanyu Yang,Jiaming Tian,Haoyang He,Antong Li,Mengshen He,Zheng Liu,Zihao Wu,Dajiang Zhu,Xiang Li,Ning Qiang,Dingang Shen,Tianming Liu,Bao Ge",26,106,3
"9fd980237e7fdfa4c103a2dc08657e73adf847c4","https://www.semanticscholar.org/paper/9fd980237e7fdfa4c103a2dc08657e73adf847c4",1,"OpenAGI: When LLM Meets Domain Experts","OpenAGI is developed, an open-source AGI research platform, specifically designed to offer complex, multi-step tasks and accompanied by task-specific datasets, evaluation metrics, and a diverse range of extensible models.","arXiv.org",2023,"Yingqiang Ge,Wenyue Hua,Jianchao Ji,Juntao Tan,Shuyuan Xu,Yongfeng Zhang",6,42,0
"6316cbb4f1e7dba5806a3310ec7f89f3571bc3db","https://www.semanticscholar.org/paper/6316cbb4f1e7dba5806a3310ec7f89f3571bc3db",1,"Boosting Cross-task Transferability of Adversarial Patches with Visual Relations","A novel Visual Relation-based cross-task Adversarial Patch generation method called VRAP is proposed, which aims to evaluate the robustness of various visual tasks, especially those involving visual reasoning, such as Visual Question Answering and Image Captioning.","arXiv.org",2023,"Tony Ma,Songze Li,Yisong Xiao,Shunchang Liu",0,22,0
"ba2f935d2578fbf77ec1aa79e26e3db396771e38","https://www.semanticscholar.org/paper/ba2f935d2578fbf77ec1aa79e26e3db396771e38",1,"Self-collaboration Code Generation via ChatGPT","It is showcased that self-collaboration could potentially enable LLMs to efficiently handle complex real-world tasks that are not readily solved by direct code generation, as evidenced in case study.","arXiv.org",2023,"Yihong Dong,Xue Jiang,Zhi Jin,Ge Li",4,47,0
"be2b0396de9431bae931642516a1d3e4906329f5","https://www.semanticscholar.org/paper/be2b0396de9431bae931642516a1d3e4906329f5",1,"Low-code LLM: Visual Programming over LLMs","A novel human-LLM interaction framework that incorporates six types of simple low-code visual programming interactions, all supported by clicking, dragging, or text editing, to achieve more controllable and stable responses.","arXiv.org",2023,"Yuzhe Cai,Shaoguang Mao,Wenshan Wu,Zehua Wang,Yaobo Liang,Tao Ge,Chenfei Wu,Wang You,Ting Song,Yan Xia,Jonathan Tien,Nan Duan",3,27,0
"e36e5df3dde73c4e3606cdd4498cfc304a29bf5c","https://www.semanticscholar.org/paper/e36e5df3dde73c4e3606cdd4498cfc304a29bf5c",1,"Learning to Program with Natural Language","This work proposes using natural language as a new programming language to describe task procedures, making them easily understandable to both humans and LLMs and shows that the learned program can be directly used to guide another LLM to improve its performance, which reveals a new transfer learning paradigm.","arXiv.org",2023,"Yiduo Guo,Yaobo Liang,Chenfei Wu,Wenshan Wu,Dongyan Zhao,Nan Duan",2,37,0
"4c8ef2db0c77aba453783f5211ebafc6695d3835","https://www.semanticscholar.org/paper/4c8ef2db0c77aba453783f5211ebafc6695d3835",1,"ChatABL: Abductive Learning via Natural Language Interaction with ChatGPT","This paper presents a novel method (ChatABL) for integrating LLMs into the ABL framework, aiming at unifying the three abilities in a more user-friendly and understandable manner, and is the first attempt to explore a new pattern for further approaching human-level cognitive ability via natural language interaction with ChatGPT.","arXiv.org",2023,"Tianyang Zhong,Yaonai Wei,Li Yang,Zihao Wu,Zheng Liu,Xiaozheng Wei,WenJu Sun,Junjie Yao,Chongfei Ma,Xiang Li,Dajiang Zhu,Xi Jiang,Jun-Feng Han,Dinggang Shen,Tianming Liu,Tuo Zhang",1,69,0
"7a5c31341e7ec22409e175542368eb76e08900aa","https://www.semanticscholar.org/paper/7a5c31341e7ec22409e175542368eb76e08900aa",1,"The Potential of Visual ChatGPT For Remote Sensing","","arXiv.org",2023,"L. Osco,Eduardo Lopes de Lemos,W. Gonçalves,A. P. Ramos,J. M. Junior",0,36,0
"8bc617c9139648d7a92991d70c671230bac7b2e2","https://www.semanticscholar.org/paper/8bc617c9139648d7a92991d70c671230bac7b2e2",1,"AudioGPT: Understanding and Generating Speech, Music, Sound, and Talking Head","A multi-modal AI system named AudioGPT is proposed, which complements LLMs with 1) foundation models to process complex audio information and solve numerous understanding and generation tasks; and 2) the input/output interface (ASR, TTS) to support spoken dialogue.","arXiv.org",2023,"Rongjie Huang,Mingze Li,Dongchao Yang,Jiatong Shi,Xuankai Chang,Zhenhui Ye,Yuning Wu,Zhiqing Hong,Jia-Bin Huang,Jinglin Liu,Yixiang Ren,Zhou Zhao,Shinji Watanabe",12,46,1
"37ba1833e844f5178f91f50d82bfff616551e6ad","https://www.semanticscholar.org/paper/37ba1833e844f5178f91f50d82bfff616551e6ad",1,"The Role of Summarization in Generative Agents: A Preliminary Perspective","","arXiv.org",2023,"Xiachong Feng,Xiaocheng Feng,Bing Qin",0,11,0
"c77d908ba29567445a9a4ad1bd4461d441cce174","https://www.semanticscholar.org/paper/c77d908ba29567445a9a4ad1bd4461d441cce174",1,"AutoML-GPT: Automatic Machine Learning with GPT","The AutoML-GPT is presented, which employs GPT as the bridge to diverse AI models and dynamically trains models with optimized hyperparameters and achieves remarkable results in computer vision, natural language processing, and other challenging areas.","arXiv.org",2023,"Shujian Zhang,Chengyue Gong,Lemeng Wu,Xingchao Liu,Mi Zhou",0,33,0
"d473847dff63e3f5d238251cb23597f8205f72f2","https://www.semanticscholar.org/paper/d473847dff63e3f5d238251cb23597f8205f72f2",1,"Generating Virtual On-body Accelerometer Data from Virtual Textual Descriptions for Human Activity Recognition","This work introduces an automated pipeline that first uses ChatGPT to generate diverse textual descriptions of activities that are later converted to streams of virtual IMU data and demonstrates how HAR models can be improved through the generation of virtual training data that do not require any manual effort.","arXiv.org",2023,"Zi-Jian Leng,HyeokHyen Kwon,T. Plotz",0,33,0
"e0dc8e113dbdd2896fb6420ac93e0b976c47f2a2","https://www.semanticscholar.org/paper/e0dc8e113dbdd2896fb6420ac93e0b976c47f2a2",1,"Augmented Large Language Models with Parametric Knowledge Guiding","The novel Parametric Knowledge Guiding (PKG) framework is proposed, which equips LLMs with a knowledge-guiding module to access relevant knowledge without altering the LLMs' parameters, and is based on open-source language models, allowing offline memory of any knowledge that LLMs require.","arXiv.org",2023,"Ziyang Luo,Can Xu,Pu Zhao,Xiubo Geng,Chongyang Tao,Jing Ma,Qingwei Lin,Daxin Jiang",0,57,0
"7a6dc7071891cb3d658c93418801942a4c6ed373","https://www.semanticscholar.org/paper/7a6dc7071891cb3d658c93418801942a4c6ed373",1,"Autonomous GIS: the next-generation AI-powered GIS","Although still in its infancy and lacking several important modules such as logging and code testing, LLM-Geo demonstrates a potential path toward the next-generation AI-powered GIS, and advocates for the GIScience community to dedicate more effort to the research and development of autonomous GIS.","arXiv.org",2023,"Zhenlong Li,H. Ning",1,64,0
"8dbb29f93292d8b1b861c322d232fe087b2ef7b1","https://www.semanticscholar.org/paper/8dbb29f93292d8b1b861c322d232fe087b2ef7b1",1,"Small Models are Valuable Plug-ins for Large Language Models","The experiments demonstrate that SuperICL can improve performance beyond state-of-the-art fine-tuned models while addressing the instability problem of in-context learning, and can enhance the capabilities of smaller models, such as multilinguality and interpretability.","arXiv.org",2023,"Canwen Xu,Yichong Xu,Shuo Wang,Yang Liu,Chenguang Zhu,Julian McAuley",5,35,1
"7787efaf502421eac9b6b0fd946a82e1ecf4c8c9","https://www.semanticscholar.org/paper/7787efaf502421eac9b6b0fd946a82e1ecf4c8c9",1,"Generating coherent comic with rich story using ChatGPT and Stable Diffusion","A novel way to evaluate AI-generated stories is introduced, and SOTA performance on character fidelity and art style is achieved by fine-tuning stable diffusion using LoRA, ControlNet, etc.","arXiv.org",2023,"Ze Jin,Zorina Song",0,17,0
"38aa4d2f58fbb951f885df1582195c262d976322","https://www.semanticscholar.org/paper/38aa4d2f58fbb951f885df1582195c262d976322",1,"Chain-of-Symbol Prompting Elicits Planning in Large Langauge Models","A novel method called CoS (Chain-of-Symbol Prompting) that represents the complex environments with condensed symbolic spatial representations during the chained intermediate thinking steps and is easy to use and does not need additional training on LLMs.","arXiv.org",2023,"Hanxu Hu,Hongyuan Lu,Huajian Zhang,Wai Lam,Yue Zhang",1,27,0
"49bb6f42879031e2374235715c942006af5c88d9","https://www.semanticscholar.org/paper/49bb6f42879031e2374235715c942006af5c88d9",1,"Empower Large Language Model to Perform Better on Industrial Domain-Specific Question Answering","This paper provides a benchmark Question Answering (QA) dataset named MSQA, which is about Microsoft products and IT technical problems encountered by customers, and proposes a new model interaction paradigm that can empower LLM to achieve better performance on domain-specific tasks where it is not proficient.","arXiv.org",2023,"Zezhong Wang,Fan Yang,Pu Zhao,Lu Wang,Jue Zhang,Mohit Garg,Qingwei Lin,Dongmei Zhang",0,41,0
"fbd4a876cee20eaf98f344aca597a55338f663f5","https://www.semanticscholar.org/paper/fbd4a876cee20eaf98f344aca597a55338f663f5",1,"Examining the Inter-Consistency of Large Language Models: An In-depth Analysis via Debate","Through extensive experiments on the commonsense reasoning task, LLMs not only become more inter-consistent but also achieve higher performance and the importance of a competent judge, such as GPT-4, is highlighted.","arXiv.org",2023,"Kai Xiong,Xiao Ding,Yixin Cao,Ting Liu,Bing Qin",0,40,0
"eb291a2e237774b162d9c51c21c4868795589e94","https://www.semanticscholar.org/paper/eb291a2e237774b162d9c51c21c4868795589e94",1,"Diving into the Inter-Consistency of Large Language Models: An Insightful Analysis through Debate","A formal debate framework is designed to delve into the inter-consistency problem among LLMs with three-stage debate: fair debate, mismatched debate, and roundtable debate and shows how a much stronger LLM would be dominant in mismatched debates, while it will be easily misled by relatively weaker LLMs in a more complex debate scenario such as round table debate.","",2023,"Kai Xiong,Xiao Ding,Yixin Cao,Ting Liu,Bing Qin",1,42,0
"205d2ed0906440f07a0275d7d6a63bced60951fc","https://www.semanticscholar.org/paper/205d2ed0906440f07a0275d7d6a63bced60951fc",1,"InstructVid2Vid: Controllable Video Editing with Natural Language Instructions","Experiments demonstrate that InstructVid2Vid is able to generate high-quality, temporally coherent videos and perform diverse edits, including attribute editing, change of background, and style transfer, which highlight the versatility and effectiveness of the proposed method.","arXiv.org",2023,"Bosheng Qin,Juncheng Li,Siliang Tang,Tat-Seng Chua,Yueting Zhuang",0,61,0
"a4ce9552b6427beaae2bcadfe5f460024858dd25","https://www.semanticscholar.org/paper/a4ce9552b6427beaae2bcadfe5f460024858dd25",1,"ChipGPT: How far are we from natural language hardware design","This work attempts to demonstrate an automated design environment that explores LLMs to generate hardware logic designs from natural language specifications without retraining or finetuning, and shows broader design optimization space compared to prior work and native LLMs alone.","arXiv.org",2023,"Kaiyan Chang,Y. Wang,Haimeng Ren,Mengdi Wang,Shengwen Liang,Yinhe Han,Huawei Li,Xiaowei Li",0,27,0
"abab79d1135684d039cfbebd0097e48ef4c1940c","https://www.semanticscholar.org/paper/abab79d1135684d039cfbebd0097e48ef4c1940c",1,"Vision + Language Applications: A Survey","A relevant research track within multimodal applications, including text, vision, audio, and others, is explored, includingText-to-image generation within multi-modal applications.","arXiv.org",2023,"Yutong Zhou,N. Shimada",0,220,0
"7c4f6fd4c7eadcc7189a6797db215895340f93c7","https://www.semanticscholar.org/paper/7c4f6fd4c7eadcc7189a6797db215895340f93c7",1,"ChatFace: Chat-Guided Real Face Editing via Diffusion Latent Space Manipulation","A novel approach that conduct text-driven image editing in the semantic latent space of diffusion model by aligning the temporal feature of the diffusion model with the semantic condition at generative process is proposed and an interactive system named ChatFace is developed, which combines the zero-shot reasoning ability of large language models to perform efficient manipulations in diffusion semantic latentspace.","arXiv.org",2023,"Dongxu Yue,Qin Guo,Munan Ning,Jiaxi Cui,Yuesheng Zhu,Liuliang Yuan",0,54,0
"ef8c21e1f574495f0c80b8c1037dbdb886f0808d","https://www.semanticscholar.org/paper/ef8c21e1f574495f0c80b8c1037dbdb886f0808d",1,"Towards Language-guided Interactive 3D Generation: LLMs as Layout Interpreter with Generative Feedback","A novel language-guided interactive 3D generation system that integrates LLMs as a 3D layout interpreter into the off-the-shelf layout-to-3D generative models, allowing users to flexibly and interactively generate visual content.","arXiv.org",2023,"Yiqi Lin,Hao Wu,Ruichen Wang,H. Lu,Xiaodong Lin,Hui Xiong,Lin Wang",0,39,0
