"id","url","score","title","summary","venue","year","authors","citationCount","referenceCount","influentialCitationCount"
"d6d3604f369bb0415cbe814e43ca3131323b03e2","https://www.semanticscholar.org/paper/d6d3604f369bb0415cbe814e43ca3131323b03e2",6,"Otter: A Multi-Modal Model with In-Context Instruction Tuning","Otter, a multi-modal model based on OpenFlamingo (open-sourced version of DeepMind's Flamingo), trained on MIMIC-IT and showcasing improved instruction-following ability and in-context learning is introduced.","arXiv.org",2023,"Bo Li,Yuanhan Zhang,Liangyu Chen,Jinghao Wang,Jingkang Yang,Ziwei Liu",22,36,5
"86cbd30d1096b0c7e4ac6b03d97a8df12fd21457","https://www.semanticscholar.org/paper/86cbd30d1096b0c7e4ac6b03d97a8df12fd21457",6,"PathAsst: Redefining Pathology through Generative Foundation AI Assistant for Pathology","The PathAsst is presented, which is a generative foundation AI assistant to revolutionize diagnostic and predictive analytics in pathology, trained based on Vicuna-13B language model in coordination with the CLIP vision encoder.","arXiv.org",2023,"Yuxuan Sun,Chenglu Zhu,S. Zheng,Kai Zhang,Zhongyi Shui,Xiaoxuan Yu,Yi-Lei Zhao,Honglin Li,Yunlong Zhang,Ruojia Zhao,Xinheng Lyu,Lin Yang",2,47,0
"ebedc4d7a2356090904baba4104ef0832bc236df","https://www.semanticscholar.org/paper/ebedc4d7a2356090904baba4104ef0832bc236df",6,"A Survey on Multimodal Large Language Models","This paper presents the formulation of MLLM and delineate its related concepts, and discusses the key techniques and applications, including Multimodal Instruction Tuning (M-IT), Multimmodal In-Context Learning (M -ICL), MultIModal Chain of Thought (m-CoT), and LLM-Aided Visual Reasoning (LAVR).","arXiv.org",2023,"Shukang Yin,Chaoyou Fu,Sirui Zhao,Ke Li,Xing Sun,Tong Xu,Enhong Chen",3,105,0
"570079bbdd8758dfe865097e05719313c9c1301a","https://www.semanticscholar.org/paper/570079bbdd8758dfe865097e05719313c9c1301a",5,"LLaMA-Adapter V2: Parameter-Efficient Visual Instruction Model","This work augments LLaMA-Adapter by unlocking more learnable parameters and proposes an early fusion strategy to feed visual tokens only into the early LLM layers, contributing to better visual knowledge incorporation and achieves strong multi-modal reasoning with only a small-scale image-text and instruction dataset.","arXiv.org",2023,"Peng Gao,Jiaming Han,Renrui Zhang,Ziyi Lin,Shijie Geng,Aojun Zhou,W. Zhang,Pan Lu,Conghui He,Xiangyu Yue,Hongsheng Li,Y. Qiao",26,77,4
"7cf64070fd3d7e53d80f260c10e6bd7018d580e1","https://www.semanticscholar.org/paper/7cf64070fd3d7e53d80f260c10e6bd7018d580e1",5,"IdealGPT: Iteratively Decomposing Vision and Language Reasoning via Large Language Models","The IdealGPT framework is presented, a framework that iteratively decomposes VL reasoning using large language models (LLMs) and outperforms the best existing GPT-4-like models by an absolute 10% on VCR and 15% on SNLI-VE.","arXiv.org",2023,"Haoxuan You,Rui Sun,Zhecan Wang,Long Chen,Gengyu Wang,Hammad A. Ayyubi,Kai-Wei Chang,Shih-Fu Chang",2,46,1
"fd755dc7b5b206c17fd953db04e1c888d45b6e4e","https://www.semanticscholar.org/paper/fd755dc7b5b206c17fd953db04e1c888d45b6e4e",5,"LAMM: Language-Assisted Multi-Modal Instruction-Tuning Dataset, Framework, and Benchmark","This work extends the research of MLLMs to point clouds and presents the LAMM-Dataset and LAMm-Benchmark for 2D image and 3D point cloud understanding and establishes an extensible framework to facilitate the extension of M LLMs to additional modalities.","arXiv.org",2023,"Zhen-fei Yin,Jiong Wang,Jianjian Cao,Zhelun Shi,Dingning Liu,Mukai Li,Lu Sheng,Lei Bai,Xiaoshui Huang,Zhiyong Wang,Wanli Ouyang,Jing Shao",3,97,2
"051549d8ef56937b2f4d113afdcf8c7586d3770b","https://www.semanticscholar.org/paper/051549d8ef56937b2f4d113afdcf8c7586d3770b",5,"Towards AGI in Computer Vision: Lessons Learned from GPT and Large Language Models","It is pointed out that the essential weakness of CV lies in lacking a paradigm to learn from environments, yet NLP has accomplished the task in the text world and is still far from a system like GPT that naturally integrates all tasks.","arXiv.org",2023,"Lingxi Xie,Longhui Wei,Xiaopeng Zhang,Kaifeng Bi,Xiaotao Gu,Jianlong Chang,Qi Tian",1,158,0
"966852963a88a28786b798c91b6662d6e501e590","https://www.semanticscholar.org/paper/966852963a88a28786b798c91b6662d6e501e590",5,"AssistGPT: A General Multi-modal Assistant that can Plan, Execute, Inspect, and Learn","A multi-modal AI assistant with an interleaved code and language reasoning approach called Plan, Execute, Inspect, and Learn (PEIL) to integrate LLMs with various tools, and a Learner is designed to enable the model to autonomously explore and discover the optimal solution.","arXiv.org",2023,"Difei Gao,Lei Ji,Luowei Zhou,Kevin Lin,Joya Chen,Zihan Fan,Mike Zheng Shou",1,70,0
"0ebc861f5478561f12941e6b48aad30574e996d8","https://www.semanticscholar.org/paper/0ebc861f5478561f12941e6b48aad30574e996d8",5,"Video ChatCaptioner: Towards Enriched Spatiotemporal Descriptions","This work introduces Video ChatCaptioner, an innovative approach for creating more comprehensive spatiotemporal video descriptions, specifically designed to select frames for posing video content-driven questions and shows promise as a method for enhancing video content.","arXiv.org",2023,"Jun Chen,Deyao Zhu,Kilichbek Haydarov,Xiang Li,Mohamed Elhoseiny",5,42,0
"e1ff32753e20e48b4b01e40b5e820254396e6e70","https://www.semanticscholar.org/paper/e1ff32753e20e48b4b01e40b5e820254396e6e70",5,"LMEye: An Interactive Perception Network for Large Language Models","Interactive Perception Network (IPN), aiming to achieve a LVLM by incorporating the image understanding capability into Large Language Models (LLMs), significantly improves the zero-shot performance of LVLMs on various multimodal tasks compared to previous methods.","arXiv.org",2023,"Yunxin Li,Baotian Hu,Xinyu Chen,Lin Ma,M. Zhang",1,48,0
"42a30dc5470f54ec249f25d3c31e05d7c376c8e3","https://www.semanticscholar.org/paper/42a30dc5470f54ec249f25d3c31e05d7c376c8e3",5,"VisionLLM: Large Language Model is also an Open-Ended Decoder for Vision-Centric Tasks","This work presents an LLM-based framework for vision-centric tasks, termed VisionLLM, which provides a unified perspective for vision and language tasks by treating images as a foreign language and aligning vision-focused tasks with language tasks that can be flexibly defined and managed using language instructions.","arXiv.org",2023,"Wen Wang,Zhe Chen,Xiaokang Chen,Jiannan Wu,Xizhou Zhu,Gang Zeng,Ping Luo,Tong Lu,Jie Zhou,Y. Qiao,Jifeng Dai",15,78,1
"06091944b864d6dc473cab63321a95fb9c4067cc","https://www.semanticscholar.org/paper/06091944b864d6dc473cab63321a95fb9c4067cc",5,"ChatCAD+: Towards a Universal and Reliable Interactive CAD using LLMs","ChatCAD+, which is designed to be universal and reliable, is introduced, capable of handling medical images from diverse domains and leveraging up-to-date information from reputable medical websites to provide reliable medical advice.","arXiv.org",2023,"Zihao Zhao,Sheng Wang,Jinchen Gu,Yitao Zhu,Lanzhuju Mei,Zixu Zhuang,Zhiming Cui,Qian Wang,Dinggang Shen",1,51,0
"31a7d8c4a5ab6bab522494b57270249105c8748e","https://www.semanticscholar.org/paper/31a7d8c4a5ab6bab522494b57270249105c8748e",5,"BiomedGPT: A Unified and Generalist Biomedical Generative Pre-trained Transformer for Vision, Language, and Multimodal Tasks","A unified and generalist Biomedical Generative Pre-trained Transformer model, which leverages self-supervision on large and diverse datasets to accept multi-modal inputs and perform a range of downstream tasks, with far-reaching implications for improving healthcare outcomes.","arXiv.org",2023,"Kaiyuan Zhang,Jun Yu,Zhilin Yan,Yixin Liu,Eashan Adhikarla,S. Fu,Xun Chen,Chen Chen,Yuyin Zhou,Xiang Li,Lifang He,B. Davison,Quanzheng Li,Yong Chen,Hongfang Liu,Lichao Sun",2,143,1
"3d02e5503caa2f444cbd61778c7cdc00a5b2e98d","https://www.semanticscholar.org/paper/3d02e5503caa2f444cbd61778c7cdc00a5b2e98d",4,"GPT4RoI: Instruction Tuning Large Language Model on Region-of-Interest","This paper proposes instruction tuning on region-of-interest, and proposes a region-level vision-language model, termed as GPT4RoI, which brings brand new conversational and interactive experience beyond image-level understanding.","arXiv.org",2023,"Shilong Zhang,Pei Sun,Shoufa Chen,Min Xiao,Wenqi Shao,Wenwei Zhang,Kai Chen,Ping Luo",0,69,0
"7e32aac43e9f1df49e116add03327ee6f365dbf3","https://www.semanticscholar.org/paper/7e32aac43e9f1df49e116add03327ee6f365dbf3",4,"mPLUG-Owl: Modularization Empowers Large Language Models with Multimodality",,"arXiv.org",2023,"Qinghao Ye,Haiyang Xu,Guohai Xu,Jiabo Ye,Ming Yan,Yi Zhou,Junyan Wang,Anwen Hu,Pengcheng Shi,Yaya Shi,Chenliang Li,Yuanhong Xu,Hehong Chen,Junfeng Tian,Qiang Qi,Ji Zhang,Feiyan Huang",34,32,8
"54a8b153ed04a872da878d695239bdc413dc782c","https://www.semanticscholar.org/paper/54a8b153ed04a872da878d695239bdc413dc782c",4,"InternGPT: Solving Vision-Centric Tasks by Interacting with Chatbots Beyond Language","By incorporating pointing instructions, the proposed iGPT significantly improves the efficiency of communication between users and chatbots, as well as the accuracy of chatbots in vision-centric tasks, especially in complicated visual scenarios where the number of objects is greater than 2.","arXiv.org",2023,"Zhaoyang Liu,Yinan He,Wenhai Wang,Weiyun Wang,Yi Wang,Shoufa Chen,Qing-Long Zhang,Yang Yang,Qingyun Li,Jiashuo Yu,Kunchang Li,Zhe Chen,Xuecheng Yang,Xizhou Zhu,Yali Wang,Limin Wang,Ping Luo,Jifeng Dai,Yu Qiao",11,81,0
"d48cb91b9e555194f7494c4d4bb9815021d3ee45","https://www.semanticscholar.org/paper/d48cb91b9e555194f7494c4d4bb9815021d3ee45",4,"VideoChat: Chat-Centric Video Understanding","VideoChat is introduced, an end-to-end chat-centric video understanding system that integrates video foundation models and large language models via a learnable neural interface, excelling in spatiotemporal reasoning, event localization, and causal relationship inference.","arXiv.org",2023,"Kunchang Li,Yinan He,Yi Wang,Yizhuo Li,Wen Wang,Ping Luo,Yali Wang,Limin Wang,Yu Qiao",22,59,7
"9837349417e36ef5be06da0fd6c74042148bdaa2","https://www.semanticscholar.org/paper/9837349417e36ef5be06da0fd6c74042148bdaa2",4,"Visual Programming for Text-to-Image Generation and Evaluation","This work proposes two novel interpretable/explainable visual programming frameworks for text-to-image (T2I) generation and evaluation and introduces VPEval, an interpretable and explainable evaluation framework for T2I generation based on visual programming.","arXiv.org",2023,"Jaemin Cho,Abhaysinh Zala,Mohit Bansal",1,62,0
"6238fd213197ccf0d79191662828e38118a06d79","https://www.semanticscholar.org/paper/6238fd213197ccf0d79191662828e38118a06d79",4,"ECHo: Event Causality Inference via Human-centric Reasoning","A unified framework aligned with the Chain-of-Thought (CoT) paradigm is proposed to assess the reasoning capability of current AI systems and scrutinize the advanced large language and multimodal models via three complementary human-centric ECHo tasks.","arXiv.org",2023,"Yuxi Xie,Guanzhen Li,MingSung Kan",0,69,0
"00fcc983728346a5f3f8f005f1365be54456728e","https://www.semanticscholar.org/paper/00fcc983728346a5f3f8f005f1365be54456728e",4,"EmbodiedGPT: Vision-Language Pre-Training via Embodied Chain of Thought","This work introduces EmbodiedGPT, an end-to-end multi-modal foundation model for embodied AI, empowering embodied agents with multi- modal understanding and execution capabilities, and significantly enhances the success rate of the embodied control task by extracting more effective features.","arXiv.org",2023,"Yao Mu,Qinglong Zhang,Mengkang Hu,Wen Wang,Mingyu Ding,Jun Jin,Bin Wang,Jifeng Dai,Y. Qiao,Ping Luo",8,67,0
"c5c5b9c6660bb2089b781d851cb3fd0ba271d742","https://www.semanticscholar.org/paper/c5c5b9c6660bb2089b781d851cb3fd0ba271d742",4,"Cheap and Quick: Efficient Vision-Language Instruction Tuning for Large Language Models","A novel and affordable solution for the effective VL adaption of LLMs, called Mixture-of-Modality Adaptation (MMA), which adopts lightweight modules, i.e., adapters, to bridge the gap between LLMs and VL tasks, which also enables the joint optimization of the image and language models","arXiv.org",2023,"Gen Luo,Yiyi Zhou,Tianhe Ren,Shen Chen,Xiaoshuai Sun,Rongrong Ji",3,48,2
"f8f8267a2acd7598de6c15327f3953241901a62d","https://www.semanticscholar.org/paper/f8f8267a2acd7598de6c15327f3953241901a62d",4,"On Evaluating Adversarial Robustness of Large Vision-Language Models","Evaluating the robustness of open-source large VLMs in the most realistic and high-risk setting, where adversaries have only black-box system access and seek to deceive the model into returning the targeted responses is proposed.","arXiv.org",2023,"Yunqing Zhao,Tianyu Pang,Chao Du,Xiao Yang,Chongxuan Li,Ngai-Man Cheung,Min Lin",4,102,1
"b458fc5261595f44b36325e5eaea1f874d65138f","https://www.semanticscholar.org/paper/b458fc5261595f44b36325e5eaea1f874d65138f",4,"GPT4Tools: Teaching Large Language Model to Use Tools via Self-instruction","The GPT4Tools based on self-instruct to enable open-source LLMs, such as LLaMA and OPT, to use tools, generates an instruction-following dataset by prompting an advanced teacher with various multi-modal contexts using the Low-Rank Adaptation (LoRA) optimization.","arXiv.org",2023,"Rui Yang,Lin Song,Yanwei Li,Sijie Zhao,Yixiao Ge,Xiu Li,Ying Shan",6,63,2
"d47524cd5c3c4b57af2e5a29f6f91c420310f236","https://www.semanticscholar.org/paper/d47524cd5c3c4b57af2e5a29f6f91c420310f236",4,"MIMIC-IT: Multi-Modal In-Context Instruction Tuning","MultI-Modal In-Context Instruction Tuning (MIMIC-IT), a dataset comprising 2.8 million multimodal instruction-response pairs, with 2.2 million unique instructions derived from images and videos, is presented and a large VLM named Otter is trained.","arXiv.org",2023,"Bo Li,Yuanhan Zhang,Liangyu Chen,Jinghao Wang,Fanyi Pu,Jingkang Yang,C. Li,Ziwei Liu",6,52,1
"74538984e72a26254697d4e7eeeb169000cf762a","https://www.semanticscholar.org/paper/74538984e72a26254697d4e7eeeb169000cf762a",4,"Valley: Video Assistant with Large Language model Enhanced abilitY","The proposed Valley model is designed with a simple projection module that bridges video, image, and language modalities, and is further unified with a multi-lingual LLM, and has the potential to function as a highly effective multilingual video assistant that can make complex video understanding scenarios easy.","arXiv.org",2023,"Ruipu Luo,Ziwang Zhao,Min Yang,Junwei Dong,Ming-Hui Qiu,Pengcheng Lu,Tao Wang,Zhongyu Wei",4,25,1
"e8cc6a50bc9c6a1e1ed7fdde0e7ccbb4efd4b505","https://www.semanticscholar.org/paper/e8cc6a50bc9c6a1e1ed7fdde0e7ccbb4efd4b505",4,"AVIS: Autonomous Visual Information Seeking with Large Language Models","An autonomous information seeking visual question answering framework that leverages a Large Language Model to dynamically strategize the utilization of external tools and to investigate their outputs, thereby acquiring the indispensable knowledge needed to provide answers to the posed questions is proposed.","arXiv.org",2023,"Ziniu Hu,Ahmet Iscen,Chen Sun,Kai-Wei Chang,Yizhou Sun,David A. Ross,C. Schmid,A. Fathi",0,123,0
"53937df61d496572e90ee34c670ddd00337e558d","https://www.semanticscholar.org/paper/53937df61d496572e90ee34c670ddd00337e558d",4,"What Matters in Training a GPT4-Style Language Model with Multimodal Inputs?","Lynx is presented, which performs the most accurate multi-modal understanding while keeping the best multi- modal generation ability compared to existing open-sourced GPT4-style models.","arXiv.org",2023,"Yan Zeng,Hanbo Zhang,Jiani Zheng,Jiangnan Xia,Guoqiang Wei,Yang Wei,Yuchen Zhang,Tao Kong",0,104,0
"efc694164312006c543ef745611348ef64e68dda","https://www.semanticscholar.org/paper/efc694164312006c543ef745611348ef64e68dda",4,"Towards Language Models That Can See: Computer Vision Through the LENS of Natural Language","This work proposes LENS, a modular approach for tackling computer vision problems by leveraging the power of large language models (LLMs) with a language model to reason over outputs from a set of independent and highly descriptive vision modules that provide exhaustive information about an image.","arXiv.org",2023,"William M. Berrios,Gautam Mittal,Tristan Thrush,Douwe Kiela,Amanpreet Singh",1,61,0
"0fea183c4f49a015a8ee7d89ef2e6885b7023c10","https://www.semanticscholar.org/paper/0fea183c4f49a015a8ee7d89ef2e6885b7023c10",4,"SVIT: Scaling up Visual Instruction Tuning","It is empirically verified that training multimodal models on SVIT can significantly improve the multi-modal performance in terms of visual perception, reasoning and planing.","",2023,"Bo Zhao,Boya Wu,Tiejun Huang",0,34,0
"13b5b69355555e0c8b702261c5de3b4172ba653c","https://www.semanticscholar.org/paper/13b5b69355555e0c8b702261c5de3b4172ba653c",4,"The Art of SOCRATIC QUESTIONING: Zero-shot Multimodal Reasoning with Recursive Thinking and Self-Questioning","Qualitative analysis clearly demonstrates the intermediate thinking steps elicited by Socratic Questioning are similar to the human's recursively thinking process of a complex reasoning problem.","arXiv.org",2023,"Jingyuan Qi,Zhiyang Xu,Ying Shen,Minqian Liu,Di Jin,Qifan Wang,Lifu Huang",0,23,0
"f1892409fdbb396b00bb180891bb1c130fe3c7f4","https://www.semanticscholar.org/paper/f1892409fdbb396b00bb180891bb1c130fe3c7f4",4,"Video-LLaMA: An Instruction-tuned Audio-Visual Language Model for Video Understanding","Video-LLaMA showcases the ability to perceive and comprehend video content, generating meaningful responses that are grounded in the visual and auditory information presented in the videos, highlighting the potential of Video- LLaMA as a promising prototype for audio-visual AI assistants.","arXiv.org",2023,"Han Zhang,Xin Li,Lidong Bing",12,32,2
"f4793adffd6f67ffcb93ccfc5672ab301b8a2b96","https://www.semanticscholar.org/paper/f4793adffd6f67ffcb93ccfc5672ab301b8a2b96",4,"PMC-VQA: Visual Instruction Tuning for Medical Visual Question Answering","This paper proposes a generative-based model for medical visual understanding by aligning visual information from a pre-trained vision encoder with a large language model, and establishes a scalable pipeline to construct a large-scale medical visual question-answering dataset.","arXiv.org",2023,"Xiaoman Zhang,Chaoyi Wu,Ziheng Zhao,Weixiong Lin,Ya Zhang,Yanfeng Wang,Weidi Xie",4,38,1
"bf40c9e7832e1b2887cbf5798455f91705ea11ba","https://www.semanticscholar.org/paper/bf40c9e7832e1b2887cbf5798455f91705ea11ba",4,"Masked Vision and Language Pre-training with Unimodal and Multimodal Contrastive Losses for Medical Visual Question Answering","This paper presents a novel self-supervised approach that learns unimodal and multimodal feature representations of input images and text using medical image caption datasets, by leveraging both unimmodal and multi-modal contrastive losses, along with masked language modeling and image text matching as pretraining objectives.","",2023,"Pengfei Li,Gang Liu,Jinlong He,Zixu Zhao,Shenjun Zhong",0,27,0
"a3711dbf296b5ddd97ba93826660cd3995611625","https://www.semanticscholar.org/paper/a3711dbf296b5ddd97ba93826660cd3995611625",3,"Towards A Foundation Model for Generalist Robots: Diverse Skill Learning at Scale via Automated Task and Scene Generation",,"arXiv.org",2023,"Zhou Xian,Théophile Gervet,Zhenjia Xu,Yi-Ling Qiao,Tsun-Hsuan Wang",0,111,0
"70681d0a441381ec862979aabe47530b515ade5a","https://www.semanticscholar.org/paper/70681d0a441381ec862979aabe47530b515ade5a",3,"Towards Generalist Robots: A Promising Paradigm via Generative Simulation","This document presents a specific idea for mining knowledge in the latest large-scale foundation models for robotics research, which uses a fully automated generative pipeline which uses these models to generate diversified tasks, scenes and training supervisions at scale, thereby scaling up low-level skill learning and ultimately leading to a foundation model for robotics that empowers generalist robots.","",2023,"Zhou Xian,Théophile Gervet,Zhenjia Xu,Yi-Ling Qiao,Tsun-Hsuan Wang,Yian Wang",0,118,0
"887138f4c365b9d1325de41a522d27bec34e0d7e","https://www.semanticscholar.org/paper/887138f4c365b9d1325de41a522d27bec34e0d7e",3,"Reasoning with Language Model Prompting: A Survey","This paper provides a comprehensive survey of cutting-edge research on reasoning with language model prompting with comparisons and summaries and provides systematic resources to help beginners.","Annual Meeting of the Association for Computational Linguistics",2022,"Shuofei Qiao,Yixin Ou,Ningyu Zhang,Xiang Chen,Yunzhi Yao,Shumin Deng,Chuanqi Tan,Fei Huang,Huajun Chen",37,204,1
"170c97c7215f42edfb20c2248f954879e91ef86e","https://www.semanticscholar.org/paper/170c97c7215f42edfb20c2248f954879e91ef86e",3,"Chameleon: Plug-and-Play Compositional Reasoning with Large Language Models","This paper presents Chameleon, an AI system that mitigates LLM limitations by augmenting LLMs with plug-and-play modules for compositional reasoning, and shows that the GPT-4-powered planner exhibits more consistent and rational tool selection via inferring potential constraints from instructions, compared to a ChatGPT- powered planner.","arXiv.org",2023,"Pan Lu,Baolin Peng,Hao Cheng,Michel Galley,Kai-Wei Chang,Y. Wu,Song-Chun Zhu,Jianfeng Gao",37,65,5
"405bc18b9d2f783f22f50d5feb02c51b4b34655f","https://www.semanticscholar.org/paper/405bc18b9d2f783f22f50d5feb02c51b4b34655f",3,"LayoutGPT: Compositional Visual Planning and Generation with Large Language Models","This work proposes LayoutGPT, a method to compose in-context visual demonstrations in style sheet language to enhance the visual planning skills of LLMs, and shows superior performance in converting challenging language concepts like numerical and spatial relations to layout arrangements for faithful text-to-image generation.","arXiv.org",2023,"Weixi Feng,Wanrong Zhu,Tsu-Jui Fu,Varun Jampani,Arjun Reddy Akula,Xuehai He,Sugato Basu,X. Wang,William Yang Wang",1,59,0
"1a28e9c62eeb76a1a77dc152197027c15310927b","https://www.semanticscholar.org/paper/1a28e9c62eeb76a1a77dc152197027c15310927b",3,"ANPL: Compiling Natural Programs with Interactive Decomposition","ANPL, a programming system that allows users to decompose user-specific tasks, is introduced and deployed on the Abstraction and Reasoning Corpus (ARC), a set of unique tasks that are challenging for state-of-the-art AI systems.","arXiv.org",2023,"Di Huang,Ziyuan Nan,Xingui Hu,Pengwei Jin,Shaohui Peng,Yuanbo Wen,Rui Zhang,Zidong Du,Qi Guo,Yewen Pu,Yunji Chen",0,67,0
"af705d648b5b16daa3dcc593bc593f2574d76c07","https://www.semanticscholar.org/paper/af705d648b5b16daa3dcc593bc593f2574d76c07",3,"Grammar Prompting for Domain-Specific Language Generation with Large Language Models","Experiments demonstrate that grammar prompting can enable LLMs to perform competitively on a diverse set of DSL generation tasks, including semantic parsing, Overnight, GeoQuery, PDDL planning, and even molecule generation (SMILES).","arXiv.org",2023,"Bailin Wang,Zimu Wang,Xuezhi Wang,Yuan Cao,R. Saurous,Yoon Kim",1,92,0
"ea566f87f6253bb2d32cf7b61cd3e2535a0c3f42","https://www.semanticscholar.org/paper/ea566f87f6253bb2d32cf7b61cd3e2535a0c3f42",3,"mPLUG-DocOwl: Modularized Multimodal Large Language Model for Document Understanding","Experimental results show that the proposed mPLUG-DocOwl model outperforms existing multi-modal models, demonstrating its strong ability of document understanding, and also generalizes well on various downstream tasks.","arXiv.org",2023,"Jiabo Ye,Anwen Hu,Haiyang Xu,Qinghao Ye,Mingshi Yan,Yuhao Dan,Chenlin Zhao,Guohai Xu,Chenliang Li,Junfeng Tian,Qiang Qi,Ji Zhang,Feiyan Huang",0,34,0
"d1120d67b700e4dfe8b39eb1e48fbdea4e1a0c43","https://www.semanticscholar.org/paper/d1120d67b700e4dfe8b39eb1e48fbdea4e1a0c43",3,"HuggingGPT: Solving AI Tasks with ChatGPT and its Friends in Hugging Face","HuggingGPT is a framework that leverages LLMs (e.g., ChatGPT) to connect various AI models in machine learning communities to solve AI tasks and is able to cover numerous sophisticated AI tasks in different modalities and domains and achieve impressive results in language, vision, speech, and other challenging tasks.","arXiv.org",2023,"Yongliang Shen,Kaitao Song,Xu Tan,D. Li,Weiming Lu,Y. Zhuang",125,39,17
"1a8eb2cae1833df3bf12fe3b41b03d60b4a4a98d","https://www.semanticscholar.org/paper/1a8eb2cae1833df3bf12fe3b41b03d60b4a4a98d",3,"Visual Instruction Tuning","This paper presents LLaVA: Large Language and Vision Assistant, an end-to-end trained large multimodal model that connects a vision encoder and LLM for general-purpose visual and language understanding and introduces GPT-4 generated visual instruction tuning data, the model and code base publicly available.","arXiv.org",2023,"Haotian Liu,Chunyuan Li,Qingyang Wu,Yong Jae Lee",88,55,41
"43e6e8d6663d83f1b74cf5a2be7b040b0928f867","https://www.semanticscholar.org/paper/43e6e8d6663d83f1b74cf5a2be7b040b0928f867",3,"X-LLM: Bootstrapping Advanced Large Language Models by Treating Multi-Modalities as Foreign Languages","X-LLM is proposed, which converts Multi-modalities into foreign languages using X2L interfaces and inputs them into a large Language model (ChatGLM), and demonstrates impressive multimodel chat abilities.","arXiv.org",2023,"Feilong Chen,Minglun Han,Haozhi Zhao,Qingyang Zhang,Jing Shi,Shuang Xu,Bo Xu",12,61,3
"6a5525c316b9be7909c433a79e090ed731425083","https://www.semanticscholar.org/paper/6a5525c316b9be7909c433a79e090ed731425083",3,"What Makes for Good Visual Tokenizers for Large Language Models?","A new MLLM equipped with a tailored Good Visual Tokenizer (GVT), which exhibits strong visual comprehension capability at multiple scales, without introducing extra parameters and task-specific fine-tuning.","arXiv.org",2023,"Guangzhi Wang,Yixiao Ge,Xiaohan Ding,Mohan S. Kankanhalli,Ying Shan",1,54,0
