"id","url","score","title","summary","venue","year","authors","citationCount","referenceCount","influentialCitationCount"
"d39182113cd4176ead48027b4fc05fe06ec6aaca","https://www.semanticscholar.org/paper/d39182113cd4176ead48027b4fc05fe06ec6aaca",3,"Language Models as Black-Box Optimizers for Vision-Language Models","This work aims to develop a novel fine-tuning approach for VLMs through natural language prompts, thereby avoiding the need to access model parameters, feature embeddings, or output logits, and finds that the text prompts generated through this strategy are not only more interpretable but also transfer well across different CLIP architectures in a black-box manner.","arXiv.org",2023,"Samuel Yu,Shihong Liu,Zhiqiu Lin,Deepak Pathak,Deva Ramanan",1,93,0
"7a7128e9696dfedc24bf432c4b4c3aafa5e95a1a","https://www.semanticscholar.org/paper/7a7128e9696dfedc24bf432c4b4c3aafa5e95a1a",3,"An Empirical Study of Scaling Instruct-Tuned Large Multimodal Models","An empirical study of scaling LLaVA up to 33B and 65B/70B and performance of LoRA/QLoRA tuning of LMM are comparable to the performance of full-model fine-tuning, finding that scaling LMM consistently enhances model performance and improves language capabilities.","arXiv.org",2023,"Yadong Lu,Chunyuan Li,Haotian Liu,Jianwei Yang,Jianfeng Gao,Yelong Shen",2,22,0
"e7d09b6f2bc878cf2c993acf675f409d0b55f35a","https://www.semanticscholar.org/paper/e7d09b6f2bc878cf2c993acf675f409d0b55f35a",3,"MiniGPT-5: Interleaved Vision-and-Language Generation via Generative Vokens","This work introduces an innovative interleaved vision-and-language generation technique anchored by the concept of ""generative vokens,"" which acts as the bridge for harmonized image-text outputs and exhibits substantial improvement over the baseline Divter model on the MMDialog dataset.","arXiv.org",2023,"Kaizhi Zheng,Xuehai He,Xin Eric Wang",0,38,0
"84f9bc5f89dac53662fb467b6af8ff26415ca3e7","https://www.semanticscholar.org/paper/84f9bc5f89dac53662fb467b6af8ff26415ca3e7",3,"InstructDET: Diversifying Referring Object Detection with Generalized Instructions","A data-centric method for referring object detection (ROD) that localizes target objects based on user instructions and shows that a conventional ROD model surpasses existing methods on standard REC datasets and the authors' InDET test set.","arXiv.org",2023,"Ronghao Dang,Jiangyan Feng,Haodong Zhang,Chongjian Ge,Lin Song,Lijun Gong,Chengju Liu,Qi Chen,Feng Zhu,Rui Zhao,Yibing Song",0,62,0
"33095b1334bed852e3652bd9d7da3f4df0cdf485","https://www.semanticscholar.org/paper/33095b1334bed852e3652bd9d7da3f4df0cdf485",3,"ViCor: Bridging Visual Understanding and Commonsense Reasoning with Large Language Models","This work explores the synergistic capabilities of pre-trained vision-and-language models (VLMs) and large language models (LLMs) for visual commonsense reasoning (VCR) and suggests a collaborative approach where LLMs, when uncertain about their reasoning, actively direct VLMs to concentrate on and gather relevant visual elements to support potential commonsense inferences.","",2023,"KAI-QING Zhou,Kwonjoon Lee,Teruhisa Misu,Xin Eric Wang",0,33,0
"28fbbf98bac1bb941162df553ca034d600cb59a6","https://www.semanticscholar.org/paper/28fbbf98bac1bb941162df553ca034d600cb59a6",3,"Rephrase, Augment, Reason: Visual Grounding of Questions for Vision-Language Models","Rephrase, Augment and Reason (RepARe), a gradient-free framework that extracts salient details about the image using the underlying LVLM as a captioner and reasoner, in order to propose modifications to the original question, is presented.","",2023,"Archiki Prasad,Elias Stengel-Eskin,Mohit Bansal",0,109,0
"b3e9f249dd2e09ec111496f6b533101e8217a5b0","https://www.semanticscholar.org/paper/b3e9f249dd2e09ec111496f6b533101e8217a5b0",3,"Multimodal Large Language Model for Visual Navigation","This work designs a model that combines a simple text prompt, current observations, and a history collector model that gathers information from previous observations as input and provides a probability distribution of possible actions that the agent can take during navigation.","",2023,"Yao-Hung Tsai,Vansh Dhar,Jialu Li,Bowen Zhang,Jian Zhang",0,40,0
"ac2e5bf716aed246ca8914a6816ef73e00286099","https://www.semanticscholar.org/paper/ac2e5bf716aed246ca8914a6816ef73e00286099",3,"Beyond Segmentation: Road Network Generation with Multi-Modal LLMs","An innovative approach to road network generation through the utilization of a multi-modal Large Language Model (LLM), specifically designed to process aerial images of road layouts and produce detailed, navigable road networks within the input images.","",2023,"Sumedh Rasal,S. Boddhu",0,35,0
"5ddb51ae85deca14dc7fc8adc07305c22a1ebe0a","https://www.semanticscholar.org/paper/5ddb51ae85deca14dc7fc8adc07305c22a1ebe0a",3,"Qwen-VL: A Frontier Large Vision-Language Model with Versatile Abilities","The Qwen-VL series is introduced, a set of large-scale vision-language models designed to perceive and understand both text and images that outperforms existing Large Vision Language Models (LVLMs).","arXiv.org",2023,"Jinze Bai,Shuai Bai,Shusheng Yang,Shijie Wang,Sinan Tan,Peng Wang,Junyang Lin,Chang Zhou,Jingren Zhou",11,81,3
"fc8988585c6846fdeee33b34779a6a87b92c3e86","https://www.semanticscholar.org/paper/fc8988585c6846fdeee33b34779a6a87b92c3e86",3,"Equivariant Similarity for Vision-Language Foundation Models","This study proposes EqSim, a regularization loss that can be efficiently calculated from any two matched training pairs and easily pluggable into existing image-text retrieval fine-tuning and presents a new challenging benchmark EqBen, the first to focus on ""visual-minimal change"".","arXiv.org",2023,"Tan Wang,Kevin Lin,Linjie Li,Chung-Ching Lin,Zhengyuan Yang,Hanwang Zhang,Zicheng Liu,Lijuan Wang",4,82,2
"9a22b33b529484c912d1ea9f8698369d4546a1c1","https://www.semanticscholar.org/paper/9a22b33b529484c912d1ea9f8698369d4546a1c1",3,"Transfer Visual Prompt Generator across LLMs","This work investigates the VPG transferability across LLMs, and designs a two-stage transfer framework named VPGTrans, which is simple yet highly effective and demonstrated to significantly speed up the transfer learning process without compromising performance.","arXiv.org",2023,"Ao Zhang,Hao Fei,Yuan Yao,Wei Ji,Li Li,Zhiyuan Liu,Tat-Seng Chua",28,35,5
"d886fc1b43b1c14b1c82ce8e4eab7c48e2c6d7af","https://www.semanticscholar.org/paper/d886fc1b43b1c14b1c82ce8e4eab7c48e2c6d7af",3,"Paxion: Patching Action Knowledge in Video-Language Foundation Models","This work proposes a novel framework, Paxion, along with a new Discriminative Video Dynamics Modeling (DVDM) objective, which effectively fills the gap in action knowledge understanding, while maintaining or improving performance on a wide spectrum of both object- and action-centric downstream tasks.","arXiv.org",2023,"Zhenhailong Wang,Ansel Blume,Sha Li,Genglin Liu,Jaemin Cho,Zineng Tang,Mohit Bansal,Heng Ji",4,62,0
"bfa9df38bd8597d8cdf0c3497fe5e5a5e31f646f","https://www.semanticscholar.org/paper/bfa9df38bd8597d8cdf0c3497fe5e5a5e31f646f",3,"ONE-PEACE: Exploring One General Representation Model Toward Unlimited Modalities","This work releases ONE-PEACE, a highly extensible model with 4B parameters that can seamlessly align and integrate representations across vision, audio, and language modalities, and develops two modality-agnostic pretraining tasks, which align the semantic space of different modalities and capture fine-grained details within modalities concurrently.","arXiv.org",2023,"Peng Wang,Shijie Wang,Junyang Lin,Shuai Bai,Xiaohuan Zhou,Jingren Zhou,Xinggang Wang,Chang Zhou",13,172,1
"6fe2a4f7594abadafc9feb05e96ab7e9e634ce8f","https://www.semanticscholar.org/paper/6fe2a4f7594abadafc9feb05e96ab7e9e634ce8f",3,"Album Storytelling with Iterative Story-aware Captioning and Large Language Models","This work proposes a new iterative album storytelling pipeline, which starts with an initial story and builds a story-aware caption model to refine the captions using the whole story as guidance, then feeds into the LLMs to generate a new refined story.","arXiv.org",2023,"Munan Ning,Yujia Xie,Dongdong Chen,Zeyin Song,Lu Yuan,Yonghong Tian,Qixiang Ye,Liuliang Yuan",2,58,1
"065dcc6074ffc9e314799d97c1757e5d23e7e2b1","https://www.semanticscholar.org/paper/065dcc6074ffc9e314799d97c1757e5d23e7e2b1",3,"S-CLIP: Semi-supervised Vision-Language Pre-training using Few Specialist Captions","S-CLIP is proposed, a semi-supervised learning method for training CLIP that utilizes additional unpaired images and employs two pseudo-labeling strategies specifically designed for contrastive learning and the language modality.","arXiv.org",2023,"Sangwoo Mo,Min-Kyung Kim,Kyungmin Lee,Jinwoo Shin",0,100,0
"f45a3474bd38d65c1b2cc3342a64dacbf07f445a","https://www.semanticscholar.org/paper/f45a3474bd38d65c1b2cc3342a64dacbf07f445a",3,"Cream: Visually-Situated Natural Language Understanding with Contrastive Reading Model and Frozen Large Language Models","The Contrastive Reading Model (Cream) is proposed, a novel neural architecture designed to enhance the language-image understanding capability of LLMs by capturing intricate details typically overlooked by existing methods.","arXiv.org",2023,"Geewook Kim,Hodong Lee,D. Kim,Haeji Jung,S. Park,Yoon Kim,Sangdoo Yun,T. Kil,Bado Lee,Seunghyun Park",2,69,0
"0983883619a0ca597d055d0e58da2f514052913d","https://www.semanticscholar.org/paper/0983883619a0ca597d055d0e58da2f514052913d",3,"Macaw-LLM: Multi-Modal Language Modeling with Image, Audio, Video, and Text Integration","This work proposes Macaw-LLM, a novel multi-modal LLM that seamlessly integrates visual, audio, and textual information and builds on the work of previous work on instruction-tuned large language models to handle diverse data modalities and address complex real-world scenarios.","arXiv.org",2023,"Chenyang Lyu,Minghao Wu,Longyue Wang,Xinting Huang,Bingshuai Liu,Zefeng Du,Shuming Shi,Zhaopeng Tu",18,54,5
"8efc20988021ce3b4b05dd44b13e27260ee9b99b","https://www.semanticscholar.org/paper/8efc20988021ce3b4b05dd44b13e27260ee9b99b",3,"Investigating Prompting Techniques for Zero- and Few-Shot Visual Question Answering","It is demonstrated that carefully designed question templates and the integration of additional visual cues, like image captions, can contribute to improved VQA performance, especially when used in conjunction with few-shot examples, however, a limitation in the use of chain-of-thought rationalization is identified, which negatively affects V QA accuracy.","arXiv.org",2023,"Rabiul Awal,Le Zhang,Aishwarya Agrawal",1,45,0
"94053805cd59f2e9a47fe3f080c7e7afefb337cc","https://www.semanticscholar.org/paper/94053805cd59f2e9a47fe3f080c7e7afefb337cc",3,"Generative Pretraining in Multimodality","Emu, a Transformer-based multimodal foundation model, is presented, which can seamlessly generate images and texts in multi-modality context through a one-model-for-all autoregressive training process and demonstrates superb performance compared to state-of-the-art large multimodAL models.","arXiv.org",2023,"Quan Sun,Qiying Yu,Yufeng Cui,Fan Zhang,Xiaosong Zhang,Yueze Wang,Hongcheng Gao,Jingjing Liu,Tiejun Huang,Xinlong Wang",19,74,5
"41c6028c620debae00ca5b30e2db5977225fec57","https://www.semanticscholar.org/paper/41c6028c620debae00ca5b30e2db5977225fec57",3,"mBLIP: Efficient Bootstrapping of Multilingual Vision-LLMs",,"arXiv.org",2023,"Gregor Geigle,Abhay Jain,R. Timofte,Goran Glavavs",0,84,0
"2e3dcf5a5d58ac210d0d87e9f918540a8373211a","https://www.semanticscholar.org/paper/2e3dcf5a5d58ac210d0d87e9f918540a8373211a",3,"GIT-Mol: A Multi-modal Large Language Model for Molecular Science with Graph, Image, and Text","GIT-Mol is introduced, a multi-modal large language model that integrates the structure Graph, Image, and Text information, including the Simplified Molecular Input Line Entry System (SMILES) and molecular captions, and proposes GIT-Former, a novel architecture capable of mapping all modalities into a unified latent space.","arXiv.org",2023,"Peng Liu,Yiming Ren,Zhixiang Ren",1,59,0
"431a2dfd60225e615cf27d044ad00a6ac147501f","https://www.semanticscholar.org/paper/431a2dfd60225e615cf27d044ad00a6ac147501f",3,"Qwen-VL: A Versatile Vision-Language Model for Understanding, Localization, Text Reading, and Beyond","The Qwen-VL series, a set of large-scale vision-language models (LVLMs) designed to perceive and understand both texts and images, set new records for generalist models under similar model scales on a broad range of visual-centric benchmarks.","",2023,"Jinze Bai,Shuai Bai,Shusheng Yang,Shijie Wang,Sinan Tan,Peng Wang,Junyang Lin,Chang Zhou,Jingren Zhou",4,86,0
"772724892819d7e6f15ce536753fdc32d022c0e0","https://www.semanticscholar.org/paper/772724892819d7e6f15ce536753fdc32d022c0e0",3,"A Survey on Image-text Multimodal Models","An exhaustive overview of the present research landscape of image-text multimodal models is offered, introducing a novel classification that segments their evolution into three distinct phases, based on their time of introduction and subsequent impact on the discipline.","arXiv.org",2023,"Ruifeng Guo,Jingxuan Wei,Linzhuang Sun,Bihui Yu,Guiyong Chang,Dawei Liu,Sibo Zhang,Zhengbing Yao,Mingjun Xu,Liping Bu",0,231,0
"96c43227831c4c3b12b7c64809e78674cea3a8a1","https://www.semanticscholar.org/paper/96c43227831c4c3b12b7c64809e78674cea3a8a1",3,"DeepSpeed-VisualChat: Multi-Round Multi-Image Interleave Chat via Multi-Modal Causal Attention","The DeepSpeed-VisualChat framework is presented, designed to optimize Large Language Models by incorporating multi-modal capabilities, with a focus on enhancing the proficiency of Large Vision and Language Models in handling interleaved inputs.","arXiv.org",2023,"Z. Yao,Xiaoxia Wu,Conglong Li,Minjia Zhang,Heyang Qi,Olatunji Ruwase,A. Awan,Samyam Rajbhandari,Yuxiong He",0,47,0
"11a4284e335ba39330b59d9f42ca3272a6166991","https://www.semanticscholar.org/paper/11a4284e335ba39330b59d9f42ca3272a6166991",3,"A Survey of Chain of Thought Reasoning: Advances, Frontiers and Future","A thorough survey of the current research according to the taxonomies of methods within the domain of chain-of-thought reasoning, and describes XoT with frontier applications, covering planning, tool use, and distillation.","arXiv.org",2023,"Zheng Chu,Jingchang Chen,Qianglong Chen,Weijiang Yu,Tao He,Haotian Wang,Weihua Peng,Ming Liu,Bing Qin,Ting Liu",0,211,0
"a5d27bf7a2155d4ca016565a78b52ee90f81624c","https://www.semanticscholar.org/paper/a5d27bf7a2155d4ca016565a78b52ee90f81624c",3,"Beyond Task Performance: Evaluating and Reducing the Flaws of Large Multimodal Models with In-Context Learning","Despite their success, LMMs have flaws that remain unsolved with scaling alone and the effect of ICL on LMMs flaws is nuanced; despite its effectiveness for improved explainability, abstention, and instruction following, ICL does not improve compositional abilities, and actually even amplifies hallucinations.","arXiv.org",2023,"Mustafa Shukor,Alexandre Ramé,Corentin Dancette,M. Cord",0,95,0
"f220d3218f84340d1e06e01b89d9c3d64e61edd1","https://www.semanticscholar.org/paper/f220d3218f84340d1e06e01b89d9c3d64e61edd1",3,"SimVLG: Simple and Efficient Pretraining of Visual Language Generative Models","A one-stage, single-loss framework for the pre-training of computationally intensive vision-language generative models, leveraging frozen pre-trained large language models (LLMs), which effectively compacts the visual information while preserving the richness of semantic content, leading to fast convergence without sacrificing performance.","arXiv.org",2023,"Yiren Jian,Tingkai Liu,Yunzhe Tao,Soroush Vosoughi,HX Yang",0,59,0
"23684a07517870cffd1f97fafbaae16ba22bd2b7","https://www.semanticscholar.org/paper/23684a07517870cffd1f97fafbaae16ba22bd2b7",3,"Large AI Models in Health Informatics: Applications, Challenges, and the Future","Seven key sectors in which large AI models are applicable and might have substantial influence, including 1) bioinformatics; 2) medical diagnosis; 3) medical imaging; 4) medical informatics; 5) medical education; 6) public health; and 7) medical robotics are identified.","IEEE journal of biomedical and health informatics",2023,"Jianing Qiu,Lin Li,Jiankai Sun,Jiachuan Peng,Peilun Shi,Rui Zhang,Yinzhao Dong,Kyle Lam,F. P. Lo,Bo Xiao,Wu Yuan,Dong Xu,Benny P. L. Lo",18,345,0
"c9dbdae8146b9f97e254f5d26fd6efde96eaa703","https://www.semanticscholar.org/paper/c9dbdae8146b9f97e254f5d26fd6efde96eaa703",3,"Med-Flamingo: a Multimodal Medical Few-shot Learner","Med-Flamingo improves performance in generative medical VQA by up to 20\% in clinician's rating and firstly enables multimodal medical few-shot adaptations, such as rationale generation, as well as releasing the model, code, and evaluation app.","arXiv.org",2023,"Michael Moor,Qian Huang,Shirley Wu,Michihiro Yasunaga,C. Zakka,Yashodhara Dalmia,E. Reis,P. Rajpurkar,J. Leskovec",5,30,2
"5b038c1a93967072cc76689fd805e756f804cc42","https://www.semanticscholar.org/paper/5b038c1a93967072cc76689fd805e756f804cc42",3,"Large Models for Time Series and Spatio-Temporal Data: A Survey and Outlook","This survey coalesces the latest strides in large model-centric research on time series and spatio-temporal data, underscoring the solid foundations, current advances, practical applications, abundant resources, and future research opportunities.","",2023,"Ming Jin,Qingsong Wen,Yuxuan Liang,Chaoli Zhang,Siqiao Xue,Xue Wang,James Y. Zhang,Yi Wang,Haifeng Chen,Xiaoli Li,Shirui Pan,Vincent S. Tseng,Yu Zheng,Lei Chen,Hui Xiong",0,343,0
"cb5f53cd7d43ac6f48abf4dde6fc58e53a083b0e","https://www.semanticscholar.org/paper/cb5f53cd7d43ac6f48abf4dde6fc58e53a083b0e",3,"Accelerating the integration of ChatGPT and other large‐scale AI models into biomedical research and healthcare","","MedComm – Future Medicine",2023,"Ding‐Qiao Wang,Long‐Yu Feng,Jin‐Guo Ye,Jin‐Gen Zou,Yingfeng Zheng",12,99,0
"d92c797f587ce7f1b001920ab9e6b7d31960bd77","https://www.semanticscholar.org/paper/d92c797f587ce7f1b001920ab9e6b7d31960bd77",3,"RemoteCLIP: A Vision Language Foundation Model for Remote Sensing","RemoteCLIP is proposed, the first vision-language foundation model for remote sensing that aims to learn robust visual features with rich semantics, as well as aligned text embeddings for seamless downstream application and consistently outperforms baseline foundation models across different model scales.","arXiv.org",2023,"F. Liu,Delong Chen,Zhan-Rong Guan,Xiaocong Zhou,Jiale Zhu,Jun Zhou",4,109,0
"4df485f8ad1c55f8a3fd3f06b5cc46bcb4f0ddc1","https://www.semanticscholar.org/paper/4df485f8ad1c55f8a3fd3f06b5cc46bcb4f0ddc1",3,"A Foundation LAnguage-Image model of the Retina (FLAIR): Encoding expert knowledge in text supervision","Interestingly, FLAIR outperforms by a large margin more generalist, larger-scale image-language models, which emphasizes the potential of embedding experts' domain knowledge and the limitations of generalist models in medical imaging.","arXiv.org",2023,"Julio Silva-Rodríguez,H. Chakor,R. Kobbi,J. Dolz,Ismail Ben Ayed",0,109,0
"82e849a32601090fbf820f5d381dba43b52a8ed5","https://www.semanticscholar.org/paper/82e849a32601090fbf820f5d381dba43b52a8ed5",3,"Do DALL-E and Flamingo Understand Each Other?","A reconstruction task where Flamingo generates a description for a given image and DALL-E uses this description as input to synthesize a new image finds that an optimal description of an image is one that gives rise to a generated image similar to the original one.","arXiv.org",2022,"Hang Li,Jindong Gu,Rajat Koner,Sahand Sharifzadeh,Volker Tresp",6,94,0
"0fe88452660cb8a0e37f54bcd44f3cd6504354b5","https://www.semanticscholar.org/paper/0fe88452660cb8a0e37f54bcd44f3cd6504354b5",3,"Unified Model for Image, Video, Audio and Language Tasks","The proposed UnIVAL model is efficiently pretrained on many tasks, based on task balancing and multimodal curriculum learning, and unifies text, images, video, and audio into a single model, allowing for out-of-distribution generalization.","arXiv.org",2023,"Mustafa Shukor,Corentin Dancette,Alexandre Ramé,M. Cord",8,158,1
"785650a805851c7e945523e495c5a523c60f72a4","https://www.semanticscholar.org/paper/785650a805851c7e945523e495c5a523c60f72a4",3,"Open-Ended Medical Visual Question Answering Through Prefix Tuning of Language Models","This work focuses on open-ended VQA and motivated by the recent advances in language models consider it as a generative task, and introduces a novel method particularly suited for small, domain-specific, medical datasets.","International Conference on Medical Image Computing and Computer-Assisted Intervention",2023,"Tom van Sonsbeek,Mohammad Mahdi Derakhshani,Ivona Najdenkoska,Cees G. M. Snoek,M. Worring",6,35,3
"bf40c9e7832e1b2887cbf5798455f91705ea11ba","https://www.semanticscholar.org/paper/bf40c9e7832e1b2887cbf5798455f91705ea11ba",3,"Masked Vision and Language Pre-training with Unimodal and Multimodal Contrastive Losses for Medical Visual Question Answering","This paper presents a novel self-supervised approach that learns unimodal and multimodal feature representations of input images and text using medical image caption datasets, by leveraging both unimmodal and multi-modal contrastive losses, along with masked language modeling and image text matching as pretraining objectives.","International Conference on Medical Image Computing and Computer-Assisted Intervention",2023,"Pengfei Li,Gang Liu,Jinlong He,Zixu Zhao,Shenjun Zhong",0,27,0
"69c4c645bf06c511cbb2dac3bb9f0da6637900f7","https://www.semanticscholar.org/paper/69c4c645bf06c511cbb2dac3bb9f0da6637900f7",3,"Towards Generalist Foundation Model for Radiology","This study constructs a large-scale Medical Multi-modal Dataset, MedMD, which consists of 16M 2D and 3D medical scans with high-quality text descriptions or reports across various data formats, modalities, and tasks, and proposes a new evaluation benchmark, RadBench, that comprises five tasks, aiming to comprehensively assess the capability of foundation models in handling practical clinical problems.","arXiv.org",2023,"Chaoyi Wu,Xiaoman Zhang,Ya Zhang,Yanfeng Wang,Weidi Xie",3,47,0
"72b06aef94f798ad9035b5775c186fd2fd6a8f38","https://www.semanticscholar.org/paper/72b06aef94f798ad9035b5775c186fd2fd6a8f38",3,"Multi-domain improves out-of-distribution and data-limited scenarios for medical image analysis","The incorporation of diverse medical image domains, including different imaging modalities like X-ray, MRI, CT, and ultrasound images, as well as various viewpoints such as axial, coronal, and sagittal views, are introduced to underscore the superior generalization capabilities of multi-domain models, particularly in scenarios characterized by limited data availability and out-of-distribution.","",2023,"Ece Ozkan,Xavier Boix",0,62,0
"82a9b8984e26fdf234431459bdb445fbcfc3cb76","https://www.semanticscholar.org/paper/82a9b8984e26fdf234431459bdb445fbcfc3cb76",2,"Visual Instruction Tuning with Polite Flamingo","Polite Flamingo is introduced, a multi-modal response rewriter that transforms raw annotations into a more appealing,""polite""format and demonstrates its advantages in both multi- modal understanding and response politeness according to automated and human evaluations.","arXiv.org",2023,"Delong Chen,Jianfeng Liu,Wenliang Dai,Baoyuan Wang",6,78,0
"bb1083425517bdac8d9a6438fcf5032543acb20e","https://www.semanticscholar.org/paper/bb1083425517bdac8d9a6438fcf5032543acb20e",2,"Evaluation and Analysis of Hallucination in Large Vision-Language Models","This paper proposes Hallucination Evaluation based on Large Language Models (HaELM), an LLM-based hallucination evaluation framework that achieves an approximate 95% performance comparable to ChatGPT and has additional advantages including low cost, reproducibility, privacy preservation and local deployment.","arXiv.org",2023,"Junyan Wang,Yi Zhou,Guohai Xu,Pengcheng Shi,Chenlin Zhao,Haiyang Xu,Qinghao Ye,Mingshi Yan,Ji Zhang,Jihua Zhu,J. Sang,Haoyu Tang",2,35,0
"0f8d12775a4685575f1489796b5dee9e11fbdfb5","https://www.semanticscholar.org/paper/0f8d12775a4685575f1489796b5dee9e11fbdfb5",2,"OphGLM: Training an Ophthalmology Large Language-and-Vision Assistant based on Instructions and Dialogue","This paper establishes a new ophthalmic multimodal instruction-following and dialogue fine-tuning dataset based on disease-related knowledge data and publicly available real-world medical dialogue, and introduces visual ability into the large language model to complete the OphGLM.","arXiv.org",2023,"Weihao Gao,Zhuo Deng,Zhiyuan Niu,Fuju Rong,Chucheng Chen,Zheng Gong,Wenze Zhang,Daimin Xiao,Fangjun Li,Zhenjie Cao,Zhaoyi Ma,Wenbin Wei,Lan Ma",2,25,1
"b18daa14486920016c4664c3ed1759f2de1ba854","https://www.semanticscholar.org/paper/b18daa14486920016c4664c3ed1759f2de1ba854",2,"Exploring Transfer Learning in Medical Image Segmentation using Vision-Language Models","The results indicate that VLSMs trained in natural image-text pairs transfer reasonably to the medical domain in zero-shot settings when prompted appropriately for non-radiology photographic modalities; when finetuned, they obtain comparable performance to conventional architectures, even in X-rays and ultrasound modalities.","arXiv.org",2023,"K. Poudel,Manish Dhakal,Prasiddha Bhandari,Rabin Adhikari,Safal Thapaliya,Bishesh Khanal",1,80,0
