"id","url","score","title","summary","venue","year","authors","citationCount","referenceCount","influentialCitationCount"
"ca055cfb9d4d47124cc035c346f38577825fcacf","https://www.semanticscholar.org/paper/ca055cfb9d4d47124cc035c346f38577825fcacf",3,"Enhance Reasoning Ability of Visual-Language Models via Large Language Models","A method called TReE is proposed, which transfers the reasoning ability of a large language model to a visual language model in zero-shot scenarios, and contains three stages: observation, thinking, and re-thinking.","arXiv.org",2023,"Yueting Yang,Xintong Zhang,Wenjuan Han",0,35,0
"c6ac708b65b24c20f80831d518c1795ce8133ad5","https://www.semanticscholar.org/paper/c6ac708b65b24c20f80831d518c1795ce8133ad5",3,"ChatBridge: Bridging Modalities with Large Language Model as a Language Catalyst","It is shown that only language-paired two-modality data is sufficient to connect all modalities and ChatBridge, a novel multimodal language model that leverages the expressive capabilities of language as the catalyst to bridge the gap between various modalities, is presented.","arXiv.org",2023,"Zijia Zhao,Longteng Guo,Tongtian Yue,Si-Qing Chen,Shuai Shao,Xinxin Zhu,Zehuan Yuan,Jing Liu",5,71,1
"50c1414fe41d0cb9db6f0933c9319aa124beac5d","https://www.semanticscholar.org/paper/50c1414fe41d0cb9db6f0933c9319aa124beac5d",3,"Contextual Object Detection with Multimodal Large Language Models","The ContextDET is presented, a unified multimodal model that is capable of end-to-end differentiable modeling of visual-language contexts, so as to locate, identify, and associate visual objects with language inputs for human-AI interaction.","arXiv.org",2023,"Yuhang Zang,Wei Li,Jun Han,Kaiyang Zhou,Chen Change Loy",3,84,0
"705e0f1887d76c956e3a1750f0176f2b8fe121ff","https://www.semanticscholar.org/paper/705e0f1887d76c956e3a1750f0176f2b8fe121ff",3,"Zero-Shot 3D Shape Correspondence","This work introduces a fully automatic method that exploits the exceptional reasoning capabilities of recent foundation models in language and vision to tackle difficult shape correspondence problems and produces highly plausible results in a zero-shot manner, especially between strongly non-isometric shapes.","arXiv.org",2023,"Ahmed Abdelreheem,A. Eldesokey,M. Ovsjanikov,Peter Wonka",1,52,0
"fed150a219f9c31bdb4920e615c7c9264c634736","https://www.semanticscholar.org/paper/fed150a219f9c31bdb4920e615c7c9264c634736",3,"On the Challenges and Perspectives of Foundation Models for Medical Image Analysis","The opportunities, applications and future directions of large-scale pre-trained models, i.e., foundation models, for analyzing medical images, and how foundation models can be leveraged in downstream medical tasks to enhance the accuracy and efficiency of medical image analysis are discussed.","arXiv.org",2023,"Shaoting Zhang,Dimitris N. Metaxas",1,44,0
"79150cb420d15830c8d36f0e91eea1b02e177f0f","https://www.semanticscholar.org/paper/79150cb420d15830c8d36f0e91eea1b02e177f0f",3,"Sticker820K: Empowering Interactive Retrieval with Stickers","The StickerCLIP is proposed as a benchmark model on the Sticker820K dataset, demonstrating strong superiority over the CLIP for the text-to-image retrieval task, and the recently popularized LLM is extended by means of prompt tuning, integrating its ability for sticker retrieval and allowing users to retrieve stickers through instructions.","arXiv.org",2023,"Sijie Zhao,Yixiao Ge,Zhongang Qi,Lin Song,Xiaohan Ding,Zehua Xie,Ying Shan",0,36,0
"697e0add95e880bd42e00bef838181e105f91981","https://www.semanticscholar.org/paper/697e0add95e880bd42e00bef838181e105f91981",3,"MME: A Comprehensive Evaluation Benchmark for Multimodal Large Language Models","The first MLLM Evaluation benchmark MME is presented, which suggests that existing MLLMs still have a large room for improvement, but also reveals the potential directions for the subsequent model optimization.","arXiv.org",2023,"Chaoyou Fu,Peixian Chen,Yunhang Shen,Yulei Qin,Mengdan Zhang,Xu Lin,Zhenyu Qiu,Wei Lin,Jinrui Yang,Xiawu Zheng,Ke Li,Xing Sun,Rongrong Ji",3,42,1
"85d9151aa2efd0cbe822e403138cfe49f9536703","https://www.semanticscholar.org/paper/85d9151aa2efd0cbe822e403138cfe49f9536703",3,"SITTA: A Semantic Image-Text Alignment for Image Captioning","This work introduces two novel ways of constructing a linear mapping that successfully transfers semantics between the embedding spaces of the two pretrained models, and makes image captioning more accessible for institutions with restricted computational resources.","",2023,"Fabian Paischer,Thomas Adler,M. Hofmarcher,S. Hochreiter",0,116,0
"c50ebdb0be883bb4e21270ba990220745c6a9cf9","https://www.semanticscholar.org/paper/c50ebdb0be883bb4e21270ba990220745c6a9cf9",3,"RemoteCLIP: A Vision Language Foundation Model for Remote Sensing","RemoteCLIP is proposed, the first vision-language foundation model for remote sensing that aims to learn robust visual features with rich semantics, as well as aligned text embeddings for seamless downstream application and consistently outperforms baseline foundation models across different model scales.","arXiv.org",2023,"F. Liu,Delong Chen,Zhan-Rong Guan,Xiaocong Zhou,Jiale Zhu,Jun Zhou",1,103,0
"9a22b33b529484c912d1ea9f8698369d4546a1c1","https://www.semanticscholar.org/paper/9a22b33b529484c912d1ea9f8698369d4546a1c1",3,"Transfer Visual Prompt Generator across LLMs","This work investigates the VPG transferability across LLMs, and designs a two-stage transfer framework named VPGTrans, which is simple yet highly effective and demonstrated to significantly speed up the transfer learning process without compromising performance.","arXiv.org",2023,"Ao Zhang,Hao Fei,Yuan Yao,Wei Ji,Li Li,Zhiyuan Liu,Tat-Seng Chua",6,34,2
"d886fc1b43b1c14b1c82ce8e4eab7c48e2c6d7af","https://www.semanticscholar.org/paper/d886fc1b43b1c14b1c82ce8e4eab7c48e2c6d7af",3,"Paxion: Patching Action Knowledge in Video-Language Foundation Models","This work proposes a novel framework, Paxion, along with a new Discriminative Video Dynamics Modeling (DVDM) objective, which effectively fills the gap in action knowledge understanding, while maintaining or improving performance on a wide spectrum of both object- and action-centric downstream tasks.","arXiv.org",2023,"Zhenhailong Wang,Ansel Blume,Sha Li,Genglin Liu,Jaemin Cho,Zineng Tang,Mohit Bansal,Heng Ji",1,62,0
"bfa9df38bd8597d8cdf0c3497fe5e5a5e31f646f","https://www.semanticscholar.org/paper/bfa9df38bd8597d8cdf0c3497fe5e5a5e31f646f",3,"ONE-PEACE: Exploring One General Representation Model Toward Unlimited Modalities","This work releases ONE-PEACE, a highly extensible model with 4B parameters that can seamlessly align and integrate representations across vision, audio, and language modalities, and develops two modality-agnostic pretraining tasks, which align the semantic space of different modalities and capture fine-grained details within modalities concurrently.","arXiv.org",2023,"Peng Wang,Shijie Wang,Junyang Lin,Shuai Bai,Xiaohuan Zhou,Jingren Zhou,Xinggang Wang,Chang Zhou",4,169,1
"6fe2a4f7594abadafc9feb05e96ab7e9e634ce8f","https://www.semanticscholar.org/paper/6fe2a4f7594abadafc9feb05e96ab7e9e634ce8f",3,"Album Storytelling with Iterative Story-aware Captioning and Large Language Models","This work proposes a new iterative album storytelling pipeline, which starts with an initial story and builds a story-aware caption model to refine the captions using the whole story as guidance, then feeds into the LLMs to generate a new refined story.","arXiv.org",2023,"Munan Ning,Yujia Xie,Dongdong Chen,Zeyin Song,Lu Yuan,Yonghong Tian,Qixiang Ye,Liuliang Yuan",0,57,0
"065dcc6074ffc9e314799d97c1757e5d23e7e2b1","https://www.semanticscholar.org/paper/065dcc6074ffc9e314799d97c1757e5d23e7e2b1",3,"S-CLIP: Semi-supervised Vision-Language Pre-training using Few Specialist Captions","S-CLIP is proposed, a semi-supervised learning method for training CLIP that utilizes additional unpaired images and employs two pseudo-labeling strategies specifically designed for contrastive learning and the language modality.","arXiv.org",2023,"Sangwoo Mo,Min-Kyung Kim,Kyungmin Lee,Jinwoo Shin",0,100,0
"f45a3474bd38d65c1b2cc3342a64dacbf07f445a","https://www.semanticscholar.org/paper/f45a3474bd38d65c1b2cc3342a64dacbf07f445a",3,"Cream: Visually-Situated Natural Language Understanding with Contrastive Reading Model and Frozen Large Language Models","The Contrastive Reading Model (Cream) is proposed, a novel neural architecture designed to enhance the language-image understanding capability of LLMs by capturing intricate details typically overlooked by existing methods.","arXiv.org",2023,"Geewook Kim,Hodong Lee,Daehee Kim,Haeji Jung,S. Park,Yoon Kim,Sangdoo Yun,T. Kil,Bado Lee,Seunghyun Park",1,63,0
"0983883619a0ca597d055d0e58da2f514052913d","https://www.semanticscholar.org/paper/0983883619a0ca597d055d0e58da2f514052913d",3,"Macaw-LLM: Multi-Modal Language Modeling with Image, Audio, Video, and Text Integration","This work proposes Macaw-LLM, a novel multi-modal LLM that seamlessly integrates visual, audio, and textual information and builds on the work of previous work on instruction-tuned large language models to handle diverse data modalities and address complex real-world scenarios.","arXiv.org",2023,"Chenyang Lyu,Minghao Wu,Longyue Wang,Xinting Huang,Bingshuai Liu,Zefeng Du,Shuming Shi,Zhaopeng Tu",3,53,1
"8efc20988021ce3b4b05dd44b13e27260ee9b99b","https://www.semanticscholar.org/paper/8efc20988021ce3b4b05dd44b13e27260ee9b99b",3,"Investigating Prompting Techniques for Zero- and Few-Shot Visual Question Answering","It is demonstrated that carefully designed question templates and the integration of additional visual cues, like image captions, can contribute to improved VQA performance, especially when used in conjunction with few-shot examples, however, a limitation in the use of chain-of-thought rationalization is identified, which negatively affects V QA accuracy.","arXiv.org",2023,"Rabiul Awal,Le Zhang,Aishwarya Agrawal",0,42,0
"94053805cd59f2e9a47fe3f080c7e7afefb337cc","https://www.semanticscholar.org/paper/94053805cd59f2e9a47fe3f080c7e7afefb337cc",3,"Generative Pretraining in Multimodality","Emu, a Transformer-based multimodal foundation model, is presented, which can seamlessly generate images and texts in multi-modality context through a one-model-for-all autoregressive training process and demonstrates superb performance compared to state-of-the-art large multimodAL models.","",2023,"Quan Sun,Qiying Yu,Yufeng Cui,Fan Zhang,Xiaosong Zhang,Yueze Wang,Hongcheng Gao,Jingjing Liu,Tiejun Huang,Xinlong Wang",1,74,0
"d58b89b64a0565e77d9b9734d871c58e4a7af6d8","https://www.semanticscholar.org/paper/d58b89b64a0565e77d9b9734d871c58e4a7af6d8",3,"mBLIP: Efficient Bootstrapping of Multilingual Vision-LLMs",,"",2023,"Gregor Geigle,Abhay Jain,R. Timofte,Goran Glavavs",0,68,0
"cb5f53cd7d43ac6f48abf4dde6fc58e53a083b0e","https://www.semanticscholar.org/paper/cb5f53cd7d43ac6f48abf4dde6fc58e53a083b0e",3,"Accelerating the integration of ChatGPT and other large‐scale AI models into biomedical research and healthcare","","MedComm – Future Medicine",2023,"Ding‐Qiao Wang,Long‐Yu Feng,Jin‐Guo Ye,Jin‐Gen Zou,Yingfeng Zheng",6,99,0
"e9480d62e216f77d5556b7eda769daa4c92d004d","https://www.semanticscholar.org/paper/e9480d62e216f77d5556b7eda769daa4c92d004d",3,"VQAMix: Conditional Triplet Mixup for Medical Visual Question Answering","This paper proposes a simple yet effective data augmentation method, VQAMix, which generates more labeled training samples by linearly combining a pair of VQA samples, which can be easily embedded into any visual-language model to boost performance.","IEEE Transactions on Medical Imaging",2022,"Haifan Gong,Guanqi Chen,Mingzhi Mao,Z. Li,Guanbin Li",9,55,3
"f7ea746cd2cc25628a7a553ac27d228198be42cb","https://www.semanticscholar.org/paper/f7ea746cd2cc25628a7a553ac27d228198be42cb",3,"Pre-trained multilevel fuse network based on vision-conditioned reasoning and bilinear attentions for medical image visual question answering","This paper proposes a new pre-trained multilevel fusion network based on Vision-conditioned reasoning and Bilinear attentions for Med-VQA (VB-MVZA), which achieves more significant accuracy than the baseline models for open-ended questions and more powerful for language-bias Med- VQA datasets.","Journal of Supercomputing",2023,"Linqin Cai,Haodu Fang,Zhiqing Li",0,47,0
"ac4d13b6a4f9fb67337099f4602135a0351f5c99","https://www.semanticscholar.org/paper/ac4d13b6a4f9fb67337099f4602135a0351f5c99",3,"Towards Medical Artificial General Intelligence via Knowledge-Enhanced Multimodal Pretraining","The proposed MOTOR successfully mimics the human practice of fulfilling a""medical student"" to accelerate the process of becoming a""specialist"" and believes that this work makes a significant stride in realizing MAGI.","arXiv.org",2023,"Bingqian Lin,Zicong Chen,Mingjie Li,Haokun Lin,Hang Xu,Yi Zhu,Jian-zhuo Liu,Wenjia Cai,Lei Yang,Shen Zhao,Chenfei Wu,Ling Chen,Xiaojun Chang,Yi Yang,L. Xing,Xiaodan Liang",0,60,0
"238c33aa23774562cb45918c4917565f1b725044","https://www.semanticscholar.org/paper/238c33aa23774562cb45918c4917565f1b725044",3,"Multi-modal Pre-training for Medical Vision-language Understanding and Generation: An Empirical Study with A New Benchmark","RadioGraphy Captions (RGC), a high-quality, multi-modality radiographic dataset containing 18,434 image-caption pairs collected from an open-access online database MedPix, is proposed, which can be used as a pre-training dataset or a new benchmark for medical report generation and medical image-text retrieval.","arXiv.org",2023,"Li Xu,Bo Liu,Ameer Hamza Khan,Lu Fan,Xiao-Ming Wu",0,62,0
"e0e9ba0c01d441e1fdcb8628d3f743d387b0b017","https://www.semanticscholar.org/paper/e0e9ba0c01d441e1fdcb8628d3f743d387b0b017",3,"UIT-Saviors at MEDVQA-GI 2023: Improving Multimodal Learning with Image Enhancement for Gastrointestinal Visual Question Answering","This study highlights the dominance of Transformer-based vision models over the CNNs and demonstrates the effectiveness of the image enhancement process, with six out of the eight vision models achieving better F1-Score.","arXiv.org",2023,"T. M. Thai,A. T. Vo,Hao K. Tieu,Linh P Bui,Thien T.B. Nguyen",0,38,0
"0f8d12775a4685575f1489796b5dee9e11fbdfb5","https://www.semanticscholar.org/paper/0f8d12775a4685575f1489796b5dee9e11fbdfb5",2,"OphGLM: Training an Ophthalmology Large Language-and-Vision Assistant based on Instructions and Dialogue","This paper establishes a new ophthalmic multimodal instruction-following and dialogue fine-tuning dataset based on disease-related knowledge data and publicly available real-world medical dialogue, and introduces visual ability into the large language model to complete the OphGLM.","arXiv.org",2023,"Weihao Gao,Zhuo Deng,Zhiyuan Niu,Fuju Rong,Chucheng Chen,Zheng Gong,Wenze Zhang,Daimin Xiao,Fangjun Li,Zhenjie Cao,Zhaoyi Ma,Wenbin Wei,Lan Ma",1,25,0
"b595b55ed27935d306b0a5e0b06a3b0a771275b1","https://www.semanticscholar.org/paper/b595b55ed27935d306b0a5e0b06a3b0a771275b1",2,"SheetCopilot: Bringing Software Productivity to the Next Level through Large Language Models","This work proposes a SheetCopilot agent which takes natural language task and control spreadsheet to fulfill the requirements, and proposes a set of atomic actions as an abstraction of spreadsheet software functionalities.","arXiv.org",2023,"Hongxin Li,Jingran Su,Yuntao Chen,Qing Li,Zhaoxiang Zhang",2,75,1
"53df959bcf6499c45e316086a96a624389a39a52","https://www.semanticscholar.org/paper/53df959bcf6499c45e316086a96a624389a39a52",2,"Accountable Textual-Visual Chat Learns to Reject Human Instructions in Image Re-creation","This paper constructs two new multimodal datasets and proposes a two-state training procedure to train the image auto-encoder and auto-regressive transformer from scratch, and provides comprehensive analyses of experimental results in terms of re-created image quality, answer accuracy, and the model behavior when faced with uncertainty and imperfect user queries.","",2023,"Zhiwei Zhang,Yuliang Liu",0,122,0
"ac7771c332da42b29a913b116bd6ef622cbf89cf","https://www.semanticscholar.org/paper/ac7771c332da42b29a913b116bd6ef622cbf89cf",2,"TaskMatrix.AI: Completing Tasks by Connecting Foundation Models with Millions of APIs","The vision of how to build such an ecosystem is presented, each key component is explained, and study cases are used to illustrate both the feasibility of this vision and the main challenges the authors need to address next.","arXiv.org",2023,"Yaobo Liang,Chenfei Wu,Ting Song,Wenshan Wu,Yan Xia,Yu Liu,Yangyiwen Ou,Shuai Lu,Lei Ji,Shaoguang Mao,Yun Wang,Linjun Shou,Ming Gong,Nan Duan",40,27,3
"352420ee61a8da783ca7750170793613b18b8d9c","https://www.semanticscholar.org/paper/352420ee61a8da783ca7750170793613b18b8d9c",2,"Tool Learning with Foundation Models","A systematic investigation of tool learning is presented, including its cognitive origins, the paradigm shift of foundation models, and the complementary roles of tools and models to inspire future research in integrating tools with foundation models.","arXiv.org",2023,"Yujia Qin,Shengding Hu,Yankai Lin,Weize Chen,Ning Ding,Ganqu Cui,Zheni Zeng,Yufei Huang,Chaojun Xiao,Chi Han,Y. Fung,Yusheng Su,Huadong Wang,Cheng Qian,Runchu Tian,Kunlun Zhu,Shi Liang,Xingyu Shen,Bokai Xu,Zhen Zhang,Yining Ye,Bo Li,Ziwei Tang,Jing Yi,Yu Zhu,Zhenning Dai,Lan Yan,Xin Cong,Ya-Ting Lu,Weilin Zhao,Yuxiang Huang,Jun-Han Yan,Xu Han,Xian Sun,Dahai Li,Jason Phang,Cheng Yang,Tongshuang Wu,Heng Ji,Zhiyuan Liu,Maosong Sun",18,238,3
"2195676f111ad492c50f4d4c96abb2bd3d72f7fc","https://www.semanticscholar.org/paper/2195676f111ad492c50f4d4c96abb2bd3d72f7fc",2,"Instruct2Act: Mapping Multi-modality Instructions to Robotic Actions with Large Language Model","This paper presents Instruct2Act, a framework that utilizes Large Language Models to map multi-modal instructions to sequential actions for robotic manipulation tasks, employing the LLM model to generate Python programs that constitute a comprehensive perception, planning, and action loop for robotic tasks.","arXiv.org",2023,"Siyuan Huang,Zhengkai Jiang,Hao-Wen Dong,Y. Qiao,Peng Gao,Hongsheng Li",2,45,1
"13a5140fc0b269c408ecfc666cb297410bc753c5","https://www.semanticscholar.org/paper/13a5140fc0b269c408ecfc666cb297410bc753c5",2,"Matcher: Segment Anything with One Shot Using All-Purpose Feature Matching","This work presents Matcher, which segments anything with one shot by integrating an all-purpose feature extraction model and a class-agnostic segmentation model, and proposes a novel instance-level matching strategy for controllable mask merging.","arXiv.org",2023,"Yang Liu,Muzhi Zhu,Hengtao Li,Hao Chen,Xinlong Wang,Chunhua Shen",3,44,0
"90027ca7802645671a69b00b65e1fa94e6b63544","https://www.semanticscholar.org/paper/90027ca7802645671a69b00b65e1fa94e6b63544",2,"ReWOO: Decoupling Reasoning from Observations for Efficient Augmented Language Models","This study proposes a modular paradigm ReWOO (Reasoning WithOut Observation) that detaches the reasoning process from external observations, thus significantly reducing token consumption and demonstrating robustness under tool-failure scenarios.","arXiv.org",2023,"Binfeng Xu,Zhiyuan Peng,Bowen Lei,Subhabrata Mukherjee,Yuchen Liu,Dongkuan Xu",2,41,0
"ba704774f194938b04b1e2be40b1d111a4ca08e1","https://www.semanticscholar.org/paper/ba704774f194938b04b1e2be40b1d111a4ca08e1",2,"CREATOR: Disentangling Abstract and Concrete Reasonings of Large Language Models through Tool Creation",,"arXiv.org",2023,"Cheng Qian,Chi Han,Y. Fung,Yujia Qin,Zhiyuan Liu,Heng Ji",3,30,1
"615962d8969c8e0ffe43319689dce6c50cbf1f29","https://www.semanticscholar.org/paper/615962d8969c8e0ffe43319689dce6c50cbf1f29",2,"Responsible Task Automation: Empowering Large Language Models as Responsible Task Automators","This paper presents Responsible Task Automation (ResponsibleTA) as a fundamental framework to facilitate responsible collaboration between LLM-based coordinators and executors for task automation with three empowered capabilities: predicting the feasibility of the commands for executors, verifying the completeness of executors and enhancing the security.","arXiv.org",2023,"Zhizheng Zhang,Xiaoyi Zhang,Wenxuan Xie,Yan Lu",0,44,0
"ed9943d73eb42116fe33564b5065c78b5ca0b16e","https://www.semanticscholar.org/paper/ed9943d73eb42116fe33564b5065c78b5ca0b16e",2,"RestGPT: Connecting Large Language Models with Real-World Applications via RESTful APIs","This paper introduces RestGPT, which leverages LLMs to solve user requests by connecting with RESTful APIs and proposes a coarse-to-fine online planning mechanism to enhance the ability of planning and API selection.","arXiv.org",2023,"Yifan Song,Weimin Xiong,D. Zhu,Chengzu Li,Ke Wang,Ye Tian,Sujian Li",0,18,0
"473eb062612a17c965eaa62136322f0dec6b1f8e","https://www.semanticscholar.org/paper/473eb062612a17c965eaa62136322f0dec6b1f8e",2,"Data-Copilot: Bridging Billions of Data and Humans with Autonomous Workflow","This work proposes Data-Copilot, an LLM-based system that connects numerous data sources on one end and caters to diverse human demands on the other end, and autonomously transforms raw data into visualization results that best match the user's intent.","arXiv.org",2023,"Wenqi Zhang,Yongliang Shen,Weiming Lu,Y. Zhuang",1,31,1
"9dbb39eccbcd31b8f6b4ff0a2c96f61a7c34e54b","https://www.semanticscholar.org/paper/9dbb39eccbcd31b8f6b4ff0a2c96f61a7c34e54b",2,"RM-PRT: Realistic Robotic Manipulation Simulator and Benchmark with Progressive Reasoning Tasks","A realistic robotic manipulation simulator is introduced and a Robotic Manipulation with Progressive Reasoning Tasks (RM-PRT) benchmark is built on this basis, which evaluates the robot's ability to understand natural language instructions in two modes of adsorption and grasping.","arXiv.org",2023,"Pengzhen Ren,Kaiwen Zhang,Hetao Zheng,Zixuan Li,Yuhang Wen,Fengda Zhu,Mas Ma,Xiaodan Liang",0,52,0
"7562e25b666cba841b1dd5cf6e700978922beb04","https://www.semanticscholar.org/paper/7562e25b666cba841b1dd5cf6e700978922beb04",2,"SkinGPT: A Dermatology Diagnostic System with Vision Large Language Model","The ability to deploy it locally and protect user privacy makes SkinGPT an attractive option for patients seeking an accurate and reliable diagnosis of their skin conditions and the system can autonomously determine the characteristics and categories of skin conditions, perform analysis, and provide treatment recommendations.","arXiv.org",2023,"Juexiao Zhou,Xin Gao",1,35,1
"30c0cdc414f68211d5d0514df027cec22e005174","https://www.semanticscholar.org/paper/30c0cdc414f68211d5d0514df027cec22e005174",2,"A Survey for In-context Learning","This paper presents a formal definition of ICL and clarify its correlation to related studies, and organizes and discusses advanced techniques, including training strategies, demonstration designing strategies, as well as related analysis.","arXiv.org",2022,"Qingxiu Dong,Lei Li,Damai Dai,Ce Zheng,Zhiyong Wu,Baobao Chang,Xu Sun,Jingjing Xu,Zhifang Sui",2,125,0
"27d0d2923a42bd2bced1b100844e232ff87368e3","https://www.semanticscholar.org/paper/27d0d2923a42bd2bced1b100844e232ff87368e3",2,"SkinGPT-4: An Interactive Dermatology Diagnostic System with Visual Large Language Model","Though SkinGPT-4 is not a substitute for doctors, it could enhance users' comprehension of their medical conditions, facilitate improve communication between patients and doctors, expedite the diagnostic process for dermatologists, and potentially promote human-centred care and healthcare equity in underdeveloped areas.","medRxiv",2023,"Juexiao Zhou,Xiao-Zhen He,Liyuan Sun,Jian-Hui Xu,Xiuying Chen,Yuetan Chu,Longxi Zhou,Xingyu Liao,Bin Zhang,Xin Gao",1,68,0
"c56a51728678e5b2e3ff95e51caf21d267439c36","https://www.semanticscholar.org/paper/c56a51728678e5b2e3ff95e51caf21d267439c36",2,"ChatVideo: A Tracklet-centric Multimodal and Versatile Video Understanding System","The vision for multimodal and versatile video understanding is presented and a prototype system, built upon a tracklet-centric paradigm, which treats tracklets as the basic video unit and employs various Video Foundation Models to annotate their properties e.g., appearance, motion, etc.","arXiv.org",2023,"Junke Wang,Dongdong Chen,Chong Luo,Xiyang Dai,Lu Yuan,Zuxuan Wu,Yu-Gang Jiang",2,43,0
"6f8b9192b1f215254ee7625d752710182c05d2f9","https://www.semanticscholar.org/paper/6f8b9192b1f215254ee7625d752710182c05d2f9",2,"Caption Anything: Interactive Image Description with Diverse Multimodal Controls","Caption AnyThing (CAT) is presented, a foundation model augmented image captioning framework supporting a wide range of multimodel controls: 1) visual controls, including points, boxes, and trajectories; 2) language controls, such as sentiment, length, language, and factuality.","arXiv.org",2023,"Teng Wang,Jinrui Zhang,Junjie Fei,Yixiao Ge,Hao Zheng,Yun-Qiu Tang,Zhe Li,Mingqi Gao,Shanshan Zhao,Ying Shan,Feng Zheng",6,48,2
"80c44fab16852ea9599411da14de7079c4514172","https://www.semanticscholar.org/paper/80c44fab16852ea9599411da14de7079c4514172",2,"Vision-Language Models in Remote Sensing: Current Progress and Future Trends","A comprehensive review of the research on vision-language models in remote sensing, summarizing the latest progress, highlighting the current challenges, and identifying potential research opportunities is provided.","arXiv.org",2023,"Congcong Wen,Yuan Hu,Xiang Li,Zhenghang Yuan,Xiao Xiang Zhu",1,195,0
